date,title,publisher
2018-07-17 07:00:00+00:00,Walmart Partners With Microsoft To Battle Amazon - U.S News & World Report Money,"{'href': 'https://money.usnews.com', 'title': 'U.S News & World Report Money'}"
2018-07-17 07:00:00+00:00,Walmart and Microsoft link up on cloud technology as they both battle Amazon - CNBC,"{'href': 'https://www.cnbc.com', 'title': 'CNBC'}"
2018-07-18 07:00:00+00:00,How Satya Nadella tripled Microsoft's stock price in just over four years - CNBC,"{'href': 'https://www.cnbc.com', 'title': 'CNBC'}"
2018-07-30 07:00:00+00:00,An open letter to Microsoft management re: Windows updating - Computerworld,"{'href': 'https://www.computerworld.com', 'title': 'Computerworld'}"
2018-07-24 07:00:00+00:00,Xbox Scarlett: Can Microsoft Finally Make Streaming Video Games The Norm? - Forbes,"{'href': 'https://www.forbes.com', 'title': 'Forbes'}"
2018-07-19 07:00:00+00:00,"Microsoft Hits $10 Billion in Annual Gaming Revenue, so What's Next? - Business Insider","{'href': 'https://www.businessinsider.com', 'title': 'Business Insider'}"
2018-07-20 07:00:00+00:00,"Google, Facebook, Microsoft, and Twitter partner for ambitious new ... - The Verge","{'href': 'https://www.theverge.com', 'title': 'The Verge'}"
2018-07-17 07:00:00+00:00,Microsoft Corporation Earnings Preview: What to Expect from MSFT ... - U.S News & World Report Money,"{'href': 'https://money.usnews.com', 'title': 'U.S News & World Report Money'}"
2018-07-16 07:00:00+00:00,Microsoft president: Jobs might move abroad following immigration ... - CIO Dive,"{'href': 'https://www.ciodive.com', 'title': 'CIO Dive'}"
2018-07-15 07:00:00+00:00,Microsoft raises alarms about face recognition - USA TODAY,"{'href': 'https://www.usatoday.com', 'title': 'USA TODAY'}"
2018-07-25 07:00:00+00:00,Microsoft's Xbox Adaptive Controller also has accessible packaging - VentureBeat,"{'href': 'https://venturebeat.com', 'title': 'VentureBeat'}"
2018-07-26 07:00:00+00:00,Microsoft Employees Question C.E.O. Over Company's Contract ... - The New York Times,"{'href': 'https://www.nytimes.com', 'title': 'The New York Times'}"
2018-07-30 07:00:00+00:00,Microsoft Boosts Game Pass on the Xbox One Dashboard ... - Thurrott.com,"{'href': 'https://www.thurrott.com', 'title': 'Thurrott.com'}"
2018-07-16 07:00:00+00:00,Can Skype win you back? Microsoft unveils overhaul after backlash ... - GeekWire,"{'href': 'https://www.geekwire.com', 'title': 'GeekWire'}"
2018-07-18 07:00:00+00:00,"Microsoft’s Identity Bug Bounty program pays up to $100,000 - CSO Online","{'href': 'https://www.csoonline.com', 'title': 'CSO Online'}"
2018-07-27 07:00:00+00:00,Slack Buys Hipchat To Take On Microsoft Teams: What It Means - Forbes,"{'href': 'https://www.forbes.com', 'title': 'Forbes'}"
2018-07-25 07:00:00+00:00,AI-powered robotic hand takes top prize at Microsoft Imagine Cup ... - GeekWire,"{'href': 'https://www.geekwire.com', 'title': 'GeekWire'}"
2018-07-23 07:00:00+00:00,Microsoft Opens Skip Ahead Ring for Windows 10 Redstone 6 ... - BleepingComputer,"{'href': 'https://www.bleepingcomputer.com', 'title': 'BleepingComputer'}"
2018-07-17 07:00:00+00:00,Microsoft To-Do for Windows 10 now lets you mark tasks as 'Important' - Windows Central,"{'href': 'https://www.windowscentral.com', 'title': 'Windows Central'}"
2018-07-27 07:00:00+00:00,Microsoft employees question CEO over company's contract with ICE - CNBC,"{'href': 'https://www.cnbc.com', 'title': 'CNBC'}"
2018-07-25 07:00:00+00:00,Microsoft's Outlook.com dark mode is now live - The Verge,"{'href': 'https://www.theverge.com', 'title': 'The Verge'}"
2018-07-26 07:00:00+00:00,"National FFA Organization, Microsoft announce initiative - Wisconsin State Farmer","{'href': 'https://www.wisfarmer.com', 'title': 'Wisconsin State Farmer'}"
2018-07-26 07:00:00+00:00,Microsoft's VC Arm Launches Contest to Fund Female Founders - Business Insider,"{'href': 'https://www.businessinsider.com', 'title': 'Business Insider'}"
2018-07-26 07:00:00+00:00,Hendrick Motorsports renew Microsoft cloud deal - SportsPro - SportsPro Media,"{'href': 'https://www.sportspromedia.com', 'title': 'SportsPro Media'}"
2018-07-16 07:00:00+00:00,Microsoft’s sales overhaul a year ago has led to all-time high stock price and continuing cloud growth - CNBC,"{'href': 'https://www.cnbc.com', 'title': 'CNBC'}"
2018-07-29 07:00:00+00:00,"There's a very good reason why Microsoft has an original Apple Macintosh on display in its headquarters (MSFT, AAPL) - Yahoo Finance","{'href': 'https://finance.yahoo.com', 'title': 'Yahoo Finance'}"
2018-07-22 07:00:00+00:00,Amy Hood won back Wall Street and helped reboot Microsoft - The Seattle Times,"{'href': 'https://www.seattletimes.com', 'title': 'The Seattle Times'}"
2018-07-22 07:00:00+00:00,Unknown Dev Brings LibreOffice to Windows 10 via the Microsoft Store - BleepingComputer,"{'href': 'https://www.bleepingcomputer.com', 'title': 'BleepingComputer'}"
2018-07-17 07:00:00+00:00,Microsoft is making the Windows command line a lot better - Ars Technica,"{'href': 'https://arstechnica.com', 'title': 'Ars Technica'}"
2018-07-23 07:00:00+00:00,Costco's Surface Go bundle offers a better low-end option than ... - PCWorld,"{'href': 'https://www.pcworld.com', 'title': 'PCWorld'}"
2018-07-30 07:00:00+00:00,Smile! Use Your Face To Log Into Websites Using Microsoft Edge - Digital Trends,"{'href': 'https://www.digitaltrends.com', 'title': 'Digital Trends'}"
2018-07-23 07:00:00+00:00,"Facebook, Google, Microsoft and Twitter make leaving easier - Naked Security","{'href': 'https://nakedsecurity.sophos.com', 'title': 'Naked Security'}"
2018-07-21 07:00:00+00:00,How Satya Nadella changed working culture of Microsoft - Bringing ... - Economic Times,"{'href': 'https://economictimes.indiatimes.com', 'title': 'Economic Times'}"
2018-07-18 07:00:00+00:00,Microsoft owns publishing rights to Alan Wake and Quantum Break ... - MSPoweruser,"{'href': 'https://mspoweruser.com', 'title': 'MSPoweruser'}"
2018-07-16 07:00:00+00:00,Panos Panay promise new form-factors but no Surface Phone in the ... - MSPoweruser,"{'href': 'https://mspoweruser.com', 'title': 'MSPoweruser'}"
2018-07-26 07:00:00+00:00,Microsoft is finally fixing the most annoying thing about Windows ... - MSPoweruser,"{'href': 'https://mspoweruser.com', 'title': 'MSPoweruser'}"
2018-07-17 07:00:00+00:00,Microsoft is killing off Skype classic and bringing call recording to ... - BetaNews,"{'href': 'https://betanews.com', 'title': 'BetaNews'}"
2018-07-20 07:00:00+00:00,Microsoft Store on Windows 10 updated with new interface and remote app installs - WindowsLatest,"{'href': 'https://www.windowslatest.com', 'title': 'WindowsLatest'}"
2018-07-17 07:00:00+00:00,Hive Streaming Will Integrate with New Microsoft 365 Live Event ... - Business Wire,"{'href': 'https://www.businesswire.com', 'title': 'Business Wire'}"
2018-07-17 07:00:00+00:00,"NVIDIA, Oculus, Valve, AMD, and Microsoft Collaborate on ... - PC Perspective","{'href': 'https://pcper.com', 'title': 'PC Perspective'}"
2018-07-16 07:00:00+00:00,A Microsoft-branded Android phone could be on the way - TechRadar,"{'href': 'https://www.techradar.com', 'title': 'TechRadar'}"
2018-07-18 07:00:00+00:00,Microsoft lures Windows 2008 users to cloud through extra support ... - Reseller News,"{'href': 'https://www.reseller.co.nz', 'title': 'Reseller News'}"
2018-07-22 07:00:00+00:00,Microsoft Surface Book 2 Review (15-Inch): A Worthy Challenger To The MacBook Pro - Forbes,"{'href': 'https://www.forbes.com', 'title': 'Forbes'}"
2018-07-26 07:00:00+00:00,"I tested Gboard against SwiftKey, and the winner surprised me - Business Insider","{'href': 'https://www.businessinsider.com', 'title': 'Business Insider'}"
2018-07-16 07:00:00+00:00,A Top Slack Exec Explains the Secret Weapon to Fight Off Microsoft ... - Business Insider,"{'href': 'https://www.businessinsider.com', 'title': 'Business Insider'}"
2018-07-16 07:00:00+00:00,Microsoft CHRO: A Conversation About Succession Management - Gallup,"{'href': 'https://www.gallup.com', 'title': 'Gallup'}"
2018-07-30 07:00:00+00:00,"Microsoft treehouses: Photos, tour, what it's like - Business Insider","{'href': 'https://www.businessinsider.com', 'title': 'Business Insider'}"
2018-07-25 07:00:00+00:00,"Where is Apple's innovative iPad, MacBook Pro hardware to rival Microsoft's Surface? - AppleInsider","{'href': 'https://appleinsider.com', 'title': 'AppleInsider'}"
2018-07-27 07:00:00+00:00,"How Steve Ballmer went from making $50,000 a year as an assistant at Microsoft to becoming a billionaire - CNBC","{'href': 'https://www.cnbc.com', 'title': 'CNBC'}"
2018-07-19 07:00:00+00:00,Microsoft announces new updates coming to OneDrive desktop client - MSPoweruser,"{'href': 'https://mspoweruser.com', 'title': 'MSPoweruser'}"
2018-07-17 07:00:00+00:00,Report: Facebook Could Be Ditching Office 365 for Google's G Suite - Thurrott.com,"{'href': 'https://www.thurrott.com', 'title': 'Thurrott.com'}"
2018-07-27 07:00:00+00:00,Microsoft Edge rolls out intelligent visual search for iPhone and iPad - Windows Central,"{'href': 'https://www.windowscentral.com', 'title': 'Windows Central'}"
2018-07-26 07:00:00+00:00,Microsoft Discovers Supply Chain Attack at Unnamed Maker of PDF ... - BleepingComputer,"{'href': 'https://www.bleepingcomputer.com', 'title': 'BleepingComputer'}"
2018-07-17 07:00:00+00:00,Getting back to nature with AI: Why Microsoft and National ... - Microsoft,"{'href': 'https://blogs.microsoft.com', 'title': 'Microsoft'}"
2018-07-21 07:00:00+00:00,Microsoft Edge's XSS Filter Appears to Be Broken - BleepingComputer,"{'href': 'https://www.bleepingcomputer.com', 'title': 'BleepingComputer'}"
2018-07-18 07:00:00+00:00,"Microsoft's focus on cloud, partnerships paying off - Reuters","{'href': 'https://www.reuters.com', 'title': 'Reuters'}"
2018-07-27 07:00:00+00:00,How can US state governments help ensure a secure digital society ... - Microsoft,"{'href': 'https://blogs.microsoft.com', 'title': 'Microsoft'}"
2018-07-15 07:00:00+00:00,Microsoft Android smartphones releasing soon? - gizmochina,"{'href': 'https://www.gizmochina.com', 'title': 'gizmochina'}"
2018-07-27 07:00:00+00:00,Microsoft plans to do away with intrusive Windows 10 updates ... - KitGuru,"{'href': 'https://www.kitguru.net', 'title': 'KitGuru'}"
2018-07-29 07:00:00+00:00,Microsoft boosts Office 2019 price by 10% - Computerworld,"{'href': 'https://www.computerworld.com', 'title': 'Computerworld'}"
2018-07-15 07:00:00+00:00,Velosio to Introduce Partner Enablement Program for Microsoft ... - PR Web,"{'href': 'https://www.prweb.com', 'title': 'PR Web'}"
2018-07-18 07:00:00+00:00,Google’s European fine is a flashback to Microsoft’s ugly antitrust ... - The Verge,"{'href': 'https://www.theverge.com', 'title': 'The Verge'}"
2018-07-17 07:00:00+00:00,Missouri S&T – News and Events – Landing a job at Microsoft - Missouri S&T News and Research,"{'href': 'https://news.mst.edu', 'title': 'Missouri S&T News and Research'}"
2018-07-27 07:00:00+00:00,Microsoft's July 10 Windows Patches Also Caused SQL Server ... - Redmondmag.com,"{'href': 'https://redmondmag.com', 'title': 'Redmondmag.com'}"
2018-07-25 07:00:00+00:00,"Amazon expands in Cape Town, stepping up cloud rivalry with ... - The Globe and Mail","{'href': 'https://www.theglobeandmail.com', 'title': 'The Globe and Mail'}"
2018-07-28 07:00:00+00:00,"Check out Bill Gates' first business card at Microsoft, from after he dropped out of Harvard (MSFT) - Yahoo Finance","{'href': 'https://finance.yahoo.com', 'title': 'Yahoo Finance'}"
2018-07-27 07:00:00+00:00,Intel shares slip on fears of AMD data center chip challenge - Reuters,"{'href': 'https://www.reuters.com', 'title': 'Reuters'}"
2018-07-19 07:00:00+00:00,Microsoft Launcher Beta for Android Updated With New Features ... - BleepingComputer,"{'href': 'https://www.bleepingcomputer.com', 'title': 'BleepingComputer'}"
2018-07-19 07:00:00+00:00,"Steve Ballmer says he and Bill Gates recommended Nadella as Microsoft CEO, praises his performance - CNBC","{'href': 'https://www.cnbc.com', 'title': 'CNBC'}"
2018-07-25 07:00:00+00:00,Microsoft Announces Availability of SharePoint Server 2019 Preview - WinCentral,"{'href': 'https://thewincentral.com', 'title': 'WinCentral'}"
2018-07-29 07:00:00+00:00,New Microsoft patent covers video streaming on a multi-screen device - PhoneArena,"{'href': 'https://www.phonearena.com', 'title': 'PhoneArena'}"
2018-07-25 07:00:00+00:00,Westcon-Comstor on-boarded as tier-2 Microsoft CSP in Philippines - Channel Asia Singapore,"{'href': 'https://channelasia.tech', 'title': 'Channel Asia Singapore'}"
2018-07-20 07:00:00+00:00,Microsoft creates interactive talking mirror for H&M in New York - MSPoweruser,"{'href': 'https://mspoweruser.com', 'title': 'MSPoweruser'}"
2018-07-18 07:00:00+00:00,How to download offline copies of Windows 10 apps from the ... - BetaNews,"{'href': 'https://betanews.com', 'title': 'BetaNews'}"
2018-07-16 07:00:00+00:00,How Remedy is taking Control of its own destiny - GamesIndustry.biz,"{'href': 'https://www.gamesindustry.biz', 'title': 'GamesIndustry.biz'}"
2018-07-18 07:00:00+00:00,Remedy: Microsoft doesn't want to make Quantum Break or Alan ... - Windows Central,"{'href': 'https://www.windowscentral.com', 'title': 'Windows Central'}"
2018-07-30 07:00:00+00:00,Microsoft announces TypeScript 3.0 with a new scalable way to ... - MSPoweruser,"{'href': 'https://mspoweruser.com', 'title': 'MSPoweruser'}"
2018-07-30 07:00:00+00:00,Google Takes Potshots at Microsoft and Apple With New Chromebook Ad - Wccftech,"{'href': 'https://wccftech.com', 'title': 'Wccftech'}"
2018-07-18 07:00:00+00:00,General Electric And Microsoft: A Match Made In Heaven (NYSE:GE) - Seeking Alpha,"{'href': 'https://seekingalpha.com', 'title': 'Seeking Alpha'}"
2018-07-26 07:00:00+00:00,Microsoft Surface Laptop and Surface Pro 4 Getting New Firmware ... - BleepingComputer,"{'href': 'https://www.bleepingcomputer.com', 'title': 'BleepingComputer'}"
2018-07-26 07:00:00+00:00,What is internet? Relive the Microsoft v. Netscape browser war in ... - GeekWire,"{'href': 'https://www.geekwire.com', 'title': 'GeekWire'}"
2018-07-23 07:00:00+00:00,Microsoft finally releases Windows UI Library for Windows 10 UWP ... - MSPoweruser,"{'href': 'https://mspoweruser.com', 'title': 'MSPoweruser'}"
2018-07-19 07:00:00+00:00,Inspire 2018: Microsoft updates Dynamics 365 for Finance and ... - MSDynamicsWorld,"{'href': 'https://msdynamicsworld.com', 'title': 'MSDynamicsWorld'}"
2018-07-19 07:00:00+00:00,Microsoft announces new features for LinkedIn messaging - Neowin,"{'href': 'https://www.neowin.net', 'title': 'Neowin'}"
2018-07-27 07:00:00+00:00,The future is the new Xbox - The Week,"{'href': 'https://theweek.com', 'title': 'The Week'}"
2018-07-19 07:00:00+00:00,"Titletown District: Packers, Microsoft add UW support to ... - Green Bay Press Gazette","{'href': 'https://www.greenbaypressgazette.com', 'title': 'Green Bay Press Gazette'}"
2018-07-18 07:00:00+00:00,"Europe hits Google with record $5 billion antitrust fine, appeal ahead - Reuters","{'href': 'https://www.reuters.com', 'title': 'Reuters'}"
2018-07-30 07:00:00+00:00,Microsoft Azure grows market share in cloud services - MyBroadband,"{'href': 'https://mybroadband.co.za', 'title': 'MyBroadband'}"
2018-07-16 07:00:00+00:00,"Four years after it was announced, Crackdown 3 is in a tough spot - Eurogamer.net","{'href': 'https://www.eurogamer.net', 'title': 'Eurogamer.net'}"
2018-07-19 07:00:00+00:00,"TH Real Estate sells Millennium Corporate Park, home to Microsoft ... - The Business Journals","{'href': 'https://www.bizjournals.com', 'title': 'The Business Journals'}"
2018-07-17 07:00:00+00:00,Microsoft Teams now allows you to send code snippets in a message - MSPoweruser,"{'href': 'https://mspoweruser.com', 'title': 'MSPoweruser'}"
2018-07-30 07:00:00+00:00,Microsoft files patent application for eyeglasses that gauge blood ... - Healthcare IT News,"{'href': 'https://www.healthcareitnews.com', 'title': 'Healthcare IT News'}"
2018-07-30 07:00:00+00:00,"With DaaS Windows coming, say goodbye to your PC as you know it - Computerworld","{'href': 'https://www.computerworld.com', 'title': 'Computerworld'}"
2018-07-25 07:00:00+00:00,How to make YouTube five times faster if you don't use Chrome - The Verge,"{'href': 'https://www.theverge.com', 'title': 'The Verge'}"
2018-07-17 07:00:00+00:00,"Polycom goes ""all-in"" with support for Microsoft Teams - AV Magazine","{'href': 'https://www.avinteractive.com', 'title': 'AV Magazine'}"
2018-07-19 07:00:00+00:00,How Big Batteries at Data Centers Could Replace Power Plants - Scientific American,"{'href': 'https://www.scientificamerican.com', 'title': 'Scientific American'}"
2018-08-03 07:00:00+00:00,GRAPHIC-Race is on for second place after Apple's $1 trillion ... - Reuters,"{'href': 'https://www.reuters.com', 'title': 'Reuters'}"
2018-08-13 07:00:00+00:00,Microsoft Surface Go review: This shrunken-down Surface is fun and ... - CNET,"{'href': 'https://www.cnet.com', 'title': 'CNET'}"
2018-08-06 07:00:00+00:00,Microsoft Surface Go review: This affordable little Windows 10 S ... - PCWorld,"{'href': 'https://www.pcworld.com', 'title': 'PCWorld'}"
2018-08-02 07:00:00+00:00,Microsoft Surface Go review: A pint-size PC for getting work done - Yahoo Finance,"{'href': 'https://finance.yahoo.com', 'title': 'Yahoo Finance'}"
2018-08-03 07:00:00+00:00,New Starbucks partnership with Microsoft allows customers to pay for Frappuccinos with bitcoin - CNBC,"{'href': 'https://www.cnbc.com', 'title': 'CNBC'}"
2018-08-02 07:00:00+00:00,Microsoft Explains Windows 10 Monthly Patch Approach - Redmondmag.com,"{'href': 'https://redmondmag.com', 'title': 'Redmondmag.com'}"
2018-08-06 07:00:00+00:00,"Microsoft Surface Go Review: Portable, Purposeful, Not Powerful - Tom's Hardware","{'href': 'https://www.tomshardware.com', 'title': ""Tom's Hardware""}"
2018-08-06 07:00:00+00:00,"Microsoft Monday: Rumor About Monthly Windows Charges, Movies Anywhere Integration, Surface Go Info - Forbes","{'href': 'https://www.forbes.com', 'title': 'Forbes'}"
2018-08-11 07:00:00+00:00,Microsoft CEO Satya Nadella Sells $36 Million in Stock - Fortune,"{'href': 'https://fortune.com', 'title': 'Fortune'}"
2018-08-08 07:00:00+00:00,Meet the 15-year-old who's the Microsoft Excel world champion (which is a real thing) - CNN,"{'href': 'https://www.cnn.com', 'title': 'CNN'}"
2018-08-14 07:00:00+00:00,Microsoft's translucent Phantom Black Xbox controller is a ... - Circuit Breaker,"{'href': 'https://www.theverge.com', 'title': 'Circuit Breaker'}"
2018-08-07 07:00:00+00:00,Is Microsoft going to charge a monthly fee for Windows 10 ... - Komando,"{'href': 'https://www.komando.com', 'title': 'Komando'}"
2018-08-09 07:00:00+00:00,Microsoft's undersea data center now has a webcam with fish ... - The Verge,"{'href': 'https://www.theverge.com', 'title': 'The Verge'}"
2018-08-07 07:00:00+00:00,Movies Anywhere Expands To Include Microsoft Movies & TV Service - PR Newswire,"{'href': 'https://www.prnewswire.com', 'title': 'PR Newswire'}"
2018-08-05 07:00:00+00:00,"Amazon, Google and Microsoft are close to joining Apple in Wall ... - USA TODAY","{'href': 'https://www.usatoday.com', 'title': 'USA TODAY'}"
2018-08-03 07:00:00+00:00,"Microsoft is building out A.I., but here's what it thinks could go wrong - CNBC","{'href': 'https://www.cnbc.com', 'title': 'CNBC'}"
2020-06-27 21:32:17+00:00,JDA partners with Microsoft to drive digital supply chain ... - Supply Chain Digital,"{'href': 'https://supplychaindigital.com', 'title': 'Supply Chain Digital'}"
2018-08-14 07:00:00+00:00,Microsoft Store Tests New Shopping Cart Feature on Xbox and PC - Thurrott.com,"{'href': 'https://www.thurrott.com', 'title': 'Thurrott.com'}"
2018-08-12 07:00:00+00:00,Microsoft's Two Goals For The Surface Go - Forbes,"{'href': 'https://www.forbes.com', 'title': 'Forbes'}"
2018-08-14 07:00:00+00:00,Microsoft Releases Windows 10 Cumulative Updates KB4343909 ... - BleepingComputer,"{'href': 'https://www.bleepingcomputer.com', 'title': 'BleepingComputer'}"
2018-08-06 07:00:00+00:00,"August 6, 1997 — The day Apple and Microsoft made peace - AppleInsider","{'href': 'https://appleinsider.com', 'title': 'AppleInsider'}"
2018-08-06 07:00:00+00:00,"Apple, Amazon, Facebook, Google, Microsoft interview processes in detail - Business Insider","{'href': 'https://www.businessinsider.com', 'title': 'Business Insider'}"
2018-08-02 07:00:00+00:00,Microsoft Edge Flaw Lets Hackers Steal Local Files - BleepingComputer,"{'href': 'https://www.bleepingcomputer.com', 'title': 'BleepingComputer'}"
2018-08-07 07:00:00+00:00,"Microsoft used to be greedy and monopolistic, but things have ... - Reseller News","{'href': 'https://www.reseller.co.nz', 'title': 'Reseller News'}"
2018-08-14 07:00:00+00:00,"Microsoft and Nintendo Didn’t Want Yakuza, Now They Do - Game Revolution","{'href': 'https://www.gamerevolution.com', 'title': 'Game Revolution'}"
2018-08-10 07:00:00+00:00,Microsoft Releases Two New Windows 10 Insider Preview Builds - Thurrott.com,"{'href': 'https://www.thurrott.com', 'title': 'Thurrott.com'}"
2018-08-13 07:00:00+00:00,Microsoft touts Xbox gaming subscription service with new Sounders ... - GeekWire,"{'href': 'https://www.geekwire.com', 'title': 'GeekWire'}"
2018-08-08 07:00:00+00:00,Microsoft's New Ethereum Blockchain Product Gets Rid of Mining - CCN.com,"{'href': 'https://www.ccn.com', 'title': 'CCN.com'}"
2018-08-10 07:00:00+00:00,Microsoft is reportedly rolling out a software update to fix Surface Pen issues - Firstpost,"{'href': 'https://www.firstpost.com', 'title': 'Firstpost'}"
2018-08-08 07:00:00+00:00,Microsoft Launches New Spotify Add-In for Skype Insiders - BleepingComputer,"{'href': 'https://www.bleepingcomputer.com', 'title': 'BleepingComputer'}"
2018-08-03 07:00:00+00:00,Generator Permit Shows Microsoft Planning Quincy Data Center ... - Data Center Knowledge,"{'href': 'https://www.datacenterknowledge.com', 'title': 'Data Center Knowledge'}"
2018-08-01 07:00:00+00:00,Microsoft AccountGuard Service Offers Protection for Political and ... - BleepingComputer,"{'href': 'https://www.bleepingcomputer.com', 'title': 'BleepingComputer'}"
2018-08-13 07:00:00+00:00,Microsoft Planning New BizTalk Server Product and Integration with ... - Redmondmag.com,"{'href': 'https://redmondmag.com', 'title': 'Redmondmag.com'}"
2018-08-14 07:00:00+00:00,Microsoft ADFS Vulnerability Lets Attackers Bypass MFA - Dark Reading,"{'href': 'https://www.darkreading.com', 'title': 'Dark Reading'}"
2018-08-10 07:00:00+00:00,Microsoft may soon add multi-session remote access to Windows 10 Enterprise - Computerworld,"{'href': 'https://www.computerworld.com', 'title': 'Computerworld'}"
2018-08-08 07:00:00+00:00,"S&P 500, Dow edge down as oil prices, trade worries weigh - Reuters","{'href': 'https://www.reuters.com', 'title': 'Reuters'}"
2018-08-13 07:00:00+00:00,"Microsoft Hires Red Dead Redemption, Tomb Raider, God of War Vets for its Newest Studio - Wccftech","{'href': 'https://wccftech.com', 'title': 'Wccftech'}"
2018-08-04 07:00:00+00:00,Inside Tokyo's epic electronics store: Apple vs. Microsoft; plenty of ... - GeekWire,"{'href': 'https://www.geekwire.com', 'title': 'GeekWire'}"
2018-08-06 07:00:00+00:00,How Microsoft became tech’s good guy - Computerworld,"{'href': 'https://www.computerworld.com', 'title': 'Computerworld'}"
2018-08-10 07:00:00+00:00,Microsoft is Live Streaming from Its Underwater Data Center in ... - Data Center Knowledge,"{'href': 'https://www.datacenterknowledge.com', 'title': 'Data Center Knowledge'}"
2018-08-13 07:00:00+00:00,Bye-bye passwords: Switching to phone sign-in for Microsoft ... - TechGenix,"{'href': 'https://techgenix.com', 'title': 'TechGenix'}"
2018-08-02 07:00:00+00:00,"Cloud Market Share 2018 By Region: Amazon AWS, Microsoft Azure ... - ChannelE2E","{'href': 'https://www.channele2e.com', 'title': 'ChannelE2E'}"
2018-08-05 07:00:00+00:00,Surface Go vs. Chromebooks: Which Is Right for You? - Laptop Mag,"{'href': 'https://www.laptopmag.com', 'title': 'Laptop Mag'}"
2018-08-06 07:00:00+00:00,Office Q&A: How to handle end-of-sentence spacing in Microsoft Word - TechRepublic,"{'href': 'https://www.techrepublic.com', 'title': 'TechRepublic'}"
2018-08-05 07:00:00+00:00,Microsoft adds Slack to official list of Office rivals as workplace ... - GeekWire,"{'href': 'https://www.geekwire.com', 'title': 'GeekWire'}"
2018-08-14 07:00:00+00:00,Microsoft Launches Its First Mixed Reality Capture Studio in Hollywood - Next Reality,"{'href': 'https://next.reality.news', 'title': 'Next Reality'}"
2018-08-13 07:00:00+00:00,Microsoft Surface GO and Fire HD 10 fit together in the same bag - Computerworld,"{'href': 'https://www.computerworld.com', 'title': 'Computerworld'}"
2018-08-05 07:00:00+00:00,Whizz kid alert: Auckland teen crowned the world's Microsoft ... - New Zealand Herald,"{'href': 'https://www.nzherald.co.nz', 'title': 'New Zealand Herald'}"
2018-08-08 07:00:00+00:00,Microsoft reveals how you can draw in emails with Windows 10 Mail app - WindowsLatest,"{'href': 'https://www.windowslatest.com', 'title': 'WindowsLatest'}"
2018-08-13 07:00:00+00:00,IT admins warn Microsoft to slow Windows 10 upgrade pace - Reseller News,"{'href': 'https://www.reseller.co.nz', 'title': 'Reseller News'}"
2018-08-01 07:00:00+00:00,Microsoft rolling out 'Your Phone' app in latest Windows 10 preview - TechSpot,"{'href': 'https://www.techspot.com', 'title': 'TechSpot'}"
2018-08-09 07:00:00+00:00,Microsoft reveals final look of Dark Theme in File Explorer for Windows 10 - WindowsLatest,"{'href': 'https://www.windowslatest.com', 'title': 'WindowsLatest'}"
2018-08-01 07:00:00+00:00,Hints of Microsoft's Modular Windows Core OS Spotted in Latest SDK - BleepingComputer,"{'href': 'https://www.bleepingcomputer.com', 'title': 'BleepingComputer'}"
2018-08-08 07:00:00+00:00,The BHF joins forces with Microsoft and the NHS to save thousands ... - British Heart Foundation,"{'href': 'https://www.bhf.org.uk', 'title': 'British Heart Foundation'}"
