date,title,publisher
2018-09-18 07:00:00+00:00,Microsoft's Stock Seen Climbing 9% on Robust Profits - Investopedia,"{'href': 'https://www.investopedia.com', 'title': 'Investopedia'}"
2018-09-16 07:00:00+00:00,Azure DevOps - Why It's A Big Deal For Microsoft And The Community - Forbes,"{'href': 'https://www.forbes.com', 'title': 'Forbes'}"
2018-09-17 07:00:00+00:00,She Collects Marathons Between Deals for Microsoft - The Wall Street Journal,"{'href': 'https://www.wsj.com', 'title': 'The Wall Street Journal'}"
2018-09-26 07:00:00+00:00,"Microsoft Dial, MacBook Touch Bar outsmarted by Brain Magic O2 ... - CNET","{'href': 'https://www.cnet.com', 'title': 'CNET'}"
2018-09-15 07:00:00+00:00,Alleged Microsoft Surface Laptop in black color leaks online - WindowsLatest,"{'href': 'https://www.windowslatest.com', 'title': 'WindowsLatest'}"
2018-09-17 07:00:00+00:00,She left Microsoft to build a school — and change a white ... - Crosscut,"{'href': 'https://crosscut.com', 'title': 'Crosscut'}"
2018-09-23 07:00:00+00:00,How to install Microsoft Word without the Office 365 suite - TCPalm,"{'href': 'https://www.tcpalm.com', 'title': 'TCPalm'}"
2018-09-25 07:00:00+00:00,Deloitte acquires Microsoft Azure partner Mexia - Services - CRN Australia,"{'href': 'https://www.crn.com.au', 'title': 'CRN Australia'}"
2018-09-15 07:00:00+00:00,Microsoft Is Updating Office Desktop on Windows With New ... - BleepingComputer,"{'href': 'https://www.bleepingcomputer.com', 'title': 'BleepingComputer'}"
2018-09-18 07:00:00+00:00,Microsoft’s SignalR real-time service moves to the cloud - InfoWorld,"{'href': 'https://www.infoworld.com', 'title': 'InfoWorld'}"
2018-09-26 07:00:00+00:00,PC reseller CPL Notting Hill claims court ruling inconsistent with ... - CRN Australia,"{'href': 'https://www.crn.com.au', 'title': 'CRN Australia'}"
2018-09-28 07:00:00+00:00,How To Align Text Inside Tables In Microsoft Word - AddictiveTips,"{'href': 'https://www.addictivetips.com', 'title': 'AddictiveTips'}"
2018-09-18 07:00:00+00:00,Windows of opportunity: Microsoft OS remains the most lucrative target for hackers - The Daily Swig,"{'href': 'https://portswigger.net', 'title': 'The Daily Swig'}"
2018-09-19 07:00:00+00:00,"Mastercard, Microsoft partner on B2B FinTech network that could save billions - Computerworld","{'href': 'https://www.computerworld.com', 'title': 'Computerworld'}"
2018-09-23 07:00:00+00:00,Microsoft Announces the General Availability of the Immutable ... - InfoQ.com,"{'href': 'https://www.infoq.com', 'title': 'InfoQ.com'}"
2018-09-24 07:00:00+00:00,Beyond IaaS with Microsoft Azure - Virtualization Review,"{'href': 'https://virtualizationreview.com', 'title': 'Virtualization Review'}"
2018-09-17 07:00:00+00:00,Microsoft Explains This Months’ Azure South Central Datacenter ... - WinBuzzer,"{'href': 'https://winbuzzer.com', 'title': 'WinBuzzer'}"
2018-09-25 07:00:00+00:00,Microsoft and Shell are bringing AI to gas stations and oil refineries - Neowin,"{'href': 'https://www.neowin.net', 'title': 'Neowin'}"
2018-09-21 07:00:00+00:00,This man's blog on Excel has turned so big that Microsoft has taken ... - YourStory,"{'href': 'https://yourstory.com', 'title': 'YourStory'}"
2018-09-19 07:00:00+00:00,Magic Leap vs. Microsoft HoloLens: Which is the better AR ... - Mashable,"{'href': 'https://mashable.com', 'title': 'Mashable'}"
2018-09-28 07:00:00+00:00,Microsoft Unveils ROS on Windows for Advanced Robotics ... - WinBuzzer,"{'href': 'https://winbuzzer.com', 'title': 'WinBuzzer'}"
2018-09-24 07:00:00+00:00,Ignite 2018: Microsoft retires StaffHub to be replaced with Home and ... - OnMSFT.com,"{'href': 'https://www.onmsft.com', 'title': 'OnMSFT.com'}"
2018-09-24 07:00:00+00:00,5 power user tips for Microsoft OneNote - Computerworld,"{'href': 'https://www.computerworld.com', 'title': 'Computerworld'}"
2018-09-17 07:00:00+00:00,Low-code tools showdown: PowerApps vs. Appian - TechTarget,"{'href': 'https://www.techtarget.com', 'title': 'TechTarget'}"
2018-09-26 07:00:00+00:00,Microsoft Responds To PS4 Cross-Play News - GameSpot,"{'href': 'https://www.gamespot.com', 'title': 'GameSpot'}"
2018-09-19 07:00:00+00:00,Microsoft plans to discontinue the Classic Intune Portal with ... - MSPoweruser,"{'href': 'https://mspoweruser.com', 'title': 'MSPoweruser'}"
2022-10-11 17:37:15+00:00,Microsoft Research Montreal moving to Mile-Ex development - Real Estate News EXchange - RENX,"{'href': 'https://renx.ca', 'title': 'Real Estate News EXchange - RENX'}"
2018-09-28 07:00:00+00:00,Microsoft Stores to hold Minecraft MINECON celebrations this ... - OnMSFT.com,"{'href': 'https://www.onmsft.com', 'title': 'OnMSFT.com'}"
2018-09-16 07:00:00+00:00,"Microsoft will be retiring Disk Cleanup tool, will replace it will ... - MSPoweruser","{'href': 'https://mspoweruser.com', 'title': 'MSPoweruser'}"
2018-09-20 07:00:00+00:00,There's an off chance Microsoft might unveil the Surface Watch in ... - Gadgets & Wearables,"{'href': 'https://gadgetsandwearables.com', 'title': 'Gadgets & Wearables'}"
2018-09-26 07:00:00+00:00,Microsoft Fuels Efficiency at Chevron with Remote Assist App for ... - HoloLens,"{'href': 'https://hololens.reality.news', 'title': 'HoloLens'}"
2018-09-18 07:00:00+00:00,"Romanian commune’s digital transformation, among Microsoft’s successful customer stories - Romania-Insider.com","{'href': 'https://www.romania-insider.com', 'title': 'Romania-Insider.com'}"
2018-09-17 07:00:00+00:00,Microsoft Office 2016 16.17 - TidBITS,"{'href': 'https://tidbits.com', 'title': 'TidBITS'}"
2018-09-22 07:00:00+00:00,Microsoft is working on a new update for Skype for Windows with focus on status feature - WindowsLatest,"{'href': 'https://www.windowslatest.com', 'title': 'WindowsLatest'}"
2018-09-15 07:00:00+00:00,Microsoft is testing radical ink color picker in Word Mobile app for Windows 10 - WindowsLatest,"{'href': 'https://www.windowslatest.com', 'title': 'WindowsLatest'}"
2018-09-27 07:00:00+00:00,Microsoft’s Newly-Acquired Studios to Operate Independently Says Xbox’s Aaron Greenberg - Wccftech,"{'href': 'https://wccftech.com', 'title': 'Wccftech'}"
2018-09-15 07:00:00+00:00,Microsoft Canada leaving Mississauga for Toronto in 2020 - Mississauga News,"{'href': 'https://www.mississauga.com', 'title': 'Mississauga News'}"
2018-09-27 07:00:00+00:00,Cat Lovers: Get Microsoft's free Cat Expressions Windows 10 theme - MSPoweruser,"{'href': 'https://mspoweruser.com', 'title': 'MSPoweruser'}"
2018-09-18 07:00:00+00:00,Microsoft Announce Enhanced Version of Ubuntu 18.04 for Hyper-V - OMG! Ubuntu!,"{'href': 'http://www.omgubuntu.co.uk', 'title': 'OMG! Ubuntu!'}"
2018-10-02 07:00:00+00:00,"Microsoft launches next-gen Surface Pro 6, Surface Laptop 2 ... - PCWorld","{'href': 'https://www.pcworld.com', 'title': 'PCWorld'}"
2018-10-02 07:00:00+00:00,Microsoft Surface Laptop 2 review: Microsoft Surface Laptop 2 starts ... - CNET,"{'href': 'https://www.cnet.com', 'title': 'CNET'}"
2018-10-02 07:00:00+00:00,"Microsoft Surface Pro 6, Surface Laptop 2, Surface Studio 2, Surface Headphones: Hands-on - Business Insider","{'href': 'https://www.businessinsider.com', 'title': 'Business Insider'}"
2018-10-03 07:00:00+00:00,Microsoft is embracing Android as the mobile version of Windows - The Verge,"{'href': 'https://www.theverge.com', 'title': 'The Verge'}"
2018-10-02 07:00:00+00:00,Microsoft Releases Windows 10 Version 1809 - Redmondmag.com,"{'href': 'https://redmondmag.com', 'title': 'Redmondmag.com'}"
2018-10-02 07:00:00+00:00,Microsoft Your Phone app for Android makes it easier to send text ... - CNET,"{'href': 'https://www.cnet.com', 'title': 'CNET'}"
2018-10-01 07:00:00+00:00,Microsoft Cofounder Paul Allen Announces That His Cancer Has Returned - Forbes,"{'href': 'https://www.forbes.com', 'title': 'Forbes'}"
2018-10-09 07:00:00+00:00,Microsoft invests in Grab to bring AI and big data to on-demand services - TechCrunch,"{'href': 'https://techcrunch.com', 'title': 'TechCrunch'}"
2018-10-08 07:00:00+00:00,Microsoft announces Project Xcloud—Xbox game streaming for myriad devices - Ars Technica,"{'href': 'https://arstechnica.com', 'title': 'Ars Technica'}"
2018-10-06 07:00:00+00:00,Microsoft pulls Windows 10 October 2018 Update after reports of ... - PCWorld,"{'href': 'https://www.pcworld.com', 'title': 'PCWorld'}"
2018-10-10 07:00:00+00:00,Microsoft open-sources its patent portfolio - ZDNet,"{'href': 'https://www.zdnet.com', 'title': 'ZDNet'}"
2018-10-09 07:00:00+00:00,Microsoft thinks Windows 10 file deletion glitch is fixed - Business Insider,"{'href': 'https://www.businessinsider.com', 'title': 'Business Insider'}"
2018-10-03 07:00:00+00:00,"Holy Crap, Am I a Microsoft Surface Fanboy? - New York Magazine","{'href': 'https://nymag.com', 'title': 'New York Magazine'}"
2018-10-08 07:00:00+00:00,"Microsoft's LinkedIn spent over $400 million on Glint, which helps companies understand if their workers are happy - CNBC","{'href': 'https://www.cnbc.com', 'title': 'CNBC'}"
2018-10-09 07:00:00+00:00,How Do You Play 'Halo' on a Phone? Stream It From an Azure Data ... - Data Center Knowledge,"{'href': 'https://www.datacenterknowledge.com', 'title': 'Data Center Knowledge'}"
2018-10-09 07:00:00+00:00,Sources: Microsoft Is Close To Buying Obsidian - Kotaku,"{'href': 'https://kotaku.com', 'title': 'Kotaku'}"
2018-10-10 07:00:00+00:00,Microsoft is now a top five PC maker in the US thanks to Surface - The Verge,"{'href': 'https://www.theverge.com', 'title': 'The Verge'}"
2018-10-08 07:00:00+00:00,Microsoft now faces a big Windows 10 quality test after botched update - The Verge,"{'href': 'https://www.theverge.com', 'title': 'The Verge'}"
2018-10-11 07:00:00+00:00,"Cricket pro teams with Microsoft for a bat that can track analytics in real-time, and send them to fans - The Seattle Times","{'href': 'https://www.seattletimes.com', 'title': 'The Seattle Times'}"
2018-10-02 07:00:00+00:00,"Microsoft unveils new Surface devices, smart headphones - CNN","{'href': 'https://www.cnn.com', 'title': 'CNN'}"
2018-10-08 07:00:00+00:00,Microsoft's new Surface Headphones launch on November 19th - The Verge,"{'href': 'https://www.theverge.com', 'title': 'The Verge'}"
2018-10-10 07:00:00+00:00,Why Microsoft may be relinquishing billions in Android patent royalties - Yahoo Finance,"{'href': 'https://finance.yahoo.com', 'title': 'Yahoo Finance'}"
2018-10-03 07:00:00+00:00,"Microsoft is adding verified icon, email promotion features to Outlook ... - ZDNet","{'href': 'https://www.zdnet.com', 'title': 'ZDNet'}"
2018-10-09 07:00:00+00:00,Microsoft CEO Satya Nadella on tech industry spotlight: 'Having the ... - GeekWire,"{'href': 'https://www.geekwire.com', 'title': 'GeekWire'}"
2018-10-07 07:00:00+00:00,Microsoft CEO Satya Nadella has execs read 'Nonviolent Communication' - Business Insider,"{'href': 'https://www.businessinsider.com', 'title': 'Business Insider'}"
2018-10-03 07:00:00+00:00,Microsoft CFO Amy Hood says it's time to redefine role beyond bean ... - Healthcare Finance News,"{'href': 'https://www.healthcarefinancenews.com', 'title': 'Healthcare Finance News'}"
2018-10-09 07:00:00+00:00,Upskill launches support for Microsoft HoloLens - TechCrunch,"{'href': 'https://techcrunch.com', 'title': 'TechCrunch'}"
2018-10-08 07:00:00+00:00,The 1 Book That Transformed Microsoft's Culture From Cutthroat to ... - Inc.,"{'href': 'https://www.inc.com', 'title': 'Inc.'}"
2018-10-07 07:00:00+00:00,Apple and Microsoft are both wrong about USB-C - Business Insider,"{'href': 'https://www.businessinsider.com', 'title': 'Business Insider'}"
2018-10-01 07:00:00+00:00,"If You're Interested in Microsoft Stock, Read This First - The Motley Fool","{'href': 'https://www.fool.com', 'title': 'The Motley Fool'}"
2018-10-01 07:00:00+00:00,"Microsoft open sources MS-DOS again, this time on GitHub - ZDNet","{'href': 'https://www.zdnet.com', 'title': 'ZDNet'}"
2018-10-06 07:00:00+00:00,How to scan printed documents with the free Microsoft Office Lens app - TechRepublic,"{'href': 'https://www.techrepublic.com', 'title': 'TechRepublic'}"
2018-10-03 07:00:00+00:00,New Microsoft Surface payment plan lets you own a PC for $25 a ... - USA TODAY,"{'href': 'https://www.usatoday.com', 'title': 'USA TODAY'}"
2018-10-04 07:00:00+00:00,Microsoft Announces the General Availability of Azure Functions 2.0 - InfoQ.com,"{'href': 'https://www.infoq.com', 'title': 'InfoQ.com'}"
2018-10-05 07:00:00+00:00,24 arrested at fake Microsoft call centre - MSPoweruser,"{'href': 'https://mspoweruser.com', 'title': 'MSPoweruser'}"
2018-10-10 07:00:00+00:00,Microsoft's new Battery Limit: Surface 50% charge cap aims to give ... - ZDNet,"{'href': 'https://www.zdnet.com', 'title': 'ZDNet'}"
2018-10-11 07:00:00+00:00,Prototype Microsoft HoloLens headset spotted in NASA video - The Verge,"{'href': 'https://www.theverge.com', 'title': 'The Verge'}"
2018-10-03 07:00:00+00:00,I Want My USB-C! Why the Surface's Missing Port Is a Big Problem. - Tom's Hardware,"{'href': 'https://www.tomshardware.com', 'title': ""Tom's Hardware""}"
2018-10-10 07:00:00+00:00,"Microsoft axes Minecraft for Apple TV, no one notices - AppleInsider","{'href': 'https://appleinsider.com', 'title': 'AppleInsider'}"
2018-10-01 07:00:00+00:00,Directly Announces Integration with Microsoft Dynamics 365 - GlobeNewswire,"{'href': 'https://www.globenewswire.com', 'title': 'GlobeNewswire'}"
2018-10-11 07:00:00+00:00,PoC Code Available for Microsoft Edge Remote Code Execution Bug - BleepingComputer,"{'href': 'https://www.bleepingcomputer.com', 'title': 'BleepingComputer'}"
2018-10-03 07:00:00+00:00,Phishing Attack Uses Azure Blob Storage to Impersonate Microsoft - BleepingComputer,"{'href': 'https://www.bleepingcomputer.com', 'title': 'BleepingComputer'}"
2018-10-11 07:00:00+00:00,Microsoft pulls 'Minecraft' for Apple TV due to low demand - Engadget,"{'href': 'https://www.engadget.com', 'title': 'Engadget'}"
2018-10-02 07:00:00+00:00,Microsoft CFO: Define Your Own Role - Fortune,"{'href': 'https://fortune.com', 'title': 'Fortune'}"
2018-10-05 07:00:00+00:00,Could TV Whitespace Get Real With Microsoft Initiative? - Daily Yonder,"{'href': 'http://dailyyonder.com', 'title': 'Daily Yonder'}"
2018-10-02 07:00:00+00:00,Microsoft Re-Open-Sources MS-DOS on GitHub - ExtremeTech,"{'href': 'https://www.extremetech.com', 'title': 'ExtremeTech'}"
2018-10-04 07:00:00+00:00,Microsoft brand grows from strength to strength but still lags other ... - MSPoweruser,"{'href': 'https://mspoweruser.com', 'title': 'MSPoweruser'}"
2018-10-12 07:00:00+00:00,The Microsoft Store is now selling Xbox Avatar costume items - MSPoweruser,"{'href': 'https://mspoweruser.com', 'title': 'MSPoweruser'}"
2018-10-01 07:00:00+00:00,Microsoft to Power Volkswagen's Connected Cars - autoevolution,"{'href': 'https://www.autoevolution.com', 'title': 'autoevolution'}"
2018-10-12 07:00:00+00:00,Windows 10 Audio Not Working After Installing Latest Windows ... - BleepingComputer,"{'href': 'https://www.bleepingcomputer.com', 'title': 'BleepingComputer'}"
2018-10-02 07:00:00+00:00,Microsoft Co-Founder Paul Allen Battles Cancer Anew - Channels Television,"{'href': 'https://www.channelstv.com', 'title': 'Channels Television'}"
2018-10-10 07:00:00+00:00,"Microsoft's Bing keeps surfacing racist, offensive, and probably ... - TNW","{'href': 'https://thenextweb.com', 'title': 'TNW'}"
2018-10-04 07:00:00+00:00,Peggy Johnson: The Story Behind Microsoft’s Transformation - TIME,"{'href': 'https://time.com', 'title': 'TIME'}"
2018-10-11 07:00:00+00:00,Microsoft's new Battery Limit feature places a strict cap on charging - TrustedReviews,"{'href': 'https://www.trustedreviews.com', 'title': 'TrustedReviews'}"
2018-10-01 07:00:00+00:00,The differences between Office 365 and Microsoft Office - Dignited,"{'href': 'https://www.dignited.com', 'title': 'Dignited'}"
2018-10-02 07:00:00+00:00,Former Microsoft Channel Executive Huddleston Dies - Redmond Channel Partner,"{'href': 'https://rcpmag.com', 'title': 'Redmond Channel Partner'}"
2018-10-01 07:00:00+00:00,Microsoft CEO elected to University of Chicago Board of Trustees - UChicago News,"{'href': 'https://news.uchicago.edu', 'title': 'UChicago News'}"
2018-10-01 07:00:00+00:00,ROS for Windows 10: Microsoft gets back into robotics - Robot Report,"{'href': 'https://www.therobotreport.com', 'title': 'Robot Report'}"
2018-10-08 07:00:00+00:00,FAQ: How Microsoft has changed Office 2019 - Computerworld,"{'href': 'https://www.computerworld.com', 'title': 'Computerworld'}"
2018-10-09 07:00:00+00:00,Microsoft is bringing Sticky Notes to iOS - Cult of Mac,"{'href': 'https://www.cultofmac.com', 'title': 'Cult of Mac'}"
2018-10-02 07:00:00+00:00,Microsoft Explains Why They Are Creating Spinoffs Like Minecraft ... - DualShockers,"{'href': 'https://www.dualshockers.com', 'title': 'DualShockers'}"
2018-10-05 07:00:00+00:00,Valohai and Microsoft Join Forces in Deep Learning for Enterprises - PR Newswire,"{'href': 'https://www.prnewswire.com', 'title': 'PR Newswire'}"
2018-10-01 07:00:00+00:00,Detailing Microsoft's New Security Tools - PCMag,"{'href': 'https://www.pcmag.com', 'title': 'PCMag'}"
2018-10-05 07:00:00+00:00,3 Ways Microsoft Has Outrun Intel - The Motley Fool,"{'href': 'https://www.fool.com', 'title': 'The Motley Fool'}"
2018-10-05 07:00:00+00:00,Microsoft Plans Relocation of Costa Rica HQ to Downtown San Jose - Nearshore Americas,"{'href': 'https://nearshoreamericas.com', 'title': 'Nearshore Americas'}"
2018-10-05 07:00:00+00:00,How to synchronize your favorites between Internet Explorer and ... - TechRepublic,"{'href': 'https://www.techrepublic.com', 'title': 'TechRepublic'}"
2018-10-08 07:00:00+00:00,Microsoft-Adobe's amazing partnership: Creating a new category? - ZDNet,"{'href': 'https://www.zdnet.com', 'title': 'ZDNet'}"
2018-10-09 07:00:00+00:00,Amazon scraps secret AI recruiting tool that showed bias against ... - Reuters,"{'href': 'https://www.reuters.com', 'title': 'Reuters'}"
2018-10-09 07:00:00+00:00,How Microsoft is making its most sensitive HoloLens depth sensor yet - ZDNet,"{'href': 'https://www.zdnet.com', 'title': 'ZDNet'}"
2018-10-10 07:00:00+00:00,Microsoft Office 2019 review - TechRadar,"{'href': 'https://www.techradar.com', 'title': 'TechRadar'}"
2018-10-01 07:00:00+00:00,South Korean backers splash out £100m for Microsoft HQ - CityAM - City A.M.,"{'href': 'https://www.cityam.com', 'title': 'City A.M.'}"
2018-10-01 07:00:00+00:00,How To Create And Edit Microsoft Word Documents Online - Ubergizmo,"{'href': 'https://www.ubergizmo.com', 'title': 'Ubergizmo'}"
2018-10-11 07:00:00+00:00,Data Doctors: What to do if you fall for a Microsoft support scam - WTOP,"{'href': 'https://wtop.com', 'title': 'WTOP'}"
2018-10-04 07:00:00+00:00,"Microsoft plans to add verified icon, and email promotion features to ... - MSPoweruser","{'href': 'https://mspoweruser.com', 'title': 'MSPoweruser'}"
2018-10-14 07:00:00+00:00,Microsoft partners with Anil Kumble's startup Spektacom to bring AI ... - YourStory,"{'href': 'https://yourstory.com', 'title': 'YourStory'}"
2018-10-09 07:00:00+00:00,Microsoft Announces Several Updates to Azure Cosmos DB Features - InfoQ.com,"{'href': 'https://www.infoq.com', 'title': 'InfoQ.com'}"
2018-10-11 07:00:00+00:00,Best Microsoft Surface Pro 6 alternatives you can buy right now - ZDNet,"{'href': 'https://www.zdnet.com', 'title': 'ZDNet'}"
2018-10-03 07:00:00+00:00,5 common misconceptions about Microsoft Hyper-V - TechGenix,"{'href': 'https://techgenix.com', 'title': 'TechGenix'}"
2018-10-04 07:00:00+00:00,What Microsoft Dynamics 365 Business Central partners will take ... - MSDynamicsWorld,"{'href': 'https://msdynamicsworld.com', 'title': 'MSDynamicsWorld'}"
2018-10-02 07:00:00+00:00,Microsoft invests in $21M round for wireless over-the-ear ... - GeekWire,"{'href': 'https://www.geekwire.com', 'title': 'GeekWire'}"
2018-10-13 07:00:00+00:00,Microsoft Edge's Hidden Browser - Komando,"{'href': 'https://www.komando.com', 'title': 'Komando'}"
2018-10-09 07:00:00+00:00,Microsoft's Common Data Model: What users (not just Dynamics 365 ... - ZDNet,"{'href': 'https://www.zdnet.com', 'title': 'ZDNet'}"
2018-10-11 07:00:00+00:00,Free eBooks From Microsoft - Komando,"{'href': 'https://www.komando.com', 'title': 'Komando'}"
2018-10-09 07:00:00+00:00,Wunderlist Founder Christian Reber Launches PowerPoint ... - Business Insider,"{'href': 'https://www.businessinsider.com', 'title': 'Business Insider'}"
2018-10-01 07:00:00+00:00,"Why there won’t be a 'Minecraft 2,' according to Microsoft and Mojang - Business Insider","{'href': 'https://www.businessinsider.com', 'title': 'Business Insider'}"
2018-10-01 07:00:00+00:00,"How Chipotle, MGM and Microsoft are trimming food waste | Greenbiz - GreenBiz","{'href': 'https://www.greenbiz.com', 'title': 'GreenBiz'}"
2018-10-09 07:00:00+00:00,POLITICO Europe partners with Microsoft to launch a new Elections ... - MSPoweruser,"{'href': 'https://mspoweruser.com', 'title': 'MSPoweruser'}"
2018-10-11 07:00:00+00:00,Microsoft Expands Previews of Azure Confidential Computing and ... - Redmondmag.com,"{'href': 'https://redmondmag.com', 'title': 'Redmondmag.com'}"
2018-10-10 07:00:00+00:00,Microsoft's rural access program enters next phase in Maine - Mainebiz,"{'href': 'https://www.mainebiz.biz', 'title': 'Mainebiz'}"
2018-10-12 07:00:00+00:00,The world's next breakthrough product may just come from Microsoft - Yanko Design,"{'href': 'https://www.yankodesign.com', 'title': 'Yanko Design'}"
2018-10-02 07:00:00+00:00,Latest Microsoft Andromeda leak reveals some interesting tidbits - WindowsLatest,"{'href': 'https://www.windowslatest.com', 'title': 'WindowsLatest'}"
2018-10-12 07:00:00+00:00,Microsoft Surface Laptop 2 vs. Dell XPS 13: Which Should You Buy? - Laptop Mag,"{'href': 'https://www.laptopmag.com', 'title': 'Laptop Mag'}"
2018-10-12 07:00:00+00:00,Is Microsoft turning Cortana into Clippy 2.0? - TechRadar,"{'href': 'https://www.techradar.com', 'title': 'TechRadar'}"
2018-10-14 07:00:00+00:00,Microsoft releases Windows 10 KB4468550 to address Intel audio issues - WindowsLatest,"{'href': 'https://www.windowslatest.com', 'title': 'WindowsLatest'}"
2018-10-03 07:00:00+00:00,Prodware Netherlands Acquires Ctac's Microsoft Dynamics Activities - Business Wire,"{'href': 'https://www.businesswire.com', 'title': 'Business Wire'}"
2018-10-06 07:00:00+00:00,Microsoft and Partners Hope to Create a Time Capsule... On the Moon! - Universe Today,"{'href': 'https://www.universetoday.com', 'title': 'Universe Today'}"
2018-10-12 07:00:00+00:00,Microsoft (Nasdaq: MSFT) builds quantum computing team in ... - The Business Journals,"{'href': 'https://www.bizjournals.com', 'title': 'The Business Journals'}"
2018-10-08 07:00:00+00:00,Hands-on of the new Microsoft Launcher 5.0 - MSPoweruser,"{'href': 'https://mspoweruser.com', 'title': 'MSPoweruser'}"
2018-10-04 07:00:00+00:00,Microsoft changes pistol emoji in latest Windows update - Android Police,"{'href': 'https://www.androidpolice.com', 'title': 'Android Police'}"
2018-10-10 07:00:00+00:00,Microsoft patches zero-day Windows 10 exploit being used for ... - MSPoweruser,"{'href': 'https://mspoweruser.com', 'title': 'MSPoweruser'}"
2018-10-15 07:00:00+00:00,Microsoft co-founder Paul Allen dies of cancer at age 65 - CNBC,"{'href': 'https://www.cnbc.com', 'title': 'CNBC'}"
2018-10-15 07:00:00+00:00,Microsoft co-founder Paul Allen dies at 65 - Reuters,"{'href': 'https://www.reuters.com', 'title': 'Reuters'}"
2018-10-15 07:00:00+00:00,"Paul Allen, Microsoft co-founder and Seahawks owner, dies at 65 - The Seattle Times","{'href': 'https://www.seattletimes.com', 'title': 'The Seattle Times'}"
2018-10-16 07:00:00+00:00,Paul Allen Turned Microsoft Into a Colossus - New York Magazine,"{'href': 'https://nymag.com', 'title': 'New York Magazine'}"
2018-10-16 07:00:00+00:00,Microsoft Pioneer's Legacy: Allen Institute For Brain Science : Shots ... - NPR,"{'href': 'https://www.npr.org', 'title': 'NPR'}"
2018-10-16 07:00:00+00:00,Microsoft exists because Paul Allen and Bill Gates launched this high school business first - CNBC,"{'href': 'https://www.cnbc.com', 'title': 'CNBC'}"
2018-10-17 07:00:00+00:00,Paul Allen's battle with Bill Gates defined his legacy - CNN,"{'href': 'https://www.cnn.com', 'title': 'CNN'}"
2018-10-26 07:00:00+00:00,Microsoft Says It Will Sell Pentagon Artificial Intelligence and Other ... - The New York Times,"{'href': 'https://www.nytimes.com', 'title': 'The New York Times'}"
2018-10-24 07:00:00+00:00,"Microsoft's Earnings Surge, as Cloud Bet Continues to Pay Off ... - The New York Times","{'href': 'https://www.nytimes.com', 'title': 'The New York Times'}"
2018-10-29 07:00:00+00:00,Microsoft vs. IBM: Can a $34B Acquisition Help IBM Return to Glory? - Yahoo Finance,"{'href': 'https://finance.yahoo.com', 'title': 'Yahoo Finance'}"
2018-10-27 07:00:00+00:00,Microsoft switches seats with Amazon as the second most valuable ... - GSMArena.com,"{'href': 'https://www.gsmarena.com', 'title': 'GSMArena.com'}"
2018-10-26 07:00:00+00:00,Microsoft closes its $7.5B purchase of code-sharing platform GitHub - TechCrunch,"{'href': 'https://techcrunch.com', 'title': 'TechCrunch'}"
2018-10-16 07:00:00+00:00,Microsoft Surface Pro 6 review: a fantastic tablet PC you shouldn't buy - The Guardian,"{'href': 'https://www.theguardian.com', 'title': 'The Guardian'}"
2018-10-18 07:00:00+00:00,Microsoft Surface Laptop 2 review: An ultraportable dream - Alphr,"{'href': 'https://www.alphr.com', 'title': 'Alphr'}"
2018-10-29 07:00:00+00:00,Microsoft experiments with modular controllers for mobile devices - GSMArena.com,"{'href': 'https://www.gsmarena.com', 'title': 'GSMArena.com'}"
2018-10-19 07:00:00+00:00,Mergers: acquisition of GitHub by Microsoft approved - European Union,"{'href': 'https://europa.eu', 'title': 'European Union'}"
2019-12-17 15:48:07+00:00,Microsoft Celebrates 1000th ID@Xbox Game Title - Thurrott.com,"{'href': 'https://www.thurrott.com', 'title': 'Thurrott.com'}"
