date,title,publisher
2020-09-15 07:00:00+00:00,Nvidia's Integration Dreams – Stratechery by Ben Thompson - Stratechery by Ben Thompson,"{'href': 'https://stratechery.com', 'title': 'Stratechery by Ben Thompson'}"
2020-09-23 07:00:00+00:00,Chinese Electric Carmaker Li Auto Teams Up With U.S. Chipmaker ... - Caixin Global,"{'href': 'https://www.caixinglobal.com', 'title': 'Caixin Global'}"
2020-09-17 07:00:00+00:00,The End of SLI As We Know It: Nvidia Reveals New Model - Tom's Hardware,"{'href': 'https://www.tomshardware.com', 'title': ""Tom's Hardware""}"
2020-09-20 07:00:00+00:00,Nvidia RTX 3080 GPU is overclocked to 2.34GHz with record ... - TechRadar,"{'href': 'https://www.techradar.com', 'title': 'TechRadar'}"
2020-09-17 07:00:00+00:00,Fortnite now supports ray-tracing and Nvidia DLSS 2.0 - Rock Paper Shotgun,"{'href': 'https://www.rockpapershotgun.com', 'title': 'Rock Paper Shotgun'}"
2020-09-15 07:00:00+00:00,Fortnite debuts improved ray-tracing graphics on Sept. 17 - Polygon,"{'href': 'https://www.polygon.com', 'title': 'Polygon'}"
2020-09-20 07:00:00+00:00,LG OLED TVs Having Issues With Latest Nvidia RTX 30 Graphics Cards - Forbes,"{'href': 'https://www.forbes.com', 'title': 'Forbes'}"
2020-09-15 07:00:00+00:00,Get a Radeon RX 5600 XT for $100 Less Than an RTX 2060 - Tom's Hardware,"{'href': 'https://www.tomshardware.com', 'title': ""Tom's Hardware""}"
2020-09-23 07:00:00+00:00,"NVIDIA Quadro RTX A6000 Ampere Card Pictured Allegedly With 10,752 CUDA Cores - Hot Hardware","{'href': 'https://hothardware.com', 'title': 'Hot Hardware'}"
2020-09-18 07:00:00+00:00,Qualcomm Exec joins SiFive to help establish RISC-V as an ... - gizmochina,"{'href': 'https://www.gizmochina.com', 'title': 'gizmochina'}"
2020-09-16 07:00:00+00:00,"Apple Bet The Farm On Arm. Now NVIDIA’s In Charge, Does It Stick Or Twist? - Forbes","{'href': 'https://www.forbes.com', 'title': 'Forbes'}"
2020-09-20 07:00:00+00:00,Moore's Law Is Dead. Long Live Huang's Law. – Mother Jones - Mother Jones,"{'href': 'https://www.motherjones.com', 'title': 'Mother Jones'}"
2020-09-29 07:00:00+00:00,Warzone Nvidia Reflex: New Graphics Option Reduces Input Lag on ... - DBLTAP,"{'href': 'https://www.dbltap.com', 'title': 'DBLTAP'}"
2020-09-25 07:00:00+00:00,"Here's Forza Horizon 4 at 8K Resolution, on the New Nvidia RTX 3090 - GTPlanet","{'href': 'https://www.gtplanet.net', 'title': 'GTPlanet'}"
2020-09-25 07:00:00+00:00,"Intel, AMD, Ampere and Nvidia Leaders on Oracle’s Next-Gen Cloud ... - CRN","{'href': 'https://www.crn.com', 'title': 'CRN'}"
2020-09-25 07:00:00+00:00,Amazon's Luna game streaming service is powered by Windows ... - The Verge,"{'href': 'https://www.theverge.com', 'title': 'The Verge'}"
2020-09-18 07:00:00+00:00,"Li Auto is said to Cooperate with Nvidia, Desay SV - Pandaily","{'href': 'https://pandaily.com', 'title': 'Pandaily'}"
2020-09-17 07:00:00+00:00,NVIDIA SLI Support Moves Towards Native Game Integration - Wccftech,"{'href': 'https://wccftech.com', 'title': 'Wccftech'}"
2020-09-22 07:00:00+00:00,"Why is it so hard to order a PS5, Xbox Series X, or RTX 3080? - The Verge","{'href': 'https://www.theverge.com', 'title': 'The Verge'}"
2020-09-25 07:00:00+00:00,Nvidia RTX 3080 vs 2080: how much faster is Nvidia's new Ampere ... - Rock Paper Shotgun,"{'href': 'https://www.rockpapershotgun.com', 'title': 'Rock Paper Shotgun'}"
2020-09-16 07:00:00+00:00,Alcatraz joins NVIDIA Metropolis Software Partner program ... - SourceSecurity.com,"{'href': 'https://www.sourcesecurity.com', 'title': 'SourceSecurity.com'}"
2020-09-18 07:00:00+00:00,"Robotic and Automation News Review: ABB, Mitsubishi, Fanuc ... - Robotics and Automation News","{'href': 'https://roboticsandautomationnews.com', 'title': 'Robotics and Automation News'}"
2020-09-19 07:00:00+00:00,"No, the $2500 Nvidia RTX Titan cannot run Crysis Remastered at 8K - TechRadar","{'href': 'https://www.techradar.com', 'title': 'TechRadar'}"
2020-09-15 07:00:00+00:00,Watch Dogs Legion system requirements are here – can your PC ... - Gamesradar,"{'href': 'https://www.gamesradar.com', 'title': 'Gamesradar'}"
2020-09-20 07:00:00+00:00,NVIDIA Reflex lowers Input Lag in Valorant: How to turn it on - TalkEsport,"{'href': 'https://www.talkesport.com', 'title': 'TalkEsport'}"
2020-09-28 07:00:00+00:00,Deals That Change The Chip Industry - SemiEngineering,"{'href': 'https://semiengineering.com', 'title': 'SemiEngineering'}"
2020-09-24 07:00:00+00:00,NVIDIA GeForce RTX 3090 sold out as soon as it released - Sportskeeda,"{'href': 'https://www.sportskeeda.com', 'title': 'Sportskeeda'}"
2020-09-16 07:00:00+00:00,"Arm China investor sues company, escalating CEO spat amid sale - Reuters","{'href': 'https://www.reuters.com', 'title': 'Reuters'}"
2020-09-18 07:00:00+00:00,The Morning After: PS5 and RTX 3080 rollouts are frustrating for gamers - Engadget,"{'href': 'https://www.engadget.com', 'title': 'Engadget'}"
2020-09-26 07:00:00+00:00,70W NVIDIA Tesla T4 graphics could make Amazon Luna a poor fit ... - Notebookcheck.net,"{'href': 'https://www.notebookcheck.net', 'title': 'Notebookcheck.net'}"
2020-09-17 07:00:00+00:00,GeForce 456.38 WHQL driver download - guru3d.com,"{'href': 'https://www.guru3d.com', 'title': 'guru3d.com'}"
2020-09-22 07:00:00+00:00,"HP Pavilion 14 launched with Intel Tiger Lake processors, an ... - Notebookcheck.net","{'href': 'https://www.notebookcheck.net', 'title': 'Notebookcheck.net'}"
2020-09-15 07:00:00+00:00,HP's OMEN 30L desktop is set to get NVIDIA RTX 30 Series GPUs ... - Windows Central,"{'href': 'https://www.windowscentral.com', 'title': 'Windows Central'}"
2020-09-28 07:00:00+00:00,This Nvidia-powered supercomputer will simulate the Earth to ... - TechRadar,"{'href': 'https://www.techradar.com', 'title': 'TechRadar'}"
2020-09-17 07:00:00+00:00,Leaked AMD Radeon RX 6900 XT photos confirm thick design and I/O - Notebookcheck.net,"{'href': 'https://www.notebookcheck.net', 'title': 'Notebookcheck.net'}"
2020-09-23 07:00:00+00:00,"NVIDIA CUDA 11.1 Released With RTX 30 Series Support, Better ... - Phoronix","{'href': 'https://www.phoronix.com', 'title': 'Phoronix'}"
2020-09-25 07:00:00+00:00,AMD is determined for Big Navi not to be a paper launch - PC Gamer,"{'href': 'https://www.pcgamer.com', 'title': 'PC Gamer'}"
2020-09-18 07:00:00+00:00,"Super Mario Galaxy ""Super Mario 3D All-Stars vs. Nvidia Shield ... - GoNintendo","{'href': 'https://www.gonintendo.com', 'title': 'GoNintendo'}"
2020-09-16 07:00:00+00:00,"Honor Hunter V700 Gaming Laptops launched, features NVIDIA ... - gizmochina","{'href': 'https://www.gizmochina.com', 'title': 'gizmochina'}"
2020-09-21 07:00:00+00:00,The Rise and Fall of Multi-GPU Graphics Cards - TechSpot,"{'href': 'https://www.techspot.com', 'title': 'TechSpot'}"
2020-09-21 07:00:00+00:00,Semiconductor development should be gauged by AI processing ... - The Hankyoreh,"{'href': 'https://english.hani.co.kr', 'title': 'The Hankyoreh'}"
2020-09-18 07:00:00+00:00,Graphics card zombies: 7 GPUs you absolutely shouldn't buy now - PCWorld,"{'href': 'https://www.pcworld.com', 'title': 'PCWorld'}"
2020-09-28 07:00:00+00:00,Pure Vector Engines Get GPU Math Help for Next Earth Simulator - The Next Platform,"{'href': 'https://www.nextplatform.com', 'title': 'The Next Platform'}"
2020-09-16 07:00:00+00:00,HP revamps ProBook 400 line with Tiger Lake CPUs and Intel Iris ... - Notebookcheck.net,"{'href': 'https://www.notebookcheck.net', 'title': 'Notebookcheck.net'}"
2020-09-25 07:00:00+00:00,MINISFORUM H31G mini PC from $659 with NVIDIA GTX 1050Ti - Geeky Gadgets,"{'href': 'https://www.geeky-gadgets.com', 'title': 'Geeky Gadgets'}"
2020-09-16 07:00:00+00:00,Test karty graficznej NVIDIA GeForce RTX 3080 - Premiera Ampere! - PurePC,"{'href': 'https://www.purepc.pl', 'title': 'PurePC'}"
2020-09-20 07:00:00+00:00,Crysis Remastered PC Performance Analysis - DSOGaming,"{'href': 'https://www.dsogaming.com', 'title': 'DSOGaming'}"
2020-09-17 07:00:00+00:00,What cable do I buy for my HDMI 2.1 graphics card? | Ask an expert - PCWorld,"{'href': 'https://www.pcworld.com', 'title': 'PCWorld'}"
2020-09-29 07:00:00+00:00,Kondensator-Probleme bei frühen GeForce-RTX-30-Karten führen zu Abstürzen (Update: NVIDIA nimmt Stellung)... - Hardwareluxx,"{'href': 'https://www.hardwareluxx.de', 'title': 'Hardwareluxx'}"
2020-09-21 07:00:00+00:00,Report: Why The GeForce RTX 3080's GDDR6X Memory Is Clocked ... - Tom's Hardware,"{'href': 'https://www.tomshardware.com', 'title': ""Tom's Hardware""}"
2020-09-24 07:00:00+00:00,Boundary Ray Tracing Benchmark Now Available for Download - Wccftech,"{'href': 'https://wccftech.com', 'title': 'Wccftech'}"
2020-09-18 07:00:00+00:00,"Fortnite Ray Tracing is now on PC, here is how it will affect your gameplay - Sportskeeda","{'href': 'https://www.sportskeeda.com', 'title': 'Sportskeeda'}"
2020-09-18 07:00:00+00:00,Corsair Announces The VENGEANCE i7200 Series Featuring Up To An RTX 3090 Alongside Intel’s 10th Gen CPUs - Wccftech,"{'href': 'https://wccftech.com', 'title': 'Wccftech'}"
2020-09-28 07:00:00+00:00,LG Rolls Out OLED Black Screen Fix – channelnews - ChannelNews,"{'href': 'https://www.channelnews.com.au', 'title': 'ChannelNews'}"
2020-09-18 07:00:00+00:00,The Asus ROG Zephyrus G14 has progressed beyond the need for ... - The Verge,"{'href': 'https://www.theverge.com', 'title': 'The Verge'}"
2020-09-15 07:00:00+00:00,Lenovo ThinkStation P920 Tower Workstation Review Quadro RTX 8000 - StorageReview.com,"{'href': 'https://www.storagereview.com', 'title': 'StorageReview.com'}"
2020-09-16 07:00:00+00:00,"First third-party benchmarks for the NVIDIA GeForce RTX3080, is 30 ... - DSOGaming","{'href': 'https://www.dsogaming.com', 'title': 'DSOGaming'}"
2020-09-18 07:00:00+00:00,What Apple’s new rules actually say about streaming Xbox and ... - The Verge,"{'href': 'https://www.theverge.com', 'title': 'The Verge'}"
2020-09-18 07:00:00+00:00,Cyberpunk 2077 minimum and recommended PC specs - Shacknews,"{'href': 'https://www.shacknews.com', 'title': 'Shacknews'}"
2020-09-23 07:00:00+00:00,"Coupang delves into computer parts biz, outcompeting go-betweens - The Korea Herald","{'href': 'https://www.koreaherald.com', 'title': 'The Korea Herald'}"
2020-09-23 07:00:00+00:00,Marques Brownlee mindblown by incredible 8K Forza Horizon ... - Dexerto,"{'href': 'https://www.dexerto.com', 'title': 'Dexerto'}"
2020-09-23 07:00:00+00:00,The Nasdaq PHLX Semiconductor Index: Powering Innovation Across Thematic Tech - Nasdaq,"{'href': 'https://www.nasdaq.com', 'title': 'Nasdaq'}"
2020-09-20 07:00:00+00:00,This week in PC gaming: Left 4 Dead 2's first major update in 10 ... - PC Gamer,"{'href': 'https://www.pcgamer.com', 'title': 'PC Gamer'}"
2020-09-18 07:00:00+00:00,Edge AI box powers up with Jetson AGX Xavier - LinuxGizmos.com,"{'href': 'https://linuxgizmos.com', 'title': 'LinuxGizmos.com'}"
2020-09-16 07:00:00+00:00,Crysis Remastered runs with 38fps at 1080p on Very High settings on an NVIDIA RTX2080Ti - DSOGaming,"{'href': 'https://www.dsogaming.com', 'title': 'DSOGaming'}"
2020-09-21 07:00:00+00:00,"AMD Navi 21 “Big Navi GPU” For Radeon RX 6900 XT Reportedly Features 16 GB VRAM, Radeon RX 6000 Cards With Navi 22 Get 12 GB VRAM - Wccftech","{'href': 'https://wccftech.com', 'title': 'Wccftech'}"
2020-09-18 07:00:00+00:00,TSMC's Estimated Wafer Prices Revealed: 300mm Wafer at 5nm Is ... - Tom's Hardware,"{'href': 'https://www.tomshardware.com', 'title': ""Tom's Hardware""}"
2020-09-15 07:00:00+00:00,ASUS ramps up the ROG 10th Gen Intel Core portfolio with bunch of ... - The Mobile Indian,"{'href': 'https://www.themobileindian.com', 'title': 'The Mobile Indian'}"
2020-09-16 07:00:00+00:00,"Bill Gates Sr., father of Microsoft cofounder Bill Gates, dies at age 94 - Business Insider India","{'href': 'https://www.businessinsider.in', 'title': 'Business Insider India'}"
2020-09-18 07:00:00+00:00,How a Bot Bought Dozens of RTX 3080 Units Before Consumers ... - Medium,"{'href': 'https://medium.com', 'title': 'Medium'}"
2020-09-25 07:00:00+00:00,LG’s 55-Inch B9 Series: The Value King of OLED HDTVs - The National Interest Online,"{'href': 'https://nationalinterest.org', 'title': 'The National Interest Online'}"
2020-09-23 07:00:00+00:00,AOC C27G2ZU review: Great value 240Hz G-Sync and FreeSync ... - Windows Central,"{'href': 'https://www.windowscentral.com', 'title': 'Windows Central'}"
2020-09-17 07:00:00+00:00,"Major pharma companies, including Novartis and Merck, build ... - VentureBeat","{'href': 'https://venturebeat.com', 'title': 'VentureBeat'}"
2020-09-29 07:00:00+00:00,MINISFORUM EliteMini H31G now available for $399 and up (mini ... - Liliputing,"{'href': 'https://liliputing.com', 'title': 'Liliputing'}"
2020-09-17 07:00:00+00:00,Geforce RTX 3080: Custom-Designs in der Übersicht - Taktraten ... - PC Games Hardware,"{'href': 'https://www.pcgameshardware.de', 'title': 'PC Games Hardware'}"
2020-09-24 07:00:00+00:00,5nm wafer costs double says AI chip report ... - eeNews Europe,"{'href': 'https://www.eenewseurope.com', 'title': 'eeNews Europe'}"
2020-09-15 07:00:00+00:00,Vulkan Present Timing Extension With Aim To Avoid Stuttering - Phoronix,"{'href': 'https://www.phoronix.com', 'title': 'Phoronix'}"
2020-09-16 07:00:00+00:00,Acer Aspire 3 A317-51G in review: 17.3-inch all-rounder offers 2 TB ... - Notebookcheck.net,"{'href': 'https://www.notebookcheck.net', 'title': 'Notebookcheck.net'}"
2020-09-16 07:00:00+00:00,Intel Xe DG2 Discrete GPU For Tiger Lake-H Reportedly Spied With Up To 8GB GDDR6 - Hot Hardware,"{'href': 'https://hothardware.com', 'title': 'Hot Hardware'}"
2020-10-05 07:00:00+00:00,Nvidia Opens GTC with Plans for AI Supercomputer for Biomedical ... - HPCwire,"{'href': 'https://www.hpcwire.com', 'title': 'HPCwire'}"
2020-10-05 16:06:55+00:00,Nvidia pledges to build UK's largest supercomputer after ... - FierceTelecom,"{'href': 'https://www.fiercetelecom.com', 'title': 'FierceTelecom'}"
2020-10-05 07:00:00+00:00,NVIDIA To Develop 400 Petaflop DGX A100 Supercomputer For UK AI Research - Hot Hardware,"{'href': 'https://hothardware.com', 'title': 'Hot Hardware'}"
2020-10-05 07:00:00+00:00,Nvidia CEO: GeForce RTX 3080 and 3090 Shortages To Last Until ... - Tom's Hardware,"{'href': 'https://www.tomshardware.com', 'title': ""Tom's Hardware""}"
2020-10-06 07:00:00+00:00,NVIDIA Has A Warning About Geforce RTX 3080 And 3090 Stock - Forbes,"{'href': 'https://www.forbes.com', 'title': 'Forbes'}"
2020-10-05 07:00:00+00:00,"Nvidia RTX A6000 and A40 target pro artists, designers, engineers ... - HEXUS","{'href': 'https://hexus.net', 'title': 'HEXUS'}"
2020-10-05 07:00:00+00:00,"Nvidia Pitches DPUs, Yet Another Way to Free Up the Data Center ... - Data Center Knowledge","{'href': 'https://www.datacenterknowledge.com', 'title': 'Data Center Knowledge'}"
2020-10-02 07:00:00+00:00,Nvidia RTX 3070 Delayed Until the End of October - IGN,"{'href': 'https://www.ign.com', 'title': 'IGN'}"
2020-10-05 07:00:00+00:00,Nvidia says its AI can fix some of the biggest problems in video calls - The Verge,"{'href': 'https://www.theverge.com', 'title': 'The Verge'}"
2020-10-05 07:00:00+00:00,Build a Face Recognition System for $60 with the New Nvidia Jetson ... - Medium,"{'href': 'https://medium.com', 'title': 'Medium'}"
2020-10-09 07:00:00+00:00,Founders Edition RTX 3080 and RTX 3090s Cut From Nvidia Store ... - Tom's Hardware,"{'href': 'https://www.tomshardware.com', 'title': ""Tom's Hardware""}"
2020-10-05 07:00:00+00:00,Nvidia announces open beta for Omniverse as a 'metaverse' for ... - VentureBeat,"{'href': 'https://venturebeat.com', 'title': 'VentureBeat'}"
2020-10-06 07:00:00+00:00,Deepfake Yourself with Nvidia Maxine's Video Chat Tools - Tom's Hardware,"{'href': 'https://www.tomshardware.com', 'title': ""Tom's Hardware""}"
2020-10-08 07:00:00+00:00,Huang ‘Confident’ Nvidia-Arm Deal Will Get Past Regulators - EE Times,"{'href': 'https://www.eetimes.com', 'title': 'EE Times'}"
2020-10-12 07:00:00+00:00,"Nvidia Removes RTX 3080, RTX 3090 From Online Store - Forbes","{'href': 'https://www.forbes.com', 'title': 'Forbes'}"
2020-10-07 07:00:00+00:00,Should I buy an Nvidia GeForce GTX 1660 Super? - PC Gamer,"{'href': 'https://www.pcgamer.com', 'title': 'PC Gamer'}"
2020-10-07 07:00:00+00:00,NVIDIA (NVDA) Could Break Out to New Highs - Investopedia,"{'href': 'https://www.investopedia.com', 'title': 'Investopedia'}"
2020-10-13 07:00:00+00:00,Arm co-founder: Nvidia takeover would create another US tech monopoly - The Guardian,"{'href': 'https://www.theguardian.com', 'title': 'The Guardian'}"
2020-10-09 07:00:00+00:00,How to download Nvidia drivers to update your graphics - Business Insider,"{'href': 'https://www.businessinsider.com', 'title': 'Business Insider'}"
2020-10-12 07:00:00+00:00,How to enable Nvidia Reflex in Apex Legends - Dexerto,"{'href': 'https://www.dexerto.com', 'title': 'Dexerto'}"
2020-10-08 07:00:00+00:00,Nvidia Deepens Arm Alliances - HPCwire,"{'href': 'https://www.hpcwire.com', 'title': 'HPCwire'}"
2020-10-05 07:00:00+00:00,"NVIDIA Announces Ready-Made NVIDIA DGX SuperPODs, Offered ... - GlobeNewswire","{'href': 'https://www.globenewswire.com', 'title': 'GlobeNewswire'}"
2020-10-14 07:00:00+00:00,"Nvidia to shift RTX 30 GPUs to TSMC 7nm in 2021, says report ... - HEXUS","{'href': 'https://hexus.net', 'title': 'HEXUS'}"
2020-10-05 07:00:00+00:00,NVIDIA AI Model Accurately Predicts Oxygen Needs for COVID-19 ... - HIT Consultant,"{'href': 'https://hitconsultant.net', 'title': 'HIT Consultant'}"
2020-10-06 07:00:00+00:00,Supermicro's new high density 4U server with NVIDIA HGX A100s 8 ... - PCR-online.biz,"{'href': 'https://pcr-online.biz', 'title': 'PCR-online.biz'}"
2020-10-06 17:56:10+00:00,Nvidia Opens Beta for Design Collaboration Tool - ARCHITECT Magazine,"{'href': 'https://www.architectmagazine.com', 'title': 'ARCHITECT Magazine'}"
2020-10-12 07:00:00+00:00,Could Nvidia's $40B Arm Gamble Get Stuck at the Edge? - Data Center Knowledge,"{'href': 'https://www.datacenterknowledge.com', 'title': 'Data Center Knowledge'}"
2020-10-13 07:00:00+00:00,More On NVIDIA Quadro Brand Retirement: Embracing the Graphics ... - AnandTech,"{'href': 'https://www.anandtech.com', 'title': 'AnandTech'}"
2020-10-07 07:00:00+00:00,GeForce 456.71 WHQL driver download - guru3d.com,"{'href': 'https://www.guru3d.com', 'title': 'guru3d.com'}"
2020-10-12 07:00:00+00:00,Nvidia uses AI to reduce video conferencing data use by 10x ... - HEXUS,"{'href': 'https://hexus.net', 'title': 'HEXUS'}"
2020-10-11 07:00:00+00:00,What Is A Data Processing Unit (DPU) And Why Is NVIDIA Betting On It? - Forbes,"{'href': 'https://www.forbes.com', 'title': 'Forbes'}"
2020-10-02 07:00:00+00:00,Nvidia pushes RTX 3070 launch back to October 29 to help its ... - GSMArena.com,"{'href': 'https://www.gsmarena.com', 'title': 'GSMArena.com'}"
2020-10-06 07:00:00+00:00,India's Fastest HPC-AI Supercomputer PARAM Siddhi – AI to be ... - IndianWeb2.com,"{'href': 'https://www.indianweb2.com', 'title': 'IndianWeb2.com'}"
2020-10-01 07:00:00+00:00,How to Get the New Google TV UI on Android TV — Nvidia Shield ... - Gadget Hacks,"{'href': 'https://www.gadgethacks.com', 'title': 'Gadget Hacks'}"
2020-10-08 07:00:00+00:00,NVIDIA's AI-Based Video Compression Reduces Bandwidth to One ... - TV Technology,"{'href': 'https://www.tvtechnology.com', 'title': 'TV Technology'}"
2020-10-12 07:00:00+00:00,Nvidia Previews Ampere Kicker To Turing GPU Accelerator - The Next Platform,"{'href': 'https://www.nextplatform.com', 'title': 'The Next Platform'}"
2020-10-07 07:00:00+00:00,Kubota taps Nvidia tech for smart-farming autonomous tractors - Nikkei Asia,"{'href': 'https://asia.nikkei.com', 'title': 'Nikkei Asia'}"
2020-10-15 07:00:00+00:00,NVIDIA Reflex now available for Apex Legends; Watch Dogs Legion ... - Tech Critter,"{'href': 'https://www.tech-critter.com', 'title': 'Tech Critter'}"
2020-10-07 07:00:00+00:00,NVIDIA Shield vs. Roku Ultra: Which should you buy? - Android Central,"{'href': 'https://www.androidcentral.com', 'title': 'Android Central'}"
2020-10-13 07:00:00+00:00,This is the cheapest GeForce RTX 3090 PC workstation we've found - TechRadar,"{'href': 'https://www.techradar.com', 'title': 'TechRadar'}"
2020-10-05 07:00:00+00:00,Autonomous Trucking Startup Locomation to Leverage Nvidia Drive ... - Business Wire,"{'href': 'https://www.businesswire.com', 'title': 'Business Wire'}"
2020-10-09 07:00:00+00:00,NVIDIA Jetson Nano: Raspberry Pi alternative gets cheaper US$54 ... - Notebookcheck.net,"{'href': 'https://www.notebookcheck.net', 'title': 'Notebookcheck.net'}"
2020-10-08 07:00:00+00:00,"Nvidia Jarvis, new conversational AI tool, now in open beta - TechTarget","{'href': 'https://www.techtarget.com', 'title': 'TechTarget'}"
2020-10-07 07:00:00+00:00,Nvidia's Solution for Bad Video Calls Is a Neural Network - Gizmodo,"{'href': 'https://gizmodo.com', 'title': 'Gizmodo'}"
2020-10-08 07:00:00+00:00,Nvidia's OC Scanner Receives Major Changes for RTX 3000 Series ... - Tom's Hardware,"{'href': 'https://www.tomshardware.com', 'title': ""Tom's Hardware""}"
2020-10-04 07:00:00+00:00,Warzone: How To Turn On Nvidia Reflex - TheGamer,"{'href': 'https://www.thegamer.com', 'title': 'TheGamer'}"
2020-10-08 07:00:00+00:00,NVIDIA Jetson Nano 2GB development kit $99 - Geeky Gadgets,"{'href': 'https://www.geeky-gadgets.com', 'title': 'Geeky Gadgets'}"
2020-10-13 07:00:00+00:00,Nvidia Maxine reinvents the video call with AI - TechHQ,"{'href': 'https://techhq.com', 'title': 'TechHQ'}"
2020-10-13 07:00:00+00:00,Nvidia's new 360Hz monitors are going to have a must-have feature ... - TechRadar,"{'href': 'https://www.techradar.com', 'title': 'TechRadar'}"
2020-10-05 07:00:00+00:00,Should I buy the Nvidia GeForce GTX 1650 Super? - TechRadar,"{'href': 'https://www.techradar.com', 'title': 'TechRadar'}"
2020-10-10 07:00:00+00:00,Defense awards for Intel SHIP project now top $156M - FierceElectronics,"{'href': 'https://www.fierceelectronics.com', 'title': 'FierceElectronics'}"
2020-10-06 07:00:00+00:00,Nvidia RTX 3080 Gaming Performance at 1440p: CPU or ... - TechSpot,"{'href': 'https://www.techspot.com', 'title': 'TechSpot'}"
2020-10-08 07:00:00+00:00,NVIDIA to Launch CloudXR Streaming on Amazon’s Cloud Platform Early Next Year - Road to VR,"{'href': 'https://www.roadtovr.com', 'title': 'Road to VR'}"
2020-10-01 07:00:00+00:00,Arm sale to NVIDIA: Cambridge MP Daniel Zeichner says government is asleep at the wheel - Cambridge Independent,"{'href': 'https://www.cambridgeindependent.co.uk', 'title': 'Cambridge Independent'}"
2020-10-08 07:00:00+00:00,New Alienware High Performance Gaming Monitors Get Details And Pricing - Wccftech,"{'href': 'https://wccftech.com', 'title': 'Wccftech'}"
2020-10-07 07:00:00+00:00,"Intel, Nvidia launch new networking processor initiatives - Network World","{'href': 'https://www.networkworld.com', 'title': 'Network World'}"
2020-10-05 07:00:00+00:00,NVIDIA's CloudXR brings photorealistic VR to mobile headsets - TweakTown,"{'href': 'https://www.tweaktown.com', 'title': 'TweakTown'}"
2020-10-07 07:00:00+00:00,Nvidia vs. AMD: A look at the factors that make NVDA a better ... - AlphaStreet,"{'href': 'https://news.alphastreet.com', 'title': 'AlphaStreet'}"
2020-10-08 07:00:00+00:00,Does Nvidia ultra performance DLSS make 8K gaming viable? - Eurogamer.net,"{'href': 'https://www.eurogamer.net', 'title': 'Eurogamer.net'}"
2020-10-02 07:00:00+00:00,EVGA GeForce RTX 3080 FTW3 Ultra review: Built to push a ... - PCWorld,"{'href': 'https://www.pcworld.com', 'title': 'PCWorld'}"
2020-10-02 07:00:00+00:00,Palit GeForce RTX GamingPro OC review - PC Gamer,"{'href': 'https://www.pcgamer.com', 'title': 'PC Gamer'}"
2020-10-08 07:00:00+00:00,NVIDIA NeMo: An Open-Source Toolkit For Developing State-Of-The-Art Conversational AI Models In Three Lines Of Code - MarkTechPost,"{'href': 'https://www.marktechpost.com', 'title': 'MarkTechPost'}"
2020-10-06 07:00:00+00:00,NVIDIA RTX 3090 Runs Crysis 3 Installed On Its VRAM - SlashGear,"{'href': 'https://www.slashgear.com', 'title': 'SlashGear'}"
2020-10-05 07:00:00+00:00,MSI GeForce RTX 3080 Gaming X Trio 10G review - PC Gamer,"{'href': 'https://www.pcgamer.com', 'title': 'PC Gamer'}"
2020-10-02 07:00:00+00:00,Nvidia's hotfix GPU driver resolves a black screen G-Sync issue and ... - PC Gamer,"{'href': 'https://www.pcgamer.com', 'title': 'PC Gamer'}"
2020-10-05 07:00:00+00:00,C-DAC to commission India’s fastest HPC-AI Supercomputer ‘PARAM Siddhi – AI’ with NVIDIA - Economic Times,"{'href': 'https://economictimes.indiatimes.com', 'title': 'Economic Times'}"
2020-10-11 07:00:00+00:00,"Warframe graphical upgrades are coming, RTX and DLSS could be ... - TweakTown","{'href': 'https://www.tweaktown.com', 'title': 'TweakTown'}"
2020-10-02 07:00:00+00:00,Serious Sam 4 Laptop and Desktop Benchmarks - Notebookcheck.net,"{'href': 'https://www.notebookcheck.net', 'title': 'Notebookcheck.net'}"
2020-10-12 07:00:00+00:00,Windows 10 graphics: GPU-powered AV1 video compression ... - ZDNet,"{'href': 'https://www.zdnet.com', 'title': 'ZDNet'}"
2020-10-12 07:00:00+00:00,Watch Dogs Legion Raytraced Reflections Actually Require RTX 3080 GPU and DLSS Performance Mode at 4K@Ultra - Wccftech,"{'href': 'https://wccftech.com', 'title': 'Wccftech'}"
2020-10-13 07:00:00+00:00,"The Turtles, yes those Turtles, are coming to Smite - Destructoid","{'href': 'https://www.destructoid.com', 'title': 'Destructoid'}"
2020-10-02 10:31:38+00:00,Best RTX 3090 graphics card 2023 - WePC - PC Tech & PC Gaming News,"{'href': 'https://www.wepc.com', 'title': 'WePC - PC Tech & PC Gaming News'}"
2020-10-02 07:00:00+00:00,Intel and DOE enter long-term collaboration on advanced computing - FierceElectronics,"{'href': 'https://www.fierceelectronics.com', 'title': 'FierceElectronics'}"
2020-10-07 07:00:00+00:00,How to Access Preference Panes Directly from macOS Dock - Beebom,"{'href': 'https://beebom.com', 'title': 'Beebom'}"
