date,title,publisher
2020-04-07 07:00:00+00:00,Nvidia's next-gen server GPU has appeared online - PC Gamer,"{'href': 'https://www.pcgamer.com', 'title': 'PC Gamer'}"
2020-04-05 07:00:00+00:00,NVIDIA DLSS 2.0 Behind the Scenes – How the Magic Happens - Wccftech,"{'href': 'https://wccftech.com', 'title': 'Wccftech'}"
2020-04-05 07:00:00+00:00,Can Fujitsu beat Nvidia in the HPC race? - Network World,"{'href': 'https://www.networkworld.com', 'title': 'Network World'}"
2020-04-13 07:00:00+00:00,ASUS Releases Graphics Card That Could Actually Be Great For ... - Phoronix,"{'href': 'https://www.phoronix.com', 'title': 'Phoronix'}"
2020-04-12 07:00:00+00:00,NVIDIA Silently Refresh Turing GeForce RTX 2070 And RTX 2060 Laptop GPUs To Tackle AMD’s Radeon RX 5700M And RX 5600M - Wccftech,"{'href': 'https://wccftech.com', 'title': 'Wccftech'}"
2020-04-09 07:00:00+00:00,DLSS 2.0 tested: why you should finally turn on Nvidia's AI-powered ... - PC Gamer,"{'href': 'https://www.pcgamer.com', 'title': 'PC Gamer'}"
2020-04-08 07:00:00+00:00,"Upended by COVID-19, job market for tech craters - FierceElectronics","{'href': 'https://www.fierceelectronics.com', 'title': 'FierceElectronics'}"
2020-04-04 07:00:00+00:00,2nd Gen NVIDIA Max-Q Technology : What’s New? - Tech ARP,"{'href': 'https://www.techarp.com', 'title': 'Tech ARP'}"
2020-04-09 07:00:00+00:00,Updated: Cyberpunk 2077 NVIDIA RTX 2080 Ti's sold at Auction for ... - guru3d.com,"{'href': 'https://www.guru3d.com', 'title': 'guru3d.com'}"
2020-04-02 07:00:00+00:00,Resident Evil 3 PC performance: the Nvidia GeForce GTX 1060 is ... - TechRadar,"{'href': 'https://www.techradar.com', 'title': 'TechRadar'}"
2020-04-05 07:00:00+00:00,NVIDIA DLSS 2.0 Review with Control - Is This Magic? | TechQuila - TechQuila,"{'href': 'https://www.techquila.co.in', 'title': 'TechQuila'}"
2020-04-13 07:00:00+00:00,"TSMC CoWoS Production At Full Capacity As Demand Skyrockets – Nvidia, AMD, And More Trying To Get Their Hands On Interposers - Wccftech","{'href': 'https://wccftech.com', 'title': 'Wccftech'}"
2020-04-07 07:00:00+00:00,The GeForce GTX 1650 GDDR6 is official | bit-tech.net - bit-tech.net,"{'href': 'https://bit-tech.net', 'title': 'bit-tech.net'}"
2020-04-14 08:05:29+00:00,Colorful Reveals 3 New Nvidia 1650 (GDDR6) GPUs - eTeknix,"{'href': 'https://www.eteknix.com', 'title': 'eTeknix'}"
2020-04-01 07:00:00+00:00,GeForce GTX 1650 with GDDR6 spotted on Gigabyte website - guru3d.com,"{'href': 'https://www.guru3d.com', 'title': 'guru3d.com'}"
2020-04-02 07:00:00+00:00,Gigabyte updates its gaming and content creator laptops - Laptop ... - HEXUS,"{'href': 'https://hexus.net', 'title': 'HEXUS'}"
2020-04-03 07:00:00+00:00,"The Witcher 3 Nintendo Switch CPU, Memory and Build Size Optimizations Detailed in New GTC 2020 Video - Wccftech","{'href': 'https://wccftech.com', 'title': 'Wccftech'}"
2020-04-14 07:00:00+00:00,"TSMC CoWoS, Nvidia and AMD are seeking technology for their ... - Optocrypto","{'href': 'https://optocrypto.com', 'title': 'Optocrypto'}"
2020-04-08 07:00:00+00:00,Huawei will enter the GPU market in 2020 – poaching NVIDIA’s recruit - Gizchina.com,"{'href': 'https://www.gizchina.com', 'title': 'Gizchina.com'}"
2020-04-02 07:00:00+00:00,Razer's Blade 15 packs an 8-core Intel CPU and RTX 2080 Super - Engadget,"{'href': 'https://www.engadget.com', 'title': 'Engadget'}"
2020-04-09 07:00:00+00:00,From the MSI GS66 Stealth to the Razer Blade 15: Here are the best gaming laptops of 2020 - Moneycontrol,"{'href': 'https://www.moneycontrol.com', 'title': 'Moneycontrol'}"
2020-04-14 07:00:00+00:00,Microsoft Surface Book 3 will be powered by 10th gen Intel CPUs ... - MSPoweruser,"{'href': 'https://mspoweruser.com', 'title': 'MSPoweruser'}"
2020-04-06 07:00:00+00:00,AMID EVIL Is Getting DLSS 2.0; Raytraced Shadows and New Level Already Out - Wccftech,"{'href': 'https://wccftech.com', 'title': 'Wccftech'}"
2020-04-10 07:00:00+00:00,Coffee Lake based edge AI computer supports Nvidia Tesla T4 - LinuxGizmos.com,"{'href': 'https://linuxgizmos.com', 'title': 'LinuxGizmos.com'}"
2020-04-07 07:00:00+00:00,Hardware acceleration 5G vRAN -a case for GPU - Ericsson,"{'href': 'https://www.ericsson.com', 'title': 'Ericsson'}"
2020-04-14 07:00:00+00:00,"Huawei might be making a graphics card, but it wouldn't be for ... - PC Gamer","{'href': 'https://www.pcgamer.com', 'title': 'PC Gamer'}"
2020-04-07 07:00:00+00:00,Cyberpunk 2077 Nvidia RTX 2080 Ti cards are selling for over $4000 - PC Gamer,"{'href': 'https://www.pcgamer.com', 'title': 'PC Gamer'}"
2020-04-01 07:00:00+00:00,Intel Optane Gaming Boost Leaked – Offloads Storage Intensive Tasks To SSD For Up To 50% Faster Gaming Performance [April Fool’s Joke] - Wccftech,"{'href': 'https://wccftech.com', 'title': 'Wccftech'}"
2020-04-02 07:00:00+00:00,Test DLSS 2.0 : NVIDIA fait bondir les performances et améliore la ... - Tomsguide,"{'href': 'https://www.tomsguide.fr', 'title': 'Tomsguide'}"
2020-04-02 07:00:00+00:00,Gigabyte GeForce GTX 1650 with GDDR6 memory spotted ... - HEXUS,"{'href': 'https://hexus.net', 'title': 'HEXUS'}"
2020-04-10 07:00:00+00:00,Linux on Laptops: ASUS Zephyrus G14 with Ryzen 9 4900HS - Ars Technica,"{'href': 'https://arstechnica.com', 'title': 'Ars Technica'}"
2020-04-03 07:00:00+00:00,"HP launches a new $1,250 Envy 17, reviving the glory days of 17-inch laptops - Digital Trends","{'href': 'https://www.digitaltrends.com', 'title': 'Digital Trends'}"
2020-04-04 07:00:00+00:00,Call of Duty Warzone PC performance report - Graphics card ... - Game Debate,"{'href': 'https://www.game-debate.com', 'title': 'Game Debate'}"
2020-04-02 07:00:00+00:00,"Ray Tracing Gets Its First Open-Source, Cross-Platform ... - Indie Ranger","{'href': 'https://indieranger.com', 'title': 'Indie Ranger'}"
2020-04-01 07:00:00+00:00,Gumstix's Nano carrier quartet includes Snapshot board for ... - LinuxGizmos.com,"{'href': 'https://linuxgizmos.com', 'title': 'LinuxGizmos.com'}"
2020-04-08 07:00:00+00:00,Lenovo and Mechdyne offer 120-day TGX trial during quarantine - Graphic Speak,"{'href': 'https://gfxspeak.com', 'title': 'Graphic Speak'}"
2020-04-01 07:00:00+00:00,Illuminating the Path Ahead for Real-Time Ray Tracing - VFX Voice,"{'href': 'https://www.vfxvoice.com', 'title': 'VFX Voice'}"
2020-04-05 07:00:00+00:00,Resident Evil 3 Remake PC performance report - Graphics card ... - Game Debate,"{'href': 'https://www.game-debate.com', 'title': 'Game Debate'}"
2020-04-12 07:00:00+00:00,"Artificial Intelligence Society, Nvidia Deep Learning Institute join ... - News of Bahrain- DT News","{'href': 'https://www.newsofbahrain.com', 'title': 'News of Bahrain- DT News'}"
2020-04-08 07:00:00+00:00,How 5G and edge computing can enhance virtual reality - Ericsson,"{'href': 'https://www.ericsson.com', 'title': 'Ericsson'}"
2020-04-03 07:00:00+00:00,Ghost Recon: Breakpoint Vulkan vs DX11 performance analysis - KitGuru,"{'href': 'https://www.kitguru.net', 'title': 'KitGuru'}"
2020-04-09 07:00:00+00:00,Samsung to design a custom Exynos chip for Google - GSMArena.com,"{'href': 'https://www.gsmarena.com', 'title': 'GSMArena.com'}"
2020-04-13 07:00:00+00:00,"Object storage vendors turn to analytics, AI, machine learning - TechTarget","{'href': 'https://www.techtarget.com', 'title': 'TechTarget'}"
2020-04-07 07:00:00+00:00,Lenovo ThinkPad P1 vs. ThinkPad P53: Which is better for you? - Windows Central,"{'href': 'https://www.windowscentral.com', 'title': 'Windows Central'}"
2020-04-10 07:00:00+00:00,Gigabyte GeForce GTX 1650 WindForce OC GDDR6 review - guru3d.com,"{'href': 'https://www.guru3d.com', 'title': 'guru3d.com'}"
2020-04-07 07:00:00+00:00,Microsoft's Xbox Game Bar is getting custom widgets and its own ... - The Verge,"{'href': 'https://www.theverge.com', 'title': 'The Verge'}"
2020-04-09 07:00:00+00:00,Karma Automotive Debuts All-New Level 4 Autonomous Van E-Flex ... - PR Newswire,"{'href': 'https://www.prnewswire.com', 'title': 'PR Newswire'}"
2020-04-05 07:00:00+00:00,Resident Evil 3 8K performance: has the $2500 RTX Titan met its ... - TechRadar,"{'href': 'https://www.techradar.com', 'title': 'TechRadar'}"
2020-04-13 07:00:00+00:00,Lenovo Legion smartphone teased to feature 90W fast charging - GSMArena.com,"{'href': 'https://www.gsmarena.com', 'title': 'GSMArena.com'}"
2020-04-07 07:00:00+00:00,"Techland talks a bit about Ray Tracing in Dying Light 2, will make ... - DSOGaming","{'href': 'https://www.dsogaming.com', 'title': 'DSOGaming'}"
2020-04-03 07:00:00+00:00,Doom Eternal Black Flickering | How to fix - Game Revolution,"{'href': 'https://www.gamerevolution.com', 'title': 'Game Revolution'}"
2020-04-08 07:00:00+00:00,How to get 4:3 aspect ratio (stretched resolution and black bars) in ... - Dot Esports,"{'href': 'https://dotesports.com', 'title': 'Dot Esports'}"
2020-04-01 07:00:00+00:00,I Need Speed: MSI Reveals Optix MAG251RX 240Hz IPS Gaming ... - AnandTech,"{'href': 'https://www.anandtech.com', 'title': 'AnandTech'}"
2020-04-01 07:00:00+00:00,GabeN Sees Single Player Games Making a Comeback Against Multiplayer Thanks to AI - Wccftech,"{'href': 'https://wccftech.com', 'title': 'Wccftech'}"
2020-04-09 07:00:00+00:00,What laptop to buy: It's a good time to shop for PC notebook computers - USA TODAY,"{'href': 'https://www.usatoday.com', 'title': 'USA TODAY'}"
2020-04-10 07:00:00+00:00,Startup Tenstorrent shows AI is changing computing and vice versa - ZDNet,"{'href': 'https://www.zdnet.com', 'title': 'ZDNet'}"
2020-04-08 07:00:00+00:00,Tech giants pool supercomputers to fight COVID-19 | Information ... - ACS,"{'href': 'https://ia.acs.org.au', 'title': 'ACS'}"
2020-04-14 07:00:00+00:00,How Supercomputers Are Being Used to Win the Fight Against ... - Newsweek,"{'href': 'https://www.newsweek.com', 'title': 'Newsweek'}"
2020-04-01 07:00:00+00:00,Resident Evil Resistance beta now available on Steam - guru3d.com,"{'href': 'https://www.guru3d.com', 'title': 'guru3d.com'}"
2020-04-05 07:00:00+00:00,Acer Predator new gaming laptops with new RTX graphics - TweakTown,"{'href': 'https://www.tweaktown.com', 'title': 'TweakTown'}"
2020-04-02 07:00:00+00:00,"More blistering fast 300Hz gaming laptops are coming, but is it all ... - PC Gamer","{'href': 'https://www.pcgamer.com', 'title': 'PC Gamer'}"
2020-04-07 07:00:00+00:00,Download: AIDA64 v6.25 is released - guru3d.com,"{'href': 'https://www.guru3d.com', 'title': 'guru3d.com'}"
2020-04-07 07:00:00+00:00,"Tenstorrent reveals Grayskull, an all-in-one system that accelerates ... - VentureBeat","{'href': 'https://venturebeat.com', 'title': 'VentureBeat'}"
2020-04-06 07:00:00+00:00,ORIGIN PC Equips Its EON15-X Enthusiast Laptop With AMD Ryzen 9 3900 12 Core CPU & NVIDIA’s GeForce RTX 2070 GPU - Wccftech,"{'href': 'https://wccftech.com', 'title': 'Wccftech'}"
2020-04-05 07:00:00+00:00,Invest in Many Types of AI Chips With One Stock - Nanalyze,"{'href': 'https://www.nanalyze.com', 'title': 'Nanalyze'}"
2020-04-06 07:00:00+00:00,Maneater's barracuda is lying low in the weeds and I bet it's gonna ... - Destructoid,"{'href': 'https://www.destructoid.com', 'title': 'Destructoid'}"
2020-04-14 07:00:00+00:00,"LG adds the ""X"" factor to its 2020 OLED range – Pickr - Pickr","{'href': 'https://www.pickr.com.au', 'title': 'Pickr'}"
2020-04-02 07:00:00+00:00,"Epic Games Store Spring Sale Includes Deals on Control, Red Dead Redemption 2, and More - Wccftech","{'href': 'https://wccftech.com', 'title': 'Wccftech'}"
2020-04-01 07:00:00+00:00,ImmunityBio and Microsoft team up to precisely model how key COVID-19 protein leads to infection - TechCrunch,"{'href': 'https://techcrunch.com', 'title': 'TechCrunch'}"
2020-04-01 07:00:00+00:00,Gigabyte Upgrades GeForce GTX 1650 Ti Turing Family With Performance Boosting GDDR6 - Hot Hardware,"{'href': 'https://hothardware.com', 'title': 'Hot Hardware'}"
2020-04-08 07:00:00+00:00,Techland talks a bit about Ray Tracing in Dying Light 2 - guru3d.com,"{'href': 'https://www.guru3d.com', 'title': 'guru3d.com'}"
2020-04-06 07:00:00+00:00,"Luxion Adds NVLink Support To KeyShot 9.2, Updates Standalone... - Techgage","{'href': 'https://techgage.com', 'title': 'Techgage'}"
2020-04-13 07:00:00+00:00,Amazing Half-Life: Alyx PC Build Looks Straight Out Of City 17 - UploadVR,"{'href': 'https://www.uploadvr.com', 'title': 'UploadVR'}"
2020-04-03 07:00:00+00:00,ASUS ROG SWIFT PG43UQ review - Tested - guru3d.com,"{'href': 'https://www.guru3d.com', 'title': 'guru3d.com'}"
2020-04-13 07:00:00+00:00,3 Growth Stocks I'd Buy Right Now - The Motley Fool,"{'href': 'https://www.fool.com', 'title': 'The Motley Fool'}"
2020-04-10 07:00:00+00:00,Final Fantasy VII Remake producer has a message for the fans - Destructoid,"{'href': 'https://www.destructoid.com', 'title': 'Destructoid'}"
2020-04-07 07:00:00+00:00,BlackRock's Aladdin investment management platform to be hosted on Microsoft's cloud - Yahoo Finance,"{'href': 'https://finance.yahoo.com', 'title': 'Yahoo Finance'}"
2020-04-02 07:00:00+00:00,Intel Counters AMD Ryzen Laptop CPUs With Comet Lake H - CRN,"{'href': 'https://www.crn.com', 'title': 'CRN'}"
2020-04-14 07:00:00+00:00,"ASUS Revives The GeForce GT 710 Graphics Card, Now Comes With Quad HDMI Outputs & SFF Design - Wccftech","{'href': 'https://wccftech.com', 'title': 'Wccftech'}"
2020-04-01 07:00:00+00:00,Sabrent Rocket 1TB NVMe SSD review - Introduction - guru3d.com,"{'href': 'https://www.guru3d.com', 'title': 'guru3d.com'}"
2020-04-03 07:00:00+00:00,Rare Video Of Bletchley Park Location During WW2 Emerges - Silicon UK,"{'href': 'https://www.silicon.co.uk', 'title': 'Silicon UK'}"
2020-04-20 07:00:00+00:00,Nvidia attempts to move past GeForce Now squabbles - VentureBeat,"{'href': 'https://venturebeat.com', 'title': 'VentureBeat'}"
2020-04-20 07:00:00+00:00,Nvidia's GeForce Now will lose access to titles from Xbox Game ... - The Verge,"{'href': 'https://www.theverge.com', 'title': 'The Verge'}"
2020-04-21 07:00:00+00:00,"Nvidia GeForce Now loses Warner Bros., Xbox Game Studios games this week - Polygon","{'href': 'https://www.polygon.com', 'title': 'Polygon'}"
2020-04-27 07:00:00+00:00,Nvidia completes 'homerun deal' after closing $7 billion acquisition of Mellanox - CNBC,"{'href': 'https://www.cnbc.com', 'title': 'CNBC'}"
2020-04-27 07:00:00+00:00,Nvidia Plus Mellanox: Talking Datacenter Architecture With Jensen Huang - The Next Platform,"{'href': 'https://www.nextplatform.com', 'title': 'The Next Platform'}"
2020-04-27 07:00:00+00:00,NVIDIA Completes Acquisition of Mellanox - HPCwire,"{'href': 'https://www.hpcwire.com', 'title': 'HPCwire'}"
2020-04-24 07:00:00+00:00,NVIDIA RTX Voice Tested: How To Use GPU AI For Perfect Zoom Conference Audio - Hot Hardware,"{'href': 'https://hothardware.com', 'title': 'Hot Hardware'}"
2020-04-21 07:00:00+00:00,How Nvidia's magical RTX Voice app eradicates background noise ... - PCWorld,"{'href': 'https://www.pcworld.com', 'title': 'PCWorld'}"
2020-04-22 07:00:00+00:00,You can get Nvidia’s “RTX Voice” noise filtering without a pricey RTX card [Updated] - Ars Technica,"{'href': 'https://arstechnica.com', 'title': 'Ars Technica'}"
2020-04-15 07:00:00+00:00,Nvidia's latest GPU driver is ready for the Minecraft with RTX beta - PC Gamer,"{'href': 'https://www.pcgamer.com', 'title': 'PC Gamer'}"
2020-04-16 07:00:00+00:00,Minecraft Nvidia RTX--How To Access The Gorgeous New Beta - GameSpot,"{'href': 'https://www.gamespot.com', 'title': 'GameSpot'}"
2020-04-26 07:00:00+00:00,Winners & Losers: Netflix nails it while developers ditch Nvidia ... - TrustedReviews,"{'href': 'https://www.trustedreviews.com', 'title': 'TrustedReviews'}"
2020-04-29 07:00:00+00:00,NVIDIA GeForce RTX 3080 Ti leaked specs teases an absolute ... - TweakTown,"{'href': 'https://www.tweaktown.com', 'title': 'TweakTown'}"
2020-04-30 07:00:00+00:00,NVIDIA buys Israeli company Mellanox for $7 billion - ISRAEL21c,"{'href': 'https://www.israel21c.org', 'title': 'ISRAEL21c'}"
2020-04-17 07:00:00+00:00,NVIDIA Provides Mellanox Transaction Closing Date – Shares +3% in Pre-Market - Wccftech,"{'href': 'https://wccftech.com', 'title': 'Wccftech'}"
2020-04-20 07:00:00+00:00,Nvidia launches RTX Voice noise suppression plugin - Software ... - HEXUS,"{'href': 'https://hexus.net', 'title': 'HEXUS'}"
2020-04-20 07:00:00+00:00,Is the Coronavirus About to Make NVIDIA Stock a Bargain? - The Motley Fool,"{'href': 'https://www.fool.com', 'title': 'The Motley Fool'}"
2020-04-24 07:00:00+00:00,"NVIDIA GeForce NOW loses all titles from 4 different publishers, but ... - Notebookcheck.net","{'href': 'https://www.notebookcheck.net', 'title': 'Notebookcheck.net'}"
2020-04-20 07:00:00+00:00,Nvidia GeForce RTX 2070 Super vs. AMD Radeon RX 5700 XT ... - TechSpot,"{'href': 'https://www.techspot.com', 'title': 'TechSpot'}"
2020-04-15 07:00:00+00:00,First Tests: Are Nvidia's GeForce RTX Super Laptop Chips a Big ... - PCMag,"{'href': 'https://www.pcmag.com', 'title': 'PCMag'}"
2020-04-22 07:00:00+00:00,NVIDIA RTX Voice works without RTX GPUs with a simple modification - guru3d.com,"{'href': 'https://www.guru3d.com', 'title': 'guru3d.com'}"
2020-04-22 07:00:00+00:00,Nvidia provides online workshops about robotics and AI - Robotics and Automation News,"{'href': 'https://roboticsandautomationnews.com', 'title': 'Robotics and Automation News'}"
2020-04-19 07:00:00+00:00,Mellanox CEO: Nvidia brings big opportunities - Globes - Globes,"{'href': 'https://en.globes.co.il', 'title': 'Globes'}"
2020-04-22 07:00:00+00:00,How to Use NVIDIA Shield TV’s AI Upscaling Feature - Cord Cutters News,"{'href': 'https://cordcuttersnews.com', 'title': 'Cord Cutters News'}"
2020-04-22 07:00:00+00:00,Here's The PC You'll Need To Take Flight In Microsoft Flight Simulator - TheGamer,"{'href': 'https://www.thegamer.com', 'title': 'TheGamer'}"
2020-04-21 07:00:00+00:00,"NVIDIA CEO Hands Out Raises, No Job Cuts surrounding COVID-19 - guru3d.com","{'href': 'https://www.guru3d.com', 'title': 'guru3d.com'}"
2020-04-20 07:00:00+00:00,How to Download the Nvidia Control Panel Without the Microsoft Store - ExtremeTech,"{'href': 'https://www.extremetech.com', 'title': 'ExtremeTech'}"
2020-04-15 07:00:00+00:00,"Welcome back, 2013! Asus presents a ""new"" NVIDIA GeForce GT 710 - Notebookcheck.net","{'href': 'https://www.notebookcheck.net', 'title': 'Notebookcheck.net'}"
2020-04-24 07:00:00+00:00,All the next-gen Intel and Nvidia gaming laptops and when you can ... - PC Gamer,"{'href': 'https://www.pcgamer.com', 'title': 'PC Gamer'}"
2020-04-16 07:00:00+00:00,HP ENVY Laptop Refresh Adds OLED And RTX For 2020 - AnandTech,"{'href': 'https://www.anandtech.com', 'title': 'AnandTech'}"
2020-04-15 07:00:00+00:00,GeForce 445.87 WHQL driver download - guru3d.com,"{'href': 'https://www.guru3d.com', 'title': 'guru3d.com'}"
2020-04-20 07:00:00+00:00,Tested: Minecraft showcases the beauty of ray tracing—and Nvidia's ... - PCWorld,"{'href': 'https://www.pcworld.com', 'title': 'PCWorld'}"
2020-04-16 07:00:00+00:00,"NVIDIA Jetson Xavier NX SoM Launched for $459, Third-Party Carrier Boards & Edge Computers Available - CNX Software","{'href': 'https://www.cnx-software.com', 'title': 'CNX Software'}"
2020-04-29 07:00:00+00:00,Leaked HP OMEN 15 listing confirms AMD Ryzen 7 4800H ... - Notebookcheck.net,"{'href': 'https://www.notebookcheck.net', 'title': 'Notebookcheck.net'}"
2020-04-21 07:00:00+00:00,NVIDIA Announces MONAI Open-Source AI Project - Phoronix,"{'href': 'https://www.phoronix.com', 'title': 'Phoronix'}"
2020-04-25 07:00:00+00:00,"Flashing a MP 4,1 to 5,1 w/ Mojave (NVIDIA GeForce GT 120 512 ... - MacRumors","{'href': 'https://forums.macrumors.com', 'title': 'MacRumors'}"
2020-04-22 07:00:00+00:00,Gigabyte launches its Eagle series GeForce graphics cards ... - HEXUS,"{'href': 'https://hexus.net', 'title': 'HEXUS'}"
2020-04-17 07:00:00+00:00,The new MSI RTX 2080 Ti gets 16Gbps memory and a shot at ... - PC Gamer,"{'href': 'https://www.pcgamer.com', 'title': 'PC Gamer'}"
2020-04-22 07:00:00+00:00,"PlayStation 5 news: Lighter OS, DualSense's Create button is like ... - Notebookcheck.net","{'href': 'https://www.notebookcheck.net', 'title': 'Notebookcheck.net'}"
2020-04-20 07:00:00+00:00,Lenovo launches Legion series of gaming PCs & laptops - FutureFive New Zealand,"{'href': 'https://futurefive.co.nz', 'title': 'FutureFive New Zealand'}"
2020-04-22 07:00:00+00:00,Intel will continue to dominate the premium gaming laptop market ... - Notebookcheck.net,"{'href': 'https://www.notebookcheck.net', 'title': 'Notebookcheck.net'}"
2020-04-21 07:00:00+00:00,WekaIO Launches DataOps AI Pipeline for Data-Starved GPUs - EnterpriseAI,"{'href': 'https://www.enterpriseai.news', 'title': 'EnterpriseAI'}"
2020-04-23 07:00:00+00:00,NVIDIA GeForce Now arrives on Android TV & Xiaomi Mi Box S ... - PiunikaWeb,"{'href': 'https://piunikaweb.com', 'title': 'PiunikaWeb'}"
2020-04-23 07:00:00+00:00,Liqid's Off-the-Shelf AI Supercomputer Takes on DGX-2 - EnterpriseAI,"{'href': 'https://www.enterpriseai.news', 'title': 'EnterpriseAI'}"
2020-04-17 07:00:00+00:00,"Lenovo Refreshes Legion Line-Up: Australian Specs, Pricing And Release Date - Kotaku Australia","{'href': 'https://www.kotaku.com.au', 'title': 'Kotaku Australia'}"
2020-04-21 07:00:00+00:00,Razer's updated Blade Stealth gets a faster display and GPU - Engadget,"{'href': 'https://www.engadget.com', 'title': 'Engadget'}"
2020-04-29 07:00:00+00:00,"New XPS 15, XPS 17 full specs leak on Dell site before promptly ... - Windows Central","{'href': 'https://www.windowscentral.com', 'title': 'Windows Central'}"
2020-04-22 07:00:00+00:00,XPG Enters the Gaming Notebook Market with the 15.6-inch XENIA - AnandTech,"{'href': 'https://www.anandtech.com', 'title': 'AnandTech'}"
2020-04-15 07:00:00+00:00,"D3, Diamond, and CTI unveil carriers for Nvidia's new Xavier NX - LinuxGizmos.com","{'href': 'https://linuxgizmos.com', 'title': 'LinuxGizmos.com'}"
2020-04-24 07:00:00+00:00,Edge AI mini-PC spins up Nvidia's Xavier NX - LinuxGizmos.com,"{'href': 'https://linuxgizmos.com', 'title': 'LinuxGizmos.com'}"
2020-04-15 07:00:00+00:00,Microsoft Surface Book 3 launch imminent as core specs revealed ... - Notebookcheck.net,"{'href': 'https://www.notebookcheck.net', 'title': 'Notebookcheck.net'}"
2020-04-28 07:00:00+00:00,A Better Frame Rate Will Go A Long Way To Getting You The Win In Call Of Duty: Warzone - Press Start Australia,"{'href': 'https://press-start.com.au', 'title': 'Press Start Australia'}"
2020-04-24 07:00:00+00:00,Gigabyte Aorus 17G review - TechRadar,"{'href': 'https://www.techradar.com', 'title': 'TechRadar'}"
2020-04-20 07:00:00+00:00,HP targets digital creatives with new ZBook mobile workstations ... - ZDNet,"{'href': 'https://www.zdnet.com', 'title': 'ZDNet'}"
2020-04-22 07:00:00+00:00,How to upgrade your graphics card - TrustedReviews,"{'href': 'https://www.trustedreviews.com', 'title': 'TrustedReviews'}"
2020-04-17 07:00:00+00:00,COVID-19 kills large Facebook physical events through June 2021 - FierceElectronics,"{'href': 'https://www.fierceelectronics.com', 'title': 'FierceElectronics'}"
2020-04-27 07:00:00+00:00,MotoGP 20 PC Performance Analysis - DSOGaming,"{'href': 'https://www.dsogaming.com', 'title': 'DSOGaming'}"
2020-04-16 07:00:00+00:00,AMD is going for customized 5nm at TSMC for ZEN4 and RDNA3? - guru3d.com,"{'href': 'https://www.guru3d.com', 'title': 'guru3d.com'}"
2020-04-27 07:00:00+00:00,Leaked Dell XPS 17 9700 listing confirms up to Core i9-10885H ... - Notebookcheck.net,"{'href': 'https://www.notebookcheck.net', 'title': 'Notebookcheck.net'}"
2020-04-21 07:00:00+00:00,The GPU “Expanse”: HPC Acceleration for the Masses - The Next Platform,"{'href': 'https://www.nextplatform.com', 'title': 'The Next Platform'}"
2020-04-16 07:00:00+00:00,MSI GeForce GTX 1650 SUPER GAMING X Review - TweakTown,"{'href': 'https://www.tweaktown.com', 'title': 'TweakTown'}"
2020-04-23 07:00:00+00:00,EVGA GeForce RTX 2080 Ti XC Hydro Copper now available ... - HEXUS,"{'href': 'https://hexus.net', 'title': 'HEXUS'}"
2020-04-17 07:00:00+00:00,10 Games That Make the Most of Your Graphics Card - IGN,"{'href': 'https://www.ign.com', 'title': 'IGN'}"
2020-04-21 07:00:00+00:00,"Asus is refreshing the VivoBook 14 with Ryzen 5 4500U, Ryzen 7 ... - Notebookcheck.net","{'href': 'https://www.notebookcheck.net', 'title': 'Notebookcheck.net'}"
2020-04-16 07:00:00+00:00,"Minecraft Update: New Bedrock download, Nether updates and Windows 10 Nvidia boost - Daily Star","{'href': 'https://www.dailystar.co.uk', 'title': 'Daily Star'}"
2020-04-18 07:00:00+00:00,Lenovo Refreshes Its Entire Gaming Laptop Lineup With Additions To Legion Series & Idea Series – Featuring RTX GPUs With A Choice of Intel 10th Gen or AMD Ryzen 4000 CPUs - Wccftech,"{'href': 'https://wccftech.com', 'title': 'Wccftech'}"
2020-04-21 07:00:00+00:00,How to find out what graphics card you have - The Verge,"{'href': 'https://www.theverge.com', 'title': 'The Verge'}"
2020-04-20 07:00:00+00:00,Boundary Interview – Zero-G Tactical FPS with Cutting Edge RTX and DLSS Tech - Wccftech,"{'href': 'https://wccftech.com', 'title': 'Wccftech'}"
2020-04-15 07:00:00+00:00,"RADV+ACO Outperforming AMDVLK, AMDGPU-PRO Vulkan ... - Phoronix","{'href': 'https://www.phoronix.com', 'title': 'Phoronix'}"
2020-04-21 07:00:00+00:00,"AOC CU34G2X Curved Gaming Monitor Review: Speed, Immersion ... - Tom's Hardware","{'href': 'https://www.tomshardware.com', 'title': ""Tom's Hardware""}"
2020-04-22 07:00:00+00:00,You Need To Check Out HP’s New ENVY And ZBooks If You Are A Creator And Looking At Apple MacBook Pros - Forbes,"{'href': 'https://www.forbes.com', 'title': 'Forbes'}"
2020-04-15 07:00:00+00:00,Review: Gigabyte Aero 17 HDR (2020) - Laptop - HEXUS,"{'href': 'https://hexus.net', 'title': 'HEXUS'}"
2020-04-27 07:00:00+00:00,"TSMC starts development of 2nm process, 3nm already in the works - guru3d.com","{'href': 'https://www.guru3d.com', 'title': 'guru3d.com'}"
2020-04-22 07:00:00+00:00,2020 Acer Nitro 5 will be available with AMD Ryzen 4000 CPU ... - HEXUS,"{'href': 'https://hexus.net', 'title': 'HEXUS'}"
