date,title,publisher
2018-09-26 07:00:00+00:00,IBASE mini PC with Nvidia MXM graphics supporting 8K displays - Geeky Gadgets,"{'href': 'https://www.geeky-gadgets.com', 'title': 'Geeky Gadgets'}"
2018-09-24 07:00:00+00:00,MRI Images Created by AI Could Help Train Deep Learning Models - HealthITAnalytics.com,"{'href': 'https://healthitanalytics.com', 'title': 'HealthITAnalytics.com'}"
2018-09-26 07:00:00+00:00,MSI Afterburner 4.6.0 Beta 9 Adds Support for GeForce RTX GPUs - GND-Tech,"{'href': 'https://gnd-tech.com', 'title': 'GND-Tech'}"
2018-09-24 07:00:00+00:00,RUMOR: AMD Radeon Polaris 30 GPU Based On 12nm FinFET Node Gearing Up For Launch - Wccftech,"{'href': 'https://wccftech.com', 'title': 'Wccftech'}"
2018-09-17 07:00:00+00:00,Difference between NVIDIA TU102-300 vs TU102-300A (Turing A and non-A GPU variants) - TheNerdMag,"{'href': 'https://thenerdmag.com', 'title': 'TheNerdMag'}"
2018-09-20 07:00:00+00:00,Geforce RTX 2080 Ti & RTX 2080 im Test: Turing gegen Pascal und ... - PC Games Hardware,"{'href': 'https://www.pcgameshardware.de', 'title': 'PC Games Hardware'}"
2018-09-28 07:00:00+00:00,Batman: Arkham Knight PC revisited - can today's best hardware ... - Eurogamer.net,"{'href': 'https://www.eurogamer.net', 'title': 'Eurogamer.net'}"
2018-09-21 07:00:00+00:00,Ace Combat 7: Skies Unknown’s Official System Requirements Revealed - GamingBolt,"{'href': 'https://gamingbolt.com', 'title': 'GamingBolt'}"
2018-09-21 07:00:00+00:00,"BMW Goes All Out With AI, Electric Cars and Autonomous Motorcycles - TheStreet","{'href': 'https://www.thestreet.com', 'title': 'TheStreet'}"
2018-09-21 07:00:00+00:00,Devil May Cry 5 system requirements revealed - PC Gamer,"{'href': 'https://www.pcgamer.com', 'title': 'PC Gamer'}"
2018-09-26 07:00:00+00:00,Put Renewable Energy On Your Desk With a Lego Wind Turbine - Popular Mechanics,"{'href': 'https://www.popularmechanics.com', 'title': 'Popular Mechanics'}"
2018-09-15 07:00:00+00:00,"'Call Of Duty: Black Ops 4' Blackout PC Open Beta Starts Today: Start And End Times, Specs And More - Forbes","{'href': 'https://www.forbes.com', 'title': 'Forbes'}"
2018-09-21 07:00:00+00:00,These rare deals drop custom Radeon Vega 56 and 64 graphics ... - PCWorld,"{'href': 'https://www.pcworld.com', 'title': 'PCWorld'}"
2018-09-17 07:00:00+00:00,"Linus Torvalds apologizes for years of being a jerk, takes time off to learn empathy - Ars Technica","{'href': 'https://arstechnica.com', 'title': 'Ars Technica'}"
2018-09-25 07:00:00+00:00,These older graphics cards are compatible with macOS Mojave - TechRadar,"{'href': 'https://www.techradar.com', 'title': 'TechRadar'}"
2018-09-19 07:00:00+00:00,Ace Combat 7: Skies Unknown Official PC System Requirements - DSOGaming,"{'href': 'https://www.dsogaming.com', 'title': 'DSOGaming'}"
2018-09-24 07:00:00+00:00,AI and HPC GPU Acceleration Benefit from Open Source Efforts - HPCwire,"{'href': 'https://www.hpcwire.com', 'title': 'HPCwire'}"
2018-09-29 07:00:00+00:00,ASUS ROG NVLink-Bridge Released (with RGB) - guru3d.com,"{'href': 'https://www.guru3d.com', 'title': 'guru3d.com'}"
2018-09-20 07:00:00+00:00,Devil May Cry 5 Official PC System Requirements - DSOGaming,"{'href': 'https://www.dsogaming.com', 'title': 'DSOGaming'}"
2018-09-20 07:00:00+00:00,Summit Supercomputer is Already Making its Mark on Science - HPCwire,"{'href': 'https://www.hpcwire.com', 'title': 'HPCwire'}"
2018-09-24 07:00:00+00:00,Deepfakes for good: Why researchers are using AI to fake health data - Fast Company,"{'href': 'https://www.fastcompany.com', 'title': 'Fast Company'}"
2018-09-29 07:00:00+00:00,FIFA 19 PC Performance Analysis - DSOGaming,"{'href': 'https://www.dsogaming.com', 'title': 'DSOGaming'}"
2018-09-21 07:00:00+00:00,Corsair Previews Hydro X Series for RTX 2080 Series Water Blocks - GND-Tech,"{'href': 'https://gnd-tech.com', 'title': 'GND-Tech'}"
2018-09-22 07:00:00+00:00,NVLink RTX 2080 Ti Benchmark: x16/x16 vs. x8 & GTX 1080 Ti SLI - GamersNexus,"{'href': 'https://www.gamersnexus.net', 'title': 'GamersNexus'}"
2018-09-27 07:00:00+00:00,List of Forza Horizon 4 known bugs and launch issues - Windows Central,"{'href': 'https://www.windowscentral.com', 'title': 'Windows Central'}"
2018-09-21 07:00:00+00:00,Nintendo has clips of the 80 new mini-games in Super Mario Party - Destructoid,"{'href': 'https://www.destructoid.com', 'title': 'Destructoid'}"
2018-09-15 07:00:00+00:00,"Alleged AMD EPYC ‘Rome’ 7nm Based 64 Core Processor Performance Leaks Out – Scores an Incredible 12,500 Points in Cinebench Multi-Tasking Benchmark - Wccftech","{'href': 'https://wccftech.com', 'title': 'Wccftech'}"
2018-09-18 07:00:00+00:00,Advanced Imaging Society Unveils 2018 Technology Lumiere ... - Animation World Network,"{'href': 'https://www.awn.com', 'title': 'Animation World Network'}"
2018-09-18 07:00:00+00:00,How Volvo Is Cruising Into the Autonomous Vehicle Race - TheStreet,"{'href': 'https://www.thestreet.com', 'title': 'TheStreet'}"
2018-09-21 07:00:00+00:00,PS3 RPCS3 PC Emulator Status Update; Massive Improvements for AAA Titles and Passes 1000 Playable Games - Wccftech,"{'href': 'https://wccftech.com', 'title': 'Wccftech'}"
2018-09-25 07:00:00+00:00,Marvel's Spider-Man fends off a familiar face in this week's UK Charts - Destructoid,"{'href': 'https://www.destructoid.com', 'title': 'Destructoid'}"
2018-09-27 07:00:00+00:00,AMD Next Generation Arcturus GPU To Succeed Navi GPU – New Radeon Family Naming Scheme Also To Be Introduced After Navi - Wccftech,"{'href': 'https://wccftech.com', 'title': 'Wccftech'}"
2018-09-27 07:00:00+00:00,How to use HDR on PC with games like Forza Horizon 4 - VG247,"{'href': 'https://www.vg247.com', 'title': 'VG247'}"
2018-09-18 07:00:00+00:00,This wooden Majora's Mask gives me the creeps in the best way - Destructoid,"{'href': 'https://www.destructoid.com', 'title': 'Destructoid'}"
2018-09-27 07:00:00+00:00,ASUS ROG Launches Limited Edition Call of Duty: Black Ops 4 ... - guru3d.com,"{'href': 'https://www.guru3d.com', 'title': 'guru3d.com'}"
2018-09-20 07:00:00+00:00,Haruka finally lets loose in Yakuza Online's TGS trailer - Destructoid,"{'href': 'https://www.destructoid.com', 'title': 'Destructoid'}"
2018-09-25 07:00:00+00:00,"New Gundam Breaker is now available on Steam, official PC system ... - DSOGaming","{'href': 'https://www.dsogaming.com', 'title': 'DSOGaming'}"
2018-09-27 07:00:00+00:00,"In March, Lu Bu will ride for Total War: Three Kingdoms - Destructoid","{'href': 'https://www.destructoid.com', 'title': 'Destructoid'}"
2018-09-18 07:00:00+00:00,Heavy metal tribute Brutal Legend now playable on Xbox One - Destructoid,"{'href': 'https://www.destructoid.com', 'title': 'Destructoid'}"
2018-09-18 07:00:00+00:00,"Nintendo Announces Switch Fortnite Bundle Royale; Includes Double Helix Outfit and 1,000 V-Bucks - Wccftech","{'href': 'https://wccftech.com', 'title': 'Wccftech'}"
2018-09-16 07:00:00+00:00,The Linux Kernel Has Grown By 225k Lines of Code So Far This ... - Phoronix,"{'href': 'https://www.phoronix.com', 'title': 'Phoronix'}"
2018-09-20 07:00:00+00:00,AMD Radeon Adrenalin Edition 18.9.2 Driver download - guru3d.com,"{'href': 'https://www.guru3d.com', 'title': 'guru3d.com'}"
2018-09-25 15:13:32+00:00,MSI RTX 2080 Gaming X Trio Graphics Card Review - eTeknix,"{'href': 'https://www.eteknix.com', 'title': 'eTeknix'}"
2018-09-27 07:00:00+00:00,Bowsette is so popular that the character is already getting its own ... - Destructoid,"{'href': 'https://www.destructoid.com', 'title': 'Destructoid'}"
2018-09-24 07:00:00+00:00,World War 3 Official PC System Requirements - guru3d.com,"{'href': 'https://www.guru3d.com', 'title': 'guru3d.com'}"
2018-09-29 07:00:00+00:00,Forza Horizon 4 PC Graphics Card Performance Comparison And Core Scaling - Wccftech,"{'href': 'https://wccftech.com', 'title': 'Wccftech'}"
2018-09-18 07:00:00+00:00,Continental develops environment model for enabling automation for CVs - Autocar Professional,"{'href': 'https://www.autocarpro.in', 'title': 'Autocar Professional'}"
2018-09-19 07:00:00+00:00,Animal Crossing displays a new arrangement for Super Smash Bros ... - Destructoid,"{'href': 'https://www.destructoid.com', 'title': 'Destructoid'}"
2018-09-17 07:00:00+00:00,"Help Me, Laptop: Can I Game on Battery-Saver Mode? - Laptop Mag","{'href': 'https://www.laptopmag.com', 'title': 'Laptop Mag'}"
2018-09-28 07:00:00+00:00,The Witcher 3 Custom Clouds and Weather Mod Update Offers Better Water Color & Moon Size Consistency alongside Cloud Tweaks - Wccftech,"{'href': 'https://wccftech.com', 'title': 'Wccftech'}"
2018-09-20 07:00:00+00:00,Marvel’s Spider-Man Sold 3.3 Million Units in Three Days Since Launch - Wccftech,"{'href': 'https://wccftech.com', 'title': 'Wccftech'}"
2018-09-16 07:00:00+00:00,"Shadow of the Tomb Raider DX11 vs DX12, Does Ryzen Still Suffer Under GeForce? - Wccftech","{'href': 'https://wccftech.com', 'title': 'Wccftech'}"
2018-09-21 07:00:00+00:00,3DMark To Introduce Ray Tracing Tech Demo To Benchmark Your ... - SegmentNext,"{'href': 'https://segmentnext.com', 'title': 'SegmentNext'}"
2018-09-20 07:00:00+00:00,Fortnite’s Cube Has Turned Loot Lake Into a Giant Trampoline - Beebom,"{'href': 'https://beebom.com', 'title': 'Beebom'}"
2018-09-22 07:00:00+00:00,Here is a brief comparison between the uncut and the censored ... - DSOGaming,"{'href': 'https://www.dsogaming.com', 'title': 'DSOGaming'}"
2018-09-28 15:42:02+00:00,What is Edge Computing? - Digital Engineering 24/7,"{'href': 'https://www.digitalengineering247.com', 'title': 'Digital Engineering 24/7'}"
2018-09-24 07:00:00+00:00,ON Semiconductor Positioning Itself As A Leader In Self-Driving Car Technologies - Forbes,"{'href': 'https://www.forbes.com', 'title': 'Forbes'}"
2018-09-17 07:00:00+00:00,Assetto Corsa Competizione 4K Screenshots Gallery - DSOGaming,"{'href': 'https://www.dsogaming.com', 'title': 'DSOGaming'}"
2018-09-29 07:00:00+00:00,"Intel's Processor Shortages Impact AMD, Micron and Many Others, Too - TheStreet","{'href': 'https://www.thestreet.com', 'title': 'TheStreet'}"
2018-09-22 07:00:00+00:00,iOS 12 Lets You Ask Siri to Show You Your Passwords - Beebom,"{'href': 'https://beebom.com', 'title': 'Beebom'}"
2018-09-28 07:00:00+00:00,A.I. Security Camera Can Identify Guns with 99 Percent Accuracy - Digital Trends,"{'href': 'https://www.digitaltrends.com', 'title': 'Digital Trends'}"
2018-09-28 07:00:00+00:00,iPhone XS Face ID: How Fast Is It Compared to the iPhone X? - Beebom,"{'href': 'https://beebom.com', 'title': 'Beebom'}"
2018-09-26 07:00:00+00:00,"Fortnite Xbox Bundle Comes with Exclusive Skin, V-bucks, and More - Beebom","{'href': 'https://beebom.com', 'title': 'Beebom'}"
2018-09-20 07:00:00+00:00,"Android TV Box Market Is Booming Worldwide With Key Players: Nvidia, Amazon, Sony - openPR","{'href': 'https://www.openpr.com', 'title': 'openPR'}"
2018-09-29 07:00:00+00:00,The 50 best-paying big companies - Business Insider,"{'href': 'https://www.businessinsider.com', 'title': 'Business Insider'}"
2018-09-19 07:00:00+00:00,First Red Dead Online Details Revealed; Beta Coming in November - Wccftech,"{'href': 'https://wccftech.com', 'title': 'Wccftech'}"
2018-09-25 07:00:00+00:00,iPhone XS: What’s In the Box? - Beebom,"{'href': 'https://beebom.com', 'title': 'Beebom'}"
2018-09-15 07:00:00+00:00,"From headsets to keyboards, this is the best gaming gear in 2018 - NBC News","{'href': 'https://www.nbcnews.com', 'title': 'NBC News'}"
2018-09-28 07:00:00+00:00,2019 Mercedes-Benz A-Class Sedan First... - MotorIllustrated,"{'href': 'https://motorillustrated.com', 'title': 'MotorIllustrated'}"
2018-09-27 07:00:00+00:00,Growth Stocks Drive Wells Fargo Funds' Ognar | Investor's Business ... - Investor's Business Daily,"{'href': 'https://www.investors.com', 'title': ""Investor's Business Daily""}"
2018-09-18 07:00:00+00:00,"Game on the Go with Samsung's New, High-Performance Gaming ... - Samsung","{'href': 'https://news.samsung.com', 'title': 'Samsung'}"
2018-10-10 07:00:00+00:00,Nvidia launches Rapids to help bring GPU acceleration to data analytics - TechCrunch,"{'href': 'https://techcrunch.com', 'title': 'TechCrunch'}"
2018-10-10 07:00:00+00:00,Nvidia Opens Up A Lead In Compute System For Automated Driving - Forbes,"{'href': 'https://www.forbes.com', 'title': 'Forbes'}"
2018-10-10 07:00:00+00:00,"Nvidia Systems Will Power Next Generation of Volvo Cars, Says ... - TheStreet","{'href': 'https://www.thestreet.com', 'title': 'TheStreet'}"
2018-10-10 07:00:00+00:00,"Volvo, Nvidia expand autonomous driving collaboration - Automotive News Europe","{'href': 'https://europe.autonews.com', 'title': 'Automotive News Europe'}"
2018-10-01 07:00:00+00:00,Pre-orders open for Nvidia Quadro RTX 5000 and RTX 6000 ... - HEXUS,"{'href': 'https://hexus.net', 'title': 'HEXUS'}"
2018-10-10 07:00:00+00:00,Exclusive: NVIDIA RTX Mobility Graphics Cards Lineup Leaked - Wccftech,"{'href': 'https://wccftech.com', 'title': 'Wccftech'}"
2018-10-14 07:00:00+00:00,NVIDIA Keeps Boosting Its Bets on the Future - The Motley Fool,"{'href': 'https://www.fool.com', 'title': 'The Motley Fool'}"
2018-10-07 07:00:00+00:00,What You Need to Know About NVIDIA's Capital-Return Program - The Motley Fool,"{'href': 'https://www.fool.com', 'title': 'The Motley Fool'}"
2018-10-09 07:00:00+00:00,NVTOP: An htop like monitoring tool for NVIDIA GPUs on Linux - Packt Hub,"{'href': 'https://hub.packtpub.com', 'title': 'Packt Hub'}"
2018-10-12 07:00:00+00:00,GPU-Z version 2.12.0 flags up fake Nvidia GPUs - Software - News - HEXUS,"{'href': 'https://hexus.net', 'title': 'HEXUS'}"
2018-10-04 07:00:00+00:00,"Alienware m15 laptop sports thinnest Dell gaming design, Nvidia Max-Q GPUs - Ars Technica","{'href': 'https://arstechnica.com', 'title': 'Ars Technica'}"
2018-10-04 07:00:00+00:00,GeForce 416.16 WHQL driver download - guru3d.com,"{'href': 'https://www.guru3d.com', 'title': 'guru3d.com'}"
2018-10-05 07:00:00+00:00,DDN Introduces Purpose-Built AI Storage Solution for NVIDIA DGX-1 - TOP500 News,"{'href': 'https://www.top500.org', 'title': 'TOP500 News'}"
2018-10-04 07:00:00+00:00,"DDN, Nvidia Blueprint Unified AI Appliance with Up to 9 DGX-1s - HPCwire","{'href': 'https://www.hpcwire.com', 'title': 'HPCwire'}"
2018-10-02 07:00:00+00:00,ENR California Best Projects 2018 Office/Retail/Mixed Use: NVIDIA ... - Engineering News-Record,"{'href': 'https://www.enr.com', 'title': 'Engineering News-Record'}"
2018-10-12 07:00:00+00:00,Nvidia to Provide Computers for Future Volvo Cars - The Drive,"{'href': 'https://www.thedrive.com', 'title': 'The Drive'}"
2018-10-13 07:00:00+00:00,NVIDIA RTX Powers Apollo 11 Moon Landing Tech Demo - Wccftech,"{'href': 'https://wccftech.com', 'title': 'Wccftech'}"
2018-10-11 07:00:00+00:00,NVIDIA CEO: We're in the 'era of the automation of automation' - Verdict,"{'href': 'https://www.verdict.co.uk', 'title': 'Verdict'}"
2018-10-14 07:00:00+00:00,GPU-Z is now warning people about FAKE graphics cards - TweakTown,"{'href': 'https://www.tweaktown.com', 'title': 'TweakTown'}"
2018-10-05 07:00:00+00:00,Nvidia's Overbought Shares Seen Falling 9% Short Term - Investopedia,"{'href': 'https://www.investopedia.com', 'title': 'Investopedia'}"
2019-05-18 07:56:14+00:00,NVIDIA and AMD to See Higher GPU Prices Because of US Tariffs - Market Realist,"{'href': 'https://marketrealist.com', 'title': 'Market Realist'}"
2018-10-01 07:00:00+00:00,Asus ROG releases GeForce RTX NVLink with Aura Sync RGB ... - HEXUS,"{'href': 'https://hexus.net', 'title': 'HEXUS'}"
2018-10-06 07:00:00+00:00,GeForce RTX 2080 Ti in NVLink: 8K 60FPS Gaming Now A Reality - TweakTown,"{'href': 'https://www.tweaktown.com', 'title': 'TweakTown'}"
2018-10-12 07:00:00+00:00,"Gaijin on Implementing NVIDIA RTX via Vulkan for Enlisted, Their Upcoming MMO Shooter Game - Wccftech","{'href': 'https://wccftech.com', 'title': 'Wccftech'}"
2018-10-04 07:00:00+00:00,EVGA GeForce RTX NVLink SLI Bridges - guru3d.com,"{'href': 'https://www.guru3d.com', 'title': 'guru3d.com'}"
2018-12-20 17:18:07+00:00,Veoneer Introduces 'Zeus' – An Autonomous Driving Supercomputer - AftermarketNews.com (AMN),"{'href': 'https://www.aftermarketnews.com', 'title': 'AftermarketNews.com (AMN)'}"
2018-10-08 07:00:00+00:00,Zotac Unleashes GeForce RTX 2080 AMP Extreme And Extreme Core With Triple Fans - Hot Hardware,"{'href': 'https://hothardware.com', 'title': 'Hot Hardware'}"
2018-10-03 07:00:00+00:00,Custom NVLink bridges show up - Fudzilla,"{'href': 'https://www.fudzilla.com', 'title': 'Fudzilla'}"
2018-10-03 07:00:00+00:00,NVIDIA CUDA Code In A JIT Interpreted Manner Via Cling - Phoronix,"{'href': 'https://www.phoronix.com', 'title': 'Phoronix'}"
2018-10-07 07:00:00+00:00,MSI GeForce RTX 2070 Gaming X Breaks Cover Early With RGB Goodness - Hot Hardware,"{'href': 'https://hothardware.com', 'title': 'Hot Hardware'}"
2018-10-05 07:00:00+00:00,Review: MSI GeForce RTX 2080 Ti Duke 11G OC - Graphics - HEXUS,"{'href': 'https://hexus.net', 'title': 'HEXUS'}"
2018-10-11 07:00:00+00:00,imaging tech: the latest developments in imaging technology - Medical Device Network,"{'href': 'https://www.medicaldevice-network.com', 'title': 'Medical Device Network'}"
2018-10-14 07:00:00+00:00,How To Check If Your Graphics Card Is A Fake - Lifehacker Australia,"{'href': 'https://www.lifehacker.com.au', 'title': 'Lifehacker Australia'}"
2018-10-07 07:00:00+00:00,NVIDIA Control Panel app for Windows 10 is now available in the Store - WindowsLatest,"{'href': 'https://www.windowslatest.com', 'title': 'WindowsLatest'}"
2018-10-01 07:00:00+00:00,NVSlimmer: remove unwanted components from Nvidia drivers - Ghacks,"{'href': 'https://www.ghacks.net', 'title': 'Ghacks'}"
2018-10-04 07:00:00+00:00,"In A Parallel Universe, Data Warehouses Run On GPUs - The Next Platform","{'href': 'https://www.nextplatform.com', 'title': 'The Next Platform'}"
2018-10-04 07:00:00+00:00,Xilinx announced PCIe Alveo AI accelerator - Fudzilla,"{'href': 'https://www.fudzilla.com', 'title': 'Fudzilla'}"
2018-10-03 07:00:00+00:00,"Microsoft’s New Surface Devices Are Gorgeous, But Flawed - TIME","{'href': 'https://time.com', 'title': 'TIME'}"
2018-10-05 07:00:00+00:00,Deep Learning Just Dipped into Exascale Territory - The Next Platform,"{'href': 'https://www.nextplatform.com', 'title': 'The Next Platform'}"
2018-10-07 07:00:00+00:00,"AMD Polaris 30 Based Radeon RX 570 Successor With 2048 Cores Launching in Mid-October, RX 580 Successor Launches in November - Wccftech","{'href': 'https://wccftech.com', 'title': 'Wccftech'}"
2018-10-09 07:00:00+00:00,"Microsoft announces Project xCloud, its own AMD GPU-powered ... - PCGamesN","{'href': 'https://www.pcgamesn.com', 'title': 'PCGamesN'}"
2018-10-11 07:00:00+00:00,"Razer Blade 15 Fall update includes dual storage, Ethernet - Laptop ... - HEXUS","{'href': 'https://hexus.net', 'title': 'HEXUS'}"
2018-10-01 07:00:00+00:00,Acer Predator X27 review: today isn't ready for tomorrow's display - The Verge,"{'href': 'https://www.theverge.com', 'title': 'The Verge'}"
2018-10-09 07:00:00+00:00,"Acer Predator Orion 9000, 5000 with Intel’s 9th gen processors announced - The Indian Express","{'href': 'https://indianexpress.com', 'title': 'The Indian Express'}"
2018-10-11 07:00:00+00:00,Asus ROG Strix GeForce RTX 2080Ti OC Review - IGN,"{'href': 'https://www.ign.com', 'title': 'IGN'}"
2018-10-01 07:00:00+00:00,"Stable release of CUDA 10.0 out, with Turing support, tools and library changes - Packt Hub","{'href': 'https://hub.packtpub.com', 'title': 'Packt Hub'}"
2018-10-02 07:00:00+00:00,This is Microsoft’s Surface Studio 2 - TechCrunch,"{'href': 'https://techcrunch.com', 'title': 'TechCrunch'}"
2018-10-03 07:00:00+00:00,What Will Google And Facebook's AI Partnership Accomplish? - Forbes,"{'href': 'https://www.forbes.com', 'title': 'Forbes'}"
2018-10-02 07:00:00+00:00,Google's Project Stream could change the way we all play video games - Business Insider,"{'href': 'https://www.businessinsider.com', 'title': 'Business Insider'}"
2018-10-10 07:00:00+00:00,Startup Says Its AI Camera Recognizes Active Shooters Before They ... - Security Sales & Integration,"{'href': 'https://www.securitysales.com', 'title': 'Security Sales & Integration'}"
2018-10-02 07:00:00+00:00,The Asus ROG Swift PG27UQ G-SYNC HDR Monitor Review ... - AnandTech,"{'href': 'https://www.anandtech.com', 'title': 'AnandTech'}"
2018-10-10 07:00:00+00:00,Jetson-equipped Teal One drone takes flight as a 60-mph ... - New Atlas,"{'href': 'https://newatlas.com', 'title': 'New Atlas'}"
2018-10-03 07:00:00+00:00,Xilinx Unveils Versal SoC - Eetasia.com,"{'href': 'https://www.eetasia.com', 'title': 'Eetasia.com'}"
2018-10-03 07:00:00+00:00,Windows 10 October update adds ray tracing support - VG247,"{'href': 'https://www.vg247.com', 'title': 'VG247'}"
2018-10-04 07:00:00+00:00,"GeForce RTX 2080 Ti Founders Edition, le test complet - GinjFo","{'href': 'https://www.ginjfo.com', 'title': 'GinjFo'}"
2018-10-08 07:00:00+00:00,"Intel launches 9th-gen, 8-core i9-9900K CPU and more - CNET","{'href': 'https://www.cnet.com', 'title': 'CNET'}"
2018-10-05 07:00:00+00:00,Windows 10 Caveat Emptor Update - PC Perspective,"{'href': 'https://pcper.com', 'title': 'PC Perspective'}"
2018-10-14 07:00:00+00:00,Call of Duty Black Ops 4 PC Performance Analysis - DSOGaming,"{'href': 'https://www.dsogaming.com', 'title': 'DSOGaming'}"
2018-10-05 07:00:00+00:00,"AORUS GeForce RTX 20 Series Graphics Cards Unveiled, RTX 2080 Ti Xtreme Is The Flagship – Feature an Incredibly Premium Design, Custom PCBs - Wccftech","{'href': 'https://wccftech.com', 'title': 'Wccftech'}"
2018-10-10 07:00:00+00:00,Overwatch's LEGO Bastion comes with a little bird and everything - Destructoid,"{'href': 'https://www.destructoid.com', 'title': 'Destructoid'}"
2018-10-12 07:00:00+00:00,Call of Cthulhu Official PC System Requirements - DSOGaming,"{'href': 'https://www.dsogaming.com', 'title': 'DSOGaming'}"
2018-10-04 07:00:00+00:00,"Companies with the happiest employees in 2018, ranked - Business Insider","{'href': 'https://www.businessinsider.com', 'title': 'Business Insider'}"
2018-10-08 07:00:00+00:00,AMD reportedly prepping RX 680 and RX 670 Polaris graphics ... - PCGamesN,"{'href': 'https://www.pcgamesn.com', 'title': 'PCGamesN'}"
2018-10-01 07:00:00+00:00,Frustum Releases Windows-based Version of GENERATE - ENGINEERING.com,"{'href': 'https://www.engineering.com', 'title': 'ENGINEERING.com'}"
2018-10-09 07:00:00+00:00,Soulcalibur mini-documentary takes a look back at the Stage of History - Destructoid,"{'href': 'https://www.destructoid.com', 'title': 'Destructoid'}"
2018-10-11 07:00:00+00:00,Assassin’s Creed Odyssey PC Performance Explored - Wccftech,"{'href': 'https://wccftech.com', 'title': 'Wccftech'}"
2018-10-04 07:00:00+00:00,Assassin’s Creed Odyssey FPS Performance Fix - Game Revolution,"{'href': 'https://www.gamerevolution.com', 'title': 'Game Revolution'}"
2018-10-10 07:00:00+00:00,MSI Aegis 3 (2017) review - TechRadar,"{'href': 'https://www.techradar.com', 'title': 'TechRadar'}"
2018-10-08 07:00:00+00:00,Download: 3DMark v2.6.6174 - Adds DirectX 12 Night Raid test - guru3d.com,"{'href': 'https://www.guru3d.com', 'title': 'guru3d.com'}"
2018-10-02 07:00:00+00:00,"Ubisoft Details Day One Assassin’s Creed Odyssey Patch 1.02; Offers Various Gameplay, Quality & Technical Improvements - Wccftech","{'href': 'https://wccftech.com', 'title': 'Wccftech'}"
2018-10-04 07:00:00+00:00,New Lego Overwatch teaser features adorable Tracer minifig - Destructoid,"{'href': 'https://www.destructoid.com', 'title': 'Destructoid'}"
2018-10-10 07:00:00+00:00,"Oxford Nanopore Launches MinIT, a Powerful Analysis Device to ... - Business Wire","{'href': 'https://www.businesswire.com', 'title': 'Business Wire'}"
2018-10-05 07:00:00+00:00,"Netflix utilizes 15 percent of the internet bandwidth, up to 40 percent ... - guru3d.com","{'href': 'https://www.guru3d.com', 'title': 'guru3d.com'}"
2018-10-12 07:00:00+00:00,AMD Radeon RX 680 graphics card coming in November with 15 ... - PCGamesN,"{'href': 'https://www.pcgamesn.com', 'title': 'PCGamesN'}"
2018-10-10 07:00:00+00:00,Persona Q2 invites robo-gal Aigis to cinematic warfare - Destructoid,"{'href': 'https://www.destructoid.com', 'title': 'Destructoid'}"
2018-10-01 07:00:00+00:00,PS4 Exclusive Spiderman Outsells Multiplatform Title Far Cry 5 in UK in Just 4 Weeks - Wccftech,"{'href': 'https://wccftech.com', 'title': 'Wccftech'}"
2018-10-03 07:00:00+00:00,AI has reimagined nature and it's both amazing and terrifying - New Scientist,"{'href': 'https://www.newscientist.com', 'title': 'New Scientist'}"
2018-10-05 07:00:00+00:00,PC Specialist launches 17.3″ Recoil II gaming laptop - KitGuru,"{'href': 'https://www.kitguru.net', 'title': 'KitGuru'}"
2018-10-10 07:00:00+00:00,Capcom release GRUESOME Resident Evil 2 Remake screenshots - TweakTown,"{'href': 'https://www.tweaktown.com', 'title': 'TweakTown'}"
2018-10-02 07:00:00+00:00,Review: Cooler Master Cosmos C700M - guru3d.com,"{'href': 'https://www.guru3d.com', 'title': 'guru3d.com'}"
2018-10-09 07:00:00+00:00,What are the minimum PC specs for Black Ops 4 and Blackout? Full ... - Dexerto,"{'href': 'https://www.dexerto.com', 'title': 'Dexerto'}"
2018-10-07 07:00:00+00:00,How to set up Plex Live TV and DVR - TalkAndroid,"{'href': 'https://www.talkandroid.com', 'title': 'TalkAndroid'}"
2018-10-08 07:00:00+00:00,ASUS ROG Dominus Extreme: the most PCMR motherboard EVER! - TweakTown,"{'href': 'https://www.tweaktown.com', 'title': 'TweakTown'}"
2018-10-10 07:00:00+00:00,Nintendo adds surprise new Super Easy Quest version of Zelda ... - Destructoid,"{'href': 'https://www.destructoid.com', 'title': 'Destructoid'}"
2018-10-12 07:00:00+00:00,Teasing Out The Bang For The Buck Of Inference Engines - The Next Platform,"{'href': 'https://www.nextplatform.com', 'title': 'The Next Platform'}"
2018-10-14 07:00:00+00:00,Updated GPU-Z Alerts Users About Graphics Cards With Fake GPUs - Wccftech,"{'href': 'https://wccftech.com', 'title': 'Wccftech'}"
