date,title,publisher
2021-09-03 07:00:00+00:00,Remember When Expedia Wanted to Reduce Its Reliance on Google? Big 180-Degree Shift Now - Skift Travel News,"{'href': 'https://skift.com', 'title': 'Skift Travel News'}"
2021-09-07 07:00:00+00:00,How to clear your Google search history - Business Insider,"{'href': 'https://www.businessinsider.com', 'title': 'Business Insider'}"
2021-09-10 07:00:00+00:00,"Google Cuts Off Ad Money To ‘Gateway Pundit,’ A Haven For Vaccine And Election Misinformation - Forbes","{'href': 'https://www.forbes.com', 'title': 'Forbes'}"
2021-09-01 07:00:00+00:00,Google Cloud and SAP forge ahead with Rise offerings - TechTarget,"{'href': 'https://www.techtarget.com', 'title': 'TechTarget'}"
2021-09-09 07:00:00+00:00,Google Said With Images Uniqueness Doesn't Make The Image ... - Search Engine Roundtable,"{'href': 'https://www.seroundtable.com', 'title': 'Search Engine Roundtable'}"
2021-09-01 07:00:00+00:00,"Amazon, Google, Microsoft Vie for Work on ICE RAVEn Data-Mining ... - Business Insider","{'href': 'https://www.businessinsider.com', 'title': 'Business Insider'}"
2021-09-04 07:00:00+00:00,How to Use a Whiteboard in Google Meet - Alphr,"{'href': 'https://www.alphr.com', 'title': 'Alphr'}"
2021-09-11 07:00:00+00:00,Analysis: Epic's narrow win in App Store case toughens fight against ... - Reuters,"{'href': 'https://www.reuters.com', 'title': 'Reuters'}"
2021-09-07 07:00:00+00:00,How to add Google account on your Android phone - India Today,"{'href': 'https://www.indiatoday.in', 'title': 'India Today'}"
2021-09-01 07:00:00+00:00,Google Messages is experiencing issues connecting to RCS for ... - Android Central,"{'href': 'https://www.androidcentral.com', 'title': 'Android Central'}"
2021-09-14 07:00:00+00:00,Top 7 VPNs that work with Android TV or Google TV - Dignited,"{'href': 'https://www.dignited.com', 'title': 'Dignited'}"
2021-09-01 07:00:00+00:00,How to Change the Host in a Google Meet - Alphr,"{'href': 'https://www.alphr.com', 'title': 'Alphr'}"
2021-09-12 07:00:00+00:00,"How Facebook, Amazon and Google abused the Patriot Act after 9/11 - MSNBC","{'href': 'https://www.msnbc.com', 'title': 'MSNBC'}"
2021-09-17 07:00:00+00:00,"Google, Apple remove Navalny app from stores as Russian ... - Reuters","{'href': 'https://www.reuters.com', 'title': 'Reuters'}"
2021-09-17 07:00:00+00:00,Apple and Google accused of ‘political censorship’ over Alexei Navalny app - The Guardian,"{'href': 'https://www.theguardian.com', 'title': 'The Guardian'}"
2021-09-17 07:00:00+00:00,"Alexei Navalny app vanishes from Google, Apple stores as Russian ... - The Washington Post","{'href': 'https://www.washingtonpost.com', 'title': 'The Washington Post'}"
2021-09-27 07:00:00+00:00,Google Is Appealing A $5 Billion Antitrust Fine In The EU - NPR,"{'href': 'https://www.npr.org', 'title': 'NPR'}"
2021-09-27 07:00:00+00:00,Google is brightening up your Gmail avatar with new illustrations - The Verge,"{'href': 'https://www.theverge.com', 'title': 'The Verge'}"
2021-09-27 07:00:00+00:00,"Google Maps, Gmail, YouTube no longer available on these phones. See full list | Mint - Mint","{'href': 'https://www.livemint.com', 'title': 'Mint'}"
2021-09-21 07:00:00+00:00,Google expands in New York with $2.1 billion office purchase - CNN,"{'href': 'https://www.cnn.com', 'title': 'CNN'}"
2021-09-18 07:00:00+00:00,India antitrust probe finds Google abused Android dominance ... - Reuters,"{'href': 'https://www.reuters.com', 'title': 'Reuters'}"
2021-09-27 07:00:00+00:00,"Australia challenges Google's ad dominance, calls for data-use rules - Reuters","{'href': 'https://www.reuters.com', 'title': 'Reuters'}"
2021-09-29 07:00:00+00:00,Google's upcoming search redesign may end up pushing more traffic to Google properties like YouTube - CNBC,"{'href': 'https://www.cnbc.com', 'title': 'CNBC'}"
2021-09-22 07:00:00+00:00,"Apple, Google raise new concerns by yanking Russian app - The Associated Press","{'href': 'https://apnews.com', 'title': 'The Associated Press'}"
2021-09-20 07:00:00+00:00,"Google’s foldable phone plans include two devices, Android 12.1 release - Ars Technica","{'href': 'https://arstechnica.com', 'title': 'Ars Technica'}"
2021-09-23 07:00:00+00:00,How to use Google Assistant's Reminders hub for your to-do list - CNET,"{'href': 'https://www.cnet.com', 'title': 'CNET'}"
2021-09-23 07:00:00+00:00,Google suing India antitrust watchdog for investigation report leak - Reuters India,"{'href': 'https://www.reuters.com', 'title': 'Reuters India'}"
2021-09-23 07:00:00+00:00,EXCLUSIVE Google offers to settle EU antitrust probe into digital ... - Reuters,"{'href': 'https://www.reuters.com', 'title': 'Reuters'}"
2021-09-15 07:00:00+00:00,Google hypes Pixel 6 launch in Japan with potato chips - 9to5Google,"{'href': 'https://9to5google.com', 'title': '9to5Google'}"
2021-09-26 07:00:00+00:00,Google is slashing the amount it keeps from sales on its cloud marketplace as pressure mounts on app stores - CNBC,"{'href': 'https://www.cnbc.com', 'title': 'CNBC'}"
2021-09-28 07:00:00+00:00,Google Meet is testing live translated captions - Engadget,"{'href': 'https://www.engadget.com', 'title': 'Engadget'}"
2021-09-20 07:00:00+00:00,Google Meet can now correct the crappy lighting in your home office - Android Police,"{'href': 'https://www.androidpolice.com', 'title': 'Android Police'}"
2021-09-29 07:00:00+00:00,A new Google Nest Doorbell (wired) is coming in 2022 - The Verge,"{'href': 'https://www.theverge.com', 'title': 'The Verge'}"
2021-09-24 07:00:00+00:00,Google CEO sought to keep Incognito mode issues out of spotlight ... - Reuters,"{'href': 'https://www.reuters.com', 'title': 'Reuters'}"
2021-09-16 07:00:00+00:00,Alphabet's Project Taara laser tech beamed 700TB of data across ... - The Verge,"{'href': 'https://www.theverge.com', 'title': 'The Verge'}"
2021-09-29 07:00:00+00:00,Google Maps is getting better at mapping wildfires - CNN,"{'href': 'https://www.cnn.com', 'title': 'CNN'}"
2021-09-28 07:00:00+00:00,Google's airtight legal defense: Apple is better - Macworld,"{'href': 'https://www.macworld.com', 'title': 'Macworld'}"
2021-09-25 07:00:00+00:00,Google Doodle honors Christopher Reeve on 'Superman' actor's birthday - CNN,"{'href': 'https://www.cnn.com', 'title': 'CNN'}"
2021-09-29 07:00:00+00:00,Google Play Warning: 200 Evil Android Apps Stole From 10 Million Phones - Forbes,"{'href': 'https://www.forbes.com', 'title': 'Forbes'}"
2021-09-27 07:00:00+00:00,Google marks its 23rd birthday with Google Doodle - BusinessLine,"{'href': 'https://www.thehindubusinessline.com', 'title': 'BusinessLine'}"
2021-09-28 07:00:00+00:00,"Google's browser cookies plan anti-competitive, advertisers tell EU - Reuters","{'href': 'https://www.reuters.com', 'title': 'Reuters'}"
2021-09-15 07:00:00+00:00,Google blocks pro-life group Live Action's ads over 'unproven medical claims' - Fox Business,"{'href': 'https://www.foxbusiness.com', 'title': 'Fox Business'}"
2021-09-22 07:00:00+00:00,"Google rolls out ticket booking links, 'Things to do' ads and an eco ... - Search Engine Land","{'href': 'https://searchengineland.com', 'title': 'Search Engine Land'}"
2021-09-29 07:00:00+00:00,Russia threatens to block YouTube as confrontation with Google escalates - ABC News,"{'href': 'https://abcnews.go.com', 'title': 'ABC News'}"
2021-09-27 07:00:00+00:00,Google is planning to add Instagram and TikTok videos as a part of ... - Digital Information World,"{'href': 'https://www.digitalinformationworld.com', 'title': 'Digital Information World'}"
2021-09-28 14:01:27+00:00,How to Outrank Competitors on Google - MarketingProfs.com,"{'href': 'https://www.marketingprofs.com', 'title': 'MarketingProfs.com'}"
2021-09-15 07:00:00+00:00,"Google finishes giant Grace Hopper undersea internet cable, NY to UK - Business Insider","{'href': 'https://www.businessinsider.com', 'title': 'Business Insider'}"
2021-09-27 07:00:00+00:00,"RIP Android TV remote app, hello Google TV remote app - The Verge","{'href': 'https://www.theverge.com', 'title': 'The Verge'}"
2021-09-26 07:00:00+00:00,Black Google employee explains experience with security: report - Insider,"{'href': 'https://www.insider.com', 'title': 'Insider'}"
2021-09-15 07:00:00+00:00,"What is Google Page Experience, and Why Does it Matter? - Entrepreneur","{'href': 'https://www.entrepreneur.com', 'title': 'Entrepreneur'}"
2021-09-30 07:00:00+00:00,"Google is the most popular search term on Bing, company reveals in ... - Android Authority","{'href': 'https://www.androidauthority.com', 'title': 'Android Authority'}"
2021-09-27 07:00:00+00:00,Fetching Google Pixel tablet fan-made renders wow with Pixel 6 ... - Notebookcheck.net,"{'href': 'https://www.notebookcheck.net', 'title': 'Notebookcheck.net'}"
2021-09-15 07:00:00+00:00,How to Turn Off All Google Tracking Activities on You - groovyPost,"{'href': 'https://www.groovypost.com', 'title': 'groovyPost'}"
2021-09-15 07:00:00+00:00,Google Cloud to host Flow blockchain - Ledger Insights - Ledger Insights,"{'href': 'https://www.ledgerinsights.com', 'title': 'Ledger Insights'}"
2021-09-23 07:00:00+00:00,Google tests if 'Chrome/100.0' user agent breaks websites - BleepingComputer,"{'href': 'https://www.bleepingcomputer.com', 'title': 'BleepingComputer'}"
2021-09-29 07:00:00+00:00,Workday Announces Expanded Use of Its Applications Across ... - GlobeNewswire,"{'href': 'https://www.globenewswire.com', 'title': 'GlobeNewswire'}"
2021-09-22 07:00:00+00:00,Google Finds 5 New ‘High’ Security Threats In Chrome - Forbes,"{'href': 'https://www.forbes.com', 'title': 'Forbes'}"
2021-09-15 07:00:00+00:00,How to get dark mode in Google Docs - Tom's Guide,"{'href': 'https://www.tomsguide.com', 'title': ""Tom's Guide""}"
2021-09-17 07:00:00+00:00,The Battle for Digital Privacy Is Reshaping the Internet (Published ... - The New York Times,"{'href': 'https://www.nytimes.com', 'title': 'The New York Times'}"
2021-09-24 07:00:00+00:00,Google Working on Indexing Instagram & TikTok Videos - Search Engine Journal,"{'href': 'https://www.searchenginejournal.com', 'title': 'Search Engine Journal'}"
2021-09-28 07:00:00+00:00,"Apple, Google asked to turn in S.Korea compliance plans by mid ... - Reuters","{'href': 'https://www.reuters.com', 'title': 'Reuters'}"
2021-09-25 16:53:04+00:00,What Is Chromecast? [2023 Guide to Google's Streaming Device] - Cloudwards,"{'href': 'https://www.cloudwards.net', 'title': 'Cloudwards'}"
2021-09-20 07:00:00+00:00,SF prank artist turns Google office into a Spirit Halloween store - SFGATE,"{'href': 'https://www.sfgate.com', 'title': 'SFGATE'}"
2021-09-20 07:00:00+00:00,Will Google Cloud ever win over enterprises? - InfoWorld,"{'href': 'https://www.infoworld.com', 'title': 'InfoWorld'}"
2021-09-17 07:00:00+00:00,"Google TV is working to inject free, ad-supported streaming ... - Chrome Unboxed","{'href': 'https://chromeunboxed.com', 'title': 'Chrome Unboxed'}"
2021-09-16 07:00:00+00:00,Thomas Kurian shows he's not afraid to shake things up at Google Cloud as he pursues growth - CNBC,"{'href': 'https://www.cnbc.com', 'title': 'CNBC'}"
2021-09-16 07:00:00+00:00,Google Cloud rolls out new storage products for better data protection - ZDNet,"{'href': 'https://www.zdnet.com', 'title': 'ZDNet'}"
2021-09-30 07:00:00+00:00,"How Google, Facebook lay giant undersea internet cables: photos - Business Insider","{'href': 'https://www.businessinsider.com', 'title': 'Business Insider'}"
2021-09-19 07:00:00+00:00,"Google: Larry Page's Palo Alto $10m mansion burns down, say reports - Business Insider","{'href': 'https://www.businessinsider.com', 'title': 'Business Insider'}"
2021-09-28 07:00:00+00:00,Genshin Impact players review bomb Google Play rating as ... - Gamesradar,"{'href': 'https://www.gamesradar.com', 'title': 'Gamesradar'}"
2021-09-23 07:00:00+00:00,Black Google Product Manager Stopped By Security Because They Didn’t Believe He Was An Employee - Forbes,"{'href': 'https://www.forbes.com', 'title': 'Forbes'}"
2021-09-22 07:00:00+00:00,Google Pixel 6 Pro just appeared in first hands-on video - Tom's Guide,"{'href': 'https://www.tomsguide.com', 'title': ""Tom's Guide""}"
2021-09-17 07:00:00+00:00,Why Does Google Replace Page Titles? - Search Engine Journal,"{'href': 'https://www.searchenginejournal.com', 'title': 'Search Engine Journal'}"
2021-09-21 07:00:00+00:00,Google DORA Report Shows Modest DevOps Gains - DevOps.com,"{'href': 'https://devops.com', 'title': 'DevOps.com'}"
2021-09-15 07:00:00+00:00,Google workers demand back pay for temps company underpaid for years - The Guardian,"{'href': 'https://www.theguardian.com', 'title': 'The Guardian'}"
2021-09-23 07:00:00+00:00,"Sideswiped: Apple, Google, and the Kremlin's Make-Believe Election - Carnegie Endowment for International Peace","{'href': 'https://carnegieendowment.org', 'title': 'Carnegie Endowment for International Peace'}"
2021-09-27 07:00:00+00:00,Google Ditches Last-click Attribution In Favor Of Machine Learning ... - The Drum,"{'href': 'https://www.thedrum.com', 'title': 'The Drum'}"
2021-09-28 07:00:00+00:00,Google Tells Judges It's So Popular It's Bing's Top Search Term - Bloomberg,"{'href': 'https://www.bloomberg.com', 'title': 'Bloomberg'}"
2021-09-28 07:00:00+00:00,Phiar Technologies Secures $12 Million Series A and Names ... - Business Wire,"{'href': 'https://www.businesswire.com', 'title': 'Business Wire'}"
2021-09-15 07:00:00+00:00,Uncommon's latest campaign for Google celebrates 'the power of ... - Creative Boom,"{'href': 'https://www.creativeboom.com', 'title': 'Creative Boom'}"
2021-09-18 07:00:00+00:00,I tried ex-Google boss Eric Schmidt's hack to tackle 765 emails - Business Insider,"{'href': 'https://www.businessinsider.com', 'title': 'Business Insider'}"
2021-09-15 07:00:00+00:00,Google Cloud CEO Thomas Kurian reorganizes engineering unit in hopes of gaining market share more quickly - CNBC,"{'href': 'https://www.cnbc.com', 'title': 'CNBC'}"
2021-09-27 07:00:00+00:00,"Goodbye, Last-Click Attribution: Google Ads Changes Default To ... - AdExchanger","{'href': 'https://www.adexchanger.com', 'title': 'AdExchanger'}"
2021-09-22 07:00:00+00:00,"Google, Facebook, Apple and Amazon keep buying smaller ... - The Washington Post","{'href': 'https://www.washingtonpost.com', 'title': 'The Washington Post'}"
2021-09-27 07:00:00+00:00,"Fed Circ. moves West Texas Google, Sonos patent dispute to Calif. - Reuters","{'href': 'https://www.reuters.com', 'title': 'Reuters'}"
2021-09-20 07:00:00+00:00,DeepMind tells Google it has no idea how to make AI less toxic - TNW,"{'href': 'https://thenextweb.com', 'title': 'TNW'}"
2021-09-24 07:00:00+00:00,Google Tasks is latest Workspace app to get a new icon - 9to5Google,"{'href': 'https://9to5google.com', 'title': '9to5Google'}"
2021-09-21 07:00:00+00:00,Google Maps can now adjust its Android Auto UI for right-hand drive ... - 9to5Google,"{'href': 'https://9to5google.com', 'title': '9to5Google'}"
2021-09-21 07:00:00+00:00,Reese Witherspoon's book club gets Google Assistant collaboration - CNET,"{'href': 'https://www.cnet.com', 'title': 'CNET'}"
2021-09-28 07:00:00+00:00,How to Use Google Classroom: A Quick Start Guide - MUO - MakeUseOf,"{'href': 'https://www.makeuseof.com', 'title': 'MUO - MakeUseOf'}"
2021-09-24 07:00:00+00:00,Chrome extensions will be much safer by 2023 when Google plans ... - Chrome Unboxed,"{'href': 'https://chromeunboxed.com', 'title': 'Chrome Unboxed'}"
2021-09-29 07:00:00+00:00,How to use find and replace in Google Docs - Business Insider,"{'href': 'https://www.businessinsider.com', 'title': 'Business Insider'}"
2021-09-22 07:00:00+00:00,Three Dallas Startups Join Google for Startups' Black Founders Fund - dallasinnovates.com,"{'href': 'https://dallasinnovates.com', 'title': 'dallasinnovates.com'}"
2021-09-29 07:00:00+00:00,Hiya Branded Call and Secure Call Now Available on Google and ... - Business Wire,"{'href': 'https://www.businesswire.com', 'title': 'Business Wire'}"
2021-09-22 07:00:00+00:00,How to back up your Android phone and data with Google One - Android Central,"{'href': 'https://www.androidcentral.com', 'title': 'Android Central'}"
2021-09-15 07:00:00+00:00,Google Keep will get its Material You makeover later this month - Phandroid - News for Android,"{'href': 'https://phandroid.com', 'title': 'Phandroid - News for Android'}"
2021-09-23 07:00:00+00:00,Otter Chrome Extension Makes Adding Meeting Notes to Google ... - Business Wire,"{'href': 'https://www.businesswire.com', 'title': 'Business Wire'}"
2021-09-29 07:00:00+00:00,Scotiabank Partners with Google Cloud to Create More ... - PR Newswire,"{'href': 'https://www.prnewswire.com', 'title': 'PR Newswire'}"
2021-09-21 07:00:00+00:00,True or false: Apple and Google slow down older phones when a ... - Komando,"{'href': 'https://www.komando.com', 'title': 'Komando'}"
2021-09-24 07:00:00+00:00,Google Is Helping Travelers Choose Sustainable Hotels With This ... - Travel + Leisure,"{'href': 'https://www.travelandleisure.com', 'title': 'Travel + Leisure'}"
2021-09-28 07:00:00+00:00,Google has a cunning plan to break your ad blocker - TechRadar,"{'href': 'https://www.techradar.com', 'title': 'TechRadar'}"
2021-09-19 07:00:00+00:00,Google Store birthday sale teases Pixel 6 'offer' for buyers - 9to5Google,"{'href': 'https://9to5google.com', 'title': '9to5Google'}"
2021-09-27 07:00:00+00:00,Google's Chrome OS Enterprise targets contact centers with variety of partners - ZDNet,"{'href': 'https://www.zdnet.com', 'title': 'ZDNet'}"
2021-09-21 07:00:00+00:00,How to connect Google Nest home speakers to Wi-Fi - Digital Trends,"{'href': 'https://www.digitaltrends.com', 'title': 'Digital Trends'}"
2021-09-21 07:00:00+00:00,Now you can turn off personal results from Google Search results on ... - TestingCatalog,"{'href': 'https://www.testingcatalog.com', 'title': 'TestingCatalog'}"
2021-09-28 07:00:00+00:00,Five Ways You Could Be Wasting Your Google Ads Spend - The Drum,"{'href': 'https://www.thedrum.com', 'title': 'The Drum'}"
2021-09-20 07:00:00+00:00,‘So much for don’t be evil’: Aussie startup Unlockd sues Google in the US - Sydney Morning Herald,"{'href': 'https://www.smh.com.au', 'title': 'Sydney Morning Herald'}"
2021-09-29 07:00:00+00:00,New Honda Models Will Have Built-in Google Starting in 2022 - MotorTrend,"{'href': 'https://www.motortrend.com', 'title': 'MotorTrend'}"
2021-09-27 07:00:00+00:00,Google Assistant appears to be gaining Material You tweaks and ... - 9to5Google,"{'href': 'https://9to5google.com', 'title': '9to5Google'}"
2021-09-23 07:00:00+00:00,"Google Meet ""mute all"" feature rolling out now on iOS - Devdiscourse","{'href': 'https://www.devdiscourse.com', 'title': 'Devdiscourse'}"
2021-09-28 07:00:00+00:00,Google's Isabelle Olsson + Sung Bai Challenge The Status Quo in ... - Design Milk,"{'href': 'https://design-milk.com', 'title': 'Design Milk'}"
2021-09-23 07:00:00+00:00,"Techs and the City: Where Google, Amazon and Others Are ... - The Wall Street Journal","{'href': 'https://www.wsj.com', 'title': 'The Wall Street Journal'}"
2021-09-23 07:00:00+00:00,Google privacy settings to change now - The Washington Post,"{'href': 'https://www.washingtonpost.com', 'title': 'The Washington Post'}"
2021-10-08 07:00:00+00:00,Google cracks down on climate change denial by targeting ads - The Associated Press,"{'href': 'https://apnews.com', 'title': 'The Associated Press'}"
2021-10-07 07:00:00+00:00,Google Will Ban Ads That Deny Climate Change And Demonetize ... - AdExchanger,"{'href': 'https://www.adexchanger.com', 'title': 'AdExchanger'}"
2021-10-07 07:00:00+00:00,Google will prevent climate change deniers from making money from ads - CNN,"{'href': 'https://www.cnn.com', 'title': 'CNN'}"
2021-10-06 07:00:00+00:00,Google Flights will show carbon emissions in flight results - NPR,"{'href': 'https://www.npr.org', 'title': 'NPR'}"
2021-10-06 07:00:00+00:00,Google launches new features to help users shrink their carbon ... - The Verge,"{'href': 'https://www.theverge.com', 'title': 'The Verge'}"
2021-10-06 07:00:00+00:00,Google Now Reports Emissions Data For Every Flight - Forbes,"{'href': 'https://www.forbes.com', 'title': 'Forbes'}"
2021-10-12 07:00:00+00:00,Wendy's and Google Cloud Partner to Enhance the Wendy's ... - PR Newswire,"{'href': 'https://www.prnewswire.com', 'title': 'PR Newswire'}"
2021-10-07 07:00:00+00:00,"The iPhone 13 is impressive, but Google's Pixel 6 is surprisingly ... - CNET","{'href': 'https://www.cnet.com', 'title': 'CNET'}"
2021-10-05 07:00:00+00:00,Google is about to turn on two-factor authentication by default for ... - The Verge,"{'href': 'https://www.theverge.com', 'title': 'The Verge'}"
2021-10-05 07:00:00+00:00,Google just announced its Pixel 6 event on October 19th - The Verge,"{'href': 'https://www.theverge.com', 'title': 'The Verge'}"
2021-10-13 07:00:00+00:00,Google Pixel 6 Pro camera module may not be user-replaceable - GSMArena.com news - GSMArena.com,"{'href': 'https://www.gsmarena.com', 'title': 'GSMArena.com'}"
2021-10-01 07:00:00+00:00,Google shuts down Plex banking service after less than a year - Engadget,"{'href': 'https://www.engadget.com', 'title': 'Engadget'}"
2021-10-12 07:00:00+00:00,"Google files a counterclaim in Epic Games lawsuit, saying it’s owed financial relief - TechCrunch","{'href': 'https://techcrunch.com', 'title': 'TechCrunch'}"
2021-10-06 07:00:00+00:00,Google Rolls Out Emission-Curbing Tools for Nest Thermostat - The Wall Street Journal,"{'href': 'https://www.wsj.com', 'title': 'The Wall Street Journal'}"
2021-10-06 07:00:00+00:00,Thales and Google Cloud Announce Strategic Partnership to Jointly ... - PR Newswire,"{'href': 'https://www.prnewswire.com', 'title': 'PR Newswire'}"
2021-10-12 07:00:00+00:00,Google TV features finally make sense with new multi-user support - Ars Technica,"{'href': 'https://arstechnica.com', 'title': 'Ars Technica'}"
2021-10-12 07:00:00+00:00,Google Announces Cybersecurity Action Team to Support the ... - PR Newswire,"{'href': 'https://www.prnewswire.com', 'title': 'PR Newswire'}"
2021-10-13 07:00:00+00:00,"Google, Amazon employees condemn Israeli military contract - Business Insider","{'href': 'https://www.businessinsider.com', 'title': 'Business Insider'}"
2021-10-12 07:00:00+00:00,Google says it's dropping Material Design components on iOS in ... - The Verge,"{'href': 'https://www.theverge.com', 'title': 'The Verge'}"
2021-10-12 07:00:00+00:00,What is Night Sight and what can it do on the Pixel phones? - Pocket-lint,"{'href': 'https://www.pocket-lint.com', 'title': 'Pocket-lint'}"
2021-10-08 07:00:00+00:00,Google to give security keys to ‘high risk’ users targeted by government hackers - TechCrunch,"{'href': 'https://techcrunch.com', 'title': 'TechCrunch'}"
2021-10-05 07:00:00+00:00,"Government secretly orders Google to track anyone searching certain names, addresses, and phone numbers - Yahoo News","{'href': 'https://news.yahoo.com', 'title': 'Yahoo News'}"
2021-10-14 07:00:00+00:00,Google is making it easier to doomscroll through search results - The Verge,"{'href': 'https://www.theverge.com', 'title': 'The Verge'}"
2021-10-04 07:00:00+00:00,Google Tests Feature to Help Users Click from Websites to ... - Search Engine Journal,"{'href': 'https://www.searchenginejournal.com', 'title': 'Search Engine Journal'}"
2021-10-12 07:00:00+00:00,"Sorry Google, but five years of Pixel 6 security updates won't be ... - Tom's Guide","{'href': 'https://www.tomsguide.com', 'title': ""Tom's Guide""}"
2021-10-01 07:00:00+00:00,"Google says the most searched word on Bing is, wait for it, 'Google' - PC Gamer","{'href': 'https://www.pcgamer.com', 'title': 'PC Gamer'}"
2021-10-01 07:00:00+00:00,"Google security official mocked gay staffer, lawsuit alleges - Reuters","{'href': 'https://www.reuters.com', 'title': 'Reuters'}"
2021-10-02 07:00:00+00:00,Google's Latest Tracking Nightmare For Chrome Comes In Two Parts - Forbes,"{'href': 'https://www.forbes.com', 'title': 'Forbes'}"
2021-10-08 07:00:00+00:00,Bakkt Partners with Google to Introduce Digital Assets to Millions of ... - Business Wire,"{'href': 'https://www.businesswire.com', 'title': 'Business Wire'}"
2021-10-07 07:00:00+00:00,The Word that Explains Why People Trust Google More than ... - Inc.,"{'href': 'https://www.inc.com', 'title': 'Inc.'}"
2021-10-07 07:00:00+00:00,"Google starts to roll out ""Quick Phrases"", talk to Assistant without saying ""Hey Google"" - GSMArena.com news - GSMArena.com","{'href': 'https://www.gsmarena.com', 'title': 'GSMArena.com'}"
2021-10-04 07:00:00+00:00,HubSpot names Google exec as chief product officer - Bizwomen - The Business Journals,"{'href': 'https://www.bizjournals.com', 'title': 'The Business Journals'}"
2021-10-06 07:00:00+00:00,Google’s Wing Kicks Off Mall-To-Home Drone Delivery Service - Forbes,"{'href': 'https://www.forbes.com', 'title': 'Forbes'}"
2021-10-05 07:00:00+00:00,Google Nest Doorbell and Cam battery review: one step forward ... - The Verge,"{'href': 'https://www.theverge.com', 'title': 'The Verge'}"
2021-10-14 07:00:00+00:00,Google's Pocket Gallery art museum experiences come to the web - Engadget,"{'href': 'https://www.engadget.com', 'title': 'Engadget'}"
2021-10-08 07:00:00+00:00,"Google Reader is still defunct, but now you can 'follow' RSS feeds in ... - The Verge","{'href': 'https://www.theverge.com', 'title': 'The Verge'}"
2021-10-03 07:00:00+00:00,How To Make Your iPhone The Perfect Google Phone - Screen Rant,"{'href': 'https://screenrant.com', 'title': 'Screen Rant'}"
2021-10-06 07:00:00+00:00,"In Israel, Google tests AI tech to better time traffic lights - The Times of Israel","{'href': 'https://www.timesofisrael.com', 'title': 'The Times of Israel'}"
2021-10-03 07:00:00+00:00,Google Pixel 6 Pro case just revealed key design details - Tom's Guide,"{'href': 'https://www.tomsguide.com', 'title': ""Tom's Guide""}"
2021-10-12 07:00:00+00:00,Google and Qualcomm Join Forces to Drive Advancements in Next ... - BlackBerry,"{'href': 'https://www.blackberry.com', 'title': 'BlackBerry'}"
