date,title,publisher
2021-01-09 08:00:00+00:00,Google suspends 'free speech' app Parler - BBC,"{'href': 'https://www.bbc.com', 'title': 'BBC'}"
2021-01-08 08:00:00+00:00,Google suspends Parler social networking app from Play Store ... - Reuters,"{'href': 'https://www.reuters.com', 'title': 'Reuters'}"
2021-01-08 08:00:00+00:00,Google pulls Parler from Play Store for fostering calls to violence - The Verge,"{'href': 'https://www.theverge.com', 'title': 'The Verge'}"
2021-01-04 08:00:00+00:00,"Hundreds of Google Employees Unionize, Culminating Years of ... - The New York Times","{'href': 'https://www.nytimes.com', 'title': 'The New York Times'}"
2021-01-04 08:00:00+00:00,Google workers have formed the company's first-ever union - CNN,"{'href': 'https://www.cnn.com', 'title': 'CNN'}"
2021-01-04 08:00:00+00:00,More than 200 US Google employees form a workers’ union - The Guardian,"{'href': 'https://www.theguardian.com', 'title': 'The Guardian'}"
2021-01-14 08:00:00+00:00,"Google closes Fitbit deal as U.S., Australia probes continue - Reuters","{'href': 'https://www.reuters.com', 'title': 'Reuters'}"
2021-01-08 08:00:00+00:00,Google Workers Speak Out About Why They Formed A Union: 'To ... - NPR,"{'href': 'https://www.npr.org', 'title': 'NPR'}"
2021-01-08 08:00:00+00:00,CMA to investigate Google's 'Privacy Sandbox' browser changes - GOV.UK,"{'href': 'https://www.gov.uk', 'title': 'GOV.UK'}"
2021-01-05 08:00:00+00:00,Ken Paxton scandal could cost state millions in legal fees for Google ... - The Texas Tribune,"{'href': 'https://www.texastribune.org', 'title': 'The Texas Tribune'}"
2021-01-13 08:00:00+00:00,Google admits to running 'experiments' which remove some media sites from its search results - The Guardian,"{'href': 'https://www.theguardian.com', 'title': 'The Guardian'}"
2021-01-05 08:00:00+00:00,Google workers have made organizing attempts in the past. Here's why this one is more significant - CNBC,"{'href': 'https://www.cnbc.com', 'title': 'CNBC'}"
2021-01-12 08:00:00+00:00,EXCLUSIVE Civil rights groups demand Google remove Trump's ... - Reuters,"{'href': 'https://www.reuters.com', 'title': 'Reuters'}"
2021-01-08 08:00:00+00:00,How to use Google Assistant driving mode in Google Maps - Business Insider,"{'href': 'https://www.businessinsider.com', 'title': 'Business Insider'}"
2021-01-05 08:00:00+00:00,Google Hasn't Updated Its iOS Apps Since the Day Before Apple's ... - MacRumors,"{'href': 'https://www.macrumors.com', 'title': 'MacRumors'}"
2021-01-12 08:00:00+00:00,Google is giving $3 million to news orgs to fact-check vaccine ... - Nieman Journalism Lab at Harvard,"{'href': 'https://www.niemanlab.org', 'title': 'Nieman Journalism Lab at Harvard'}"
2021-01-11 08:00:00+00:00,JPM: Boehringer partners with Google to bring quantum computing ... - FierceBiotech,"{'href': 'https://www.fiercebiotech.com', 'title': 'FierceBiotech'}"
2021-01-03 08:00:00+00:00,"Sorry, Alexa and Siri. These 5 Google Home features make me love ... - CNET","{'href': 'https://www.cnet.com', 'title': 'CNET'}"
2021-01-11 08:00:00+00:00,Google Has 'Shattered' Its Pipeline To Black Talent - VICE,"{'href': 'https://www.vice.com', 'title': 'VICE'}"
2021-01-11 08:00:00+00:00,YouTube Competitor Rumble Hits Google With Antitrust Allegations - Bloomberg Law,"{'href': 'https://news.bloomberglaw.com', 'title': 'Bloomberg Law'}"
2021-01-12 08:00:00+00:00,Google reveals sophisticated Windows and Android hacking operation - ZDNet,"{'href': 'https://www.zdnet.com', 'title': 'ZDNet'}"
2021-01-08 08:00:00+00:00,A Google smart display with radar-based sleep tracking is reportedly happening - Ars Technica,"{'href': 'https://arstechnica.com', 'title': 'Ars Technica'}"
2021-01-12 08:00:00+00:00,"How far will Apple, Google, Twitter, Amazon and Facebook go to ... - The Washington Post","{'href': 'https://www.washingtonpost.com', 'title': 'The Washington Post'}"
2021-01-14 08:00:00+00:00,Google cracks down on personal loan apps in India following abuse and outcry - TechCrunch,"{'href': 'https://techcrunch.com', 'title': 'TechCrunch'}"
2021-01-13 08:00:00+00:00,Everything you need to know to find the perfect Google Pixel for you - CNN Underscored,"{'href': 'https://www.cnn.com', 'title': 'CNN Underscored'}"
2021-01-08 08:00:00+00:00,How to enable grid view in Google Meet - Business Insider,"{'href': 'https://www.businessinsider.com', 'title': 'Business Insider'}"
2021-01-08 08:00:00+00:00,Google TV will drive the experience in Sony's new 'Bravia XR ... - Chrome Unboxed,"{'href': 'https://chromeunboxed.com', 'title': 'Chrome Unboxed'}"
2021-01-14 08:00:00+00:00,Google Assistant's 'Guest Mode' for Incognito Use Arrives - Voicebot.ai,"{'href': 'https://voicebot.ai', 'title': 'Voicebot.ai'}"
2021-01-06 08:00:00+00:00,Google CEO strongly condemns violence and lawlessness in D.C. - CNBC,"{'href': 'https://www.cnbc.com', 'title': 'CNBC'}"
2021-01-08 08:00:00+00:00,Hackers can clone Google Titan 2FA keys using a side channel in NXP chips - Ars Technica,"{'href': 'https://arstechnica.com', 'title': 'Ars Technica'}"
2021-01-11 08:00:00+00:00,Google Makes 4 Changes to Index Coverage Report - Search Engine Journal,"{'href': 'https://www.searchenginejournal.com', 'title': 'Search Engine Journal'}"
2021-01-03 08:00:00+00:00,5 things we want to see from Google in 2021 - Android Authority,"{'href': 'https://www.androidauthority.com', 'title': 'Android Authority'}"
2021-01-13 08:00:00+00:00,"Toronto-based video platform Rumble sues Google, accusing tech giant of steering traffic to YouTube - Financial Post","{'href': 'https://financialpost.com', 'title': 'Financial Post'}"
2021-01-12 08:00:00+00:00,Google Search Console Adds Report For News Publishers - Search Engine Journal,"{'href': 'https://www.searchenginejournal.com', 'title': 'Search Engine Journal'}"
2021-01-11 08:00:00+00:00,Google offers a silly solution for multilingual Android Auto users ... - Android Police,"{'href': 'https://www.androidpolice.com', 'title': 'Android Police'}"
2021-01-10 08:00:00+00:00,Google Home: 5 things you need to be asking your smart speaker - CNET,"{'href': 'https://www.cnet.com', 'title': 'CNET'}"
2021-01-01 08:00:00+00:00,Hidden map on phone reveals everywhere you've been - KTAR.com,"{'href': 'https://ktar.com', 'title': 'KTAR.com'}"
2021-01-12 08:00:00+00:00,Google trained a trillion-parameter AI language model - VentureBeat,"{'href': 'https://venturebeat.com', 'title': 'VentureBeat'}"
2021-01-04 08:00:00+00:00,Karan Bajwa promoted to lead Google Cloud in Asia Pacific region - Business Standard,"{'href': 'https://www.business-standard.com', 'title': 'Business Standard'}"
2021-01-07 08:00:00+00:00,FTC commissioners criticize Apple and Google in settlement with mobile ad company - CNBC,"{'href': 'https://www.cnbc.com', 'title': 'CNBC'}"
2021-01-04 08:00:00+00:00,Google Search Traffic to Pirate Sites Down After Algorithm Updates - Search Engine Journal,"{'href': 'https://www.searchenginejournal.com', 'title': 'Search Engine Journal'}"
2021-01-08 08:00:00+00:00,Google Ads Salesperson Alleged to Link Organic Ranking to Ad ... - Search Engine Journal,"{'href': 'https://www.searchenginejournal.com', 'title': 'Search Engine Journal'}"
2021-01-06 08:00:00+00:00,Google Explains What URL Removals Tool Does - Search Engine Journal,"{'href': 'https://www.searchenginejournal.com', 'title': 'Search Engine Journal'}"
2021-01-06 08:00:00+00:00,How to search and switch tabs on Google Chrome - Business Insider,"{'href': 'https://www.businessinsider.com', 'title': 'Business Insider'}"
2021-01-12 08:00:00+00:00,Howard Alum & 1st Black Female Google VP Appointed to ... - HBCU Buzz,"{'href': 'https://hbcubuzz.com', 'title': 'HBCU Buzz'}"
2021-01-07 08:00:00+00:00,Google My Business launches new performance reporting - Search Engine Land,"{'href': 'https://searchengineland.com', 'title': 'Search Engine Land'}"
2021-01-12 08:00:00+00:00,How to track someone on Google Maps after they share their location with you - Business Insider India,"{'href': 'https://www.businessinsider.in', 'title': 'Business Insider India'}"
2021-01-08 08:00:00+00:00,"Would It Benefit Consumers to Break Up Amazon, Apple, Facebook ... - Newsweek","{'href': 'https://www.newsweek.com', 'title': 'Newsweek'}"
2021-01-13 08:00:00+00:00,Opinion | Google's Fake Union Insults the Labor Movement - The Wall Street Journal,"{'href': 'https://www.wsj.com', 'title': 'The Wall Street Journal'}"
2021-01-13 08:00:00+00:00,Google's new trillion-parameter AI language model is almost 6 times ... - TNW,"{'href': 'https://thenextweb.com', 'title': 'TNW'}"
2021-01-09 08:00:00+00:00,Google Phone app automatically records calls from unknown numbers - HT Tech,"{'href': 'https://tech.hindustantimes.com', 'title': 'HT Tech'}"
2021-01-14 08:00:00+00:00,"New Google Union Triples in Size in First Week, But Faces ... - KQED","{'href': 'https://www.kqed.org', 'title': 'KQED'}"
2021-01-12 08:00:00+00:00,Report: Google and Facebook are responsible for depressed ... - Poynter,"{'href': 'https://www.poynter.org', 'title': 'Poynter'}"
2021-01-06 08:00:00+00:00,"USTR slams India, Italy, Turkey on digital taxes but holds off on tariffs - Reuters","{'href': 'https://www.reuters.com', 'title': 'Reuters'}"
2021-01-09 08:00:00+00:00,Google Maps reminds you of how many places you couldn't visit this ... - Chrome Unboxed,"{'href': 'https://chromeunboxed.com', 'title': 'Chrome Unboxed'}"
2021-01-03 08:00:00+00:00,Five big business litigation questions for 2021 - Reuters,"{'href': 'https://www.reuters.com', 'title': 'Reuters'}"
2021-01-06 08:00:00+00:00,Google and Snapchat turn to beauty tech for AR makeup try-on - Glossy,"{'href': 'https://www.glossy.co', 'title': 'Glossy'}"
2021-01-01 08:00:00+00:00,"Google Pay now shows how much money you spent in 2020, here is ... - India Today","{'href': 'https://www.indiatoday.in', 'title': 'India Today'}"
2021-01-05 08:00:00+00:00,The Google Podcasts web app comes closer to replacing its app ... - Chrome Unboxed,"{'href': 'https://chromeunboxed.com', 'title': 'Chrome Unboxed'}"
2021-01-06 08:00:00+00:00,Changing of the Google Cloud guard as Rick Harshman exits - Channel Asia Singapore,"{'href': 'https://channelasia.tech', 'title': 'Channel Asia Singapore'}"
2021-01-13 08:00:00+00:00,"Google backs Biden immigration efforts, covers fees in threatened ... - Reuters","{'href': 'https://www.reuters.com', 'title': 'Reuters'}"
2021-01-14 08:00:00+00:00,Google Ad Manager Maintains Lead In Latest Advertiser ... - AdExchanger,"{'href': 'https://www.adexchanger.com', 'title': 'AdExchanger'}"
2021-01-08 08:00:00+00:00,Google Ads and SMBs: How to drive results on a low budget - Search Engine Land,"{'href': 'https://searchengineland.com', 'title': 'Search Engine Land'}"
2021-01-07 08:00:00+00:00,A beginner's guide to Google Analytics for startups - EU-Startups,"{'href': 'https://www.eu-startups.com', 'title': 'EU-Startups'}"
2021-01-11 08:00:00+00:00,She helps Google workers be productive. Here are her pro tips - CNN,"{'href': 'https://www.cnn.com', 'title': 'CNN'}"
2021-01-10 08:00:00+00:00,"Driven: Google, Uber, and the Battle to Build an Autonomous Car - Car and Driver","{'href': 'https://www.caranddriver.com', 'title': 'Car and Driver'}"
2021-01-07 08:00:00+00:00,Google's SMITH Algorithm Outperforms BERT - Search Engine Journal,"{'href': 'https://www.searchenginejournal.com', 'title': 'Search Engine Journal'}"
2021-01-06 08:00:00+00:00,AI models from Microsoft and Google already surpass human ... - VentureBeat,"{'href': 'https://venturebeat.com', 'title': 'VentureBeat'}"
2021-01-06 08:00:00+00:00,"This tool lets you confuse Google’s ad network, and a test shows it works - MIT Technology Review","{'href': 'https://www.technologyreview.com', 'title': 'MIT Technology Review'}"
2021-01-07 08:00:00+00:00,Google Finally Says It Loud and Clear That Google Maps Has Ads - autoevolution,"{'href': 'https://www.autoevolution.com', 'title': 'autoevolution'}"
2021-01-11 08:00:00+00:00,The Beginner's Guide to The Google HEART Framework - hackernoon.com,"{'href': 'https://hackernoon.com', 'title': 'hackernoon.com'}"
2021-01-15 08:00:00+00:00,Google says Pixel 4a 5G touchscreen issue will be fixed in February ... - Android Police,"{'href': 'https://www.androidpolice.com', 'title': 'Android Police'}"
2021-01-06 08:00:00+00:00,"Twitter, Facebook freeze Trump accounts as tech giants respond to ... - Reuters","{'href': 'https://www.reuters.com', 'title': 'Reuters'}"
2021-01-08 08:00:00+00:00,Google Maps for Android and Android Auto Gets Highly Anticipated ... - autoevolution,"{'href': 'https://www.autoevolution.com', 'title': 'autoevolution'}"
2021-01-14 08:00:00+00:00,Google removes some lending apps in India to protect consumers - Reuters India,"{'href': 'https://www.reuters.com', 'title': 'Reuters India'}"
2021-01-08 08:00:00+00:00,Bummed about new Google Photos storage limits? Amazon Photos says “hi” - Ars Technica,"{'href': 'https://arstechnica.com', 'title': 'Ars Technica'}"
2021-01-06 08:00:00+00:00,Google Nest Mini vs Amazon Echo Dot: which should you buy? - Radio Times,"{'href': 'https://www.radiotimes.com', 'title': 'Radio Times'}"
2021-01-04 08:00:00+00:00,Workers Organize Union at Google - SHRM,"{'href': 'https://www.shrm.org', 'title': 'SHRM'}"
2021-01-08 08:00:00+00:00,Google Ads Smart Bidding Now Allows For Data Exclusion - Search Engine Roundtable,"{'href': 'https://www.seroundtable.com', 'title': 'Search Engine Roundtable'}"
2021-01-11 08:00:00+00:00,Google Titan security keys hacked by French researchers - Naked Security,"{'href': 'https://nakedsecurity.sophos.com', 'title': 'Naked Security'}"
2021-01-15 08:00:00+00:00,"How to Change Default Search Engine in Chrome on Windows, Mac, Android, iOS - Beebom","{'href': 'https://beebom.com', 'title': 'Beebom'}"
2021-01-08 08:00:00+00:00,Google One may soon offer free trials of its upgraded storage plans - Chrome Unboxed,"{'href': 'https://chromeunboxed.com', 'title': 'Chrome Unboxed'}"
2021-01-14 08:00:00+00:00,Google tries to allay Fitbit-deal privacy fears - BBC,"{'href': 'https://www.bbc.co.uk', 'title': 'BBC'}"
2021-01-14 08:00:00+00:00,Android Auto is reading notifications in the wrong language — and ... - TNW,"{'href': 'https://thenextweb.com', 'title': 'TNW'}"
2021-01-05 08:00:00+00:00,Google Warns of Critical Android Remote Code Execution Bug - Threatpost,"{'href': 'https://threatpost.com', 'title': 'Threatpost'}"
2021-01-09 08:00:00+00:00,"Apple, Microsoft, Amazon, Google, Facebook, and Tesla are now ... - CEOWORLD magazine","{'href': 'https://ceoworld.biz', 'title': 'CEOWORLD magazine'}"
2021-01-14 08:00:00+00:00,HTC Wildfire E3 appears in Google Play Console - GSMArena.com,"{'href': 'https://www.gsmarena.com', 'title': 'GSMArena.com'}"
2021-01-08 08:00:00+00:00,Google Developers Machine Learning Crash Course - Genetic Engineering & Biotechnology News,"{'href': 'https://www.genengnews.com', 'title': 'Genetic Engineering & Biotechnology News'}"
2021-01-11 08:00:00+00:00,Chromecast with Google TV Review: Improved Streaming Remote ... - Clark.com - Clark Howard,"{'href': 'https://clark.com', 'title': 'Clark.com - Clark Howard'}"
2021-01-04 08:00:00+00:00,Here's Why Google Has Driverless Cars on the Road and Tesla Does Not - InsideHook,"{'href': 'https://www.insidehook.com', 'title': 'InsideHook'}"
2021-01-11 08:00:00+00:00,Student Asks Girl Out on a Date With Google Forms - VICE,"{'href': 'https://www.vice.com', 'title': 'VICE'}"
2021-01-13 08:00:00+00:00,"Air Force, Google Strike Agreement to Modernize Flight Training - FedTech Magazine","{'href': 'https://fedtechmagazine.com', 'title': 'FedTech Magazine'}"
2021-01-06 08:00:00+00:00,Google Maps Calling Out Square Ad Pins As Ads - Search Engine Roundtable,"{'href': 'https://www.seroundtable.com', 'title': 'Search Engine Roundtable'}"
2021-01-06 08:00:00+00:00,Google Assistant gains a 'Do Nothing Mode' in India that really does ... - 9to5Google,"{'href': 'https://9to5google.com', 'title': '9to5Google'}"
2021-01-04 08:00:00+00:00,Quick Tip: How to disconnect your Google Drive files from your ... - Chrome Unboxed,"{'href': 'https://chromeunboxed.com', 'title': 'Chrome Unboxed'}"
2021-01-13 08:00:00+00:00,The Google Assistant has a neat Dragon Ball Z Easter egg - 9to5Google,"{'href': 'https://9to5google.com', 'title': '9to5Google'}"
2021-01-13 08:00:00+00:00,Netherlands earned €25 mil. from Google's tax avoidance - NL Times,"{'href': 'https://nltimes.nl', 'title': 'NL Times'}"
2021-01-03 08:00:00+00:00,Valve bans former Newbee players from events - Reuters,"{'href': 'https://www.reuters.com', 'title': 'Reuters'}"
2021-01-08 08:00:00+00:00,How to group tabs in Google Chrome to organize them - Business Insider,"{'href': 'https://www.businessinsider.com', 'title': 'Business Insider'}"
2021-01-11 08:00:00+00:00,Google Releases New Google Maps Updates for Android and ... - autoevolution,"{'href': 'https://www.autoevolution.com', 'title': 'autoevolution'}"
2021-01-27 08:00:00+00:00,"Google to stop using Apple tool to track iPhone users, avoiding new ... - Reuters","{'href': 'https://www.reuters.com', 'title': 'Reuters'}"
2021-01-27 08:00:00+00:00,Google spells out consequences of Apple's privacy push and IDFA ... - VentureBeat,"{'href': 'https://venturebeat.com', 'title': 'VentureBeat'}"
2021-01-27 08:00:00+00:00,Google apps to stop using ad tracker highlighted by iOS 14 - AppleInsider,"{'href': 'https://appleinsider.com', 'title': 'AppleInsider'}"
2021-01-22 08:00:00+00:00,Google threatens to withdraw search engine from Australia - BBC,"{'href': 'https://www.bbc.com', 'title': 'BBC'}"
2021-01-21 08:00:00+00:00,Australian local government PR website given 'news' status by ... - Reuters,"{'href': 'https://www.reuters.com', 'title': 'Reuters'}"
2021-01-26 08:00:00+00:00,An Australia With No Google? The Bitter Fight Behind a Drastic ... - The New York Times,"{'href': 'https://www.nytimes.com', 'title': 'The New York Times'}"
2021-01-29 08:00:00+00:00,Google pulled its service from China more than a decade ago — can Australia learn from that? - ABC News,"{'href': 'https://www.abc.net.au', 'title': 'ABC News'}"
2021-01-26 08:00:00+00:00,The Industry Reacts To Google’s Bold Claim That FLoCs Are 95 ... - AdExchanger,"{'href': 'https://www.adexchanger.com', 'title': 'AdExchanger'}"
2021-01-21 08:00:00+00:00,Google inks agreement in France on paying publishers for news reuse - TechCrunch,"{'href': 'https://techcrunch.com', 'title': 'TechCrunch'}"
2021-01-27 08:00:00+00:00,Important stories hidden in Google's 'experiment' blocking Australian ... - The Guardian,"{'href': 'https://www.theguardian.com', 'title': 'The Guardian'}"
2021-01-21 08:00:00+00:00,Google Shuts Loon Helium Balloon Project - The New York Times,"{'href': 'https://www.nytimes.com', 'title': 'The New York Times'}"
2021-01-20 08:00:00+00:00,Former Google engineer Anthony Levandowski among list of last-minute Trump pardons - TechCrunch,"{'href': 'https://techcrunch.com', 'title': 'TechCrunch'}"
2021-01-25 08:00:00+00:00,"Google announces partnership with One Medical to open COVID-19 vaccine clinics, expedite process - KGO-TV","{'href': 'https://abc7news.com', 'title': 'KGO-TV'}"
2021-01-20 08:00:00+00:00,Google targets AI ethics lead Margaret Mitchell after firing Timnit Gebru - VentureBeat,"{'href': 'https://venturebeat.com', 'title': 'VentureBeat'}"
2021-01-22 08:00:00+00:00,"EU lawmakers want Amazon, Apple, Facebook, Google CEOs at ... - Reuters","{'href': 'https://www.reuters.com', 'title': 'Reuters'}"
2021-01-25 08:00:00+00:00,Google stops donations to U.S. Congress members who voted ... - Reuters,"{'href': 'https://www.reuters.com', 'title': 'Reuters'}"
2021-01-28 08:00:00+00:00,Google salvaged Robinhood's one-star rating by deleting nearly ... - The Verge,"{'href': 'https://www.theverge.com', 'title': 'The Verge'}"
2021-01-20 08:00:00+00:00,"Google Chrome now checks for weak passwords, helps fix them - BleepingComputer","{'href': 'https://www.bleepingcomputer.com', 'title': 'BleepingComputer'}"
2021-01-24 08:00:00+00:00,Google is threatening to pull its search engine from Australia. So what does that mean for you? - ABC News,"{'href': 'https://www.abc.net.au', 'title': 'ABC News'}"
2021-01-28 08:00:00+00:00,Gambling apps are coming to Google's Play Store in the US and 14 ... - The Verge,"{'href': 'https://www.theverge.com', 'title': 'The Verge'}"
2021-01-29 08:00:00+00:00,Chromecast with Google TV review: full smart TV upgrade with voice remote - The Guardian,"{'href': 'https://www.theguardian.com', 'title': 'The Guardian'}"
2021-01-18 08:00:00+00:00,US attacks Australia's 'extraordinary' plan to make Google and Facebook pay for news - The Guardian,"{'href': 'https://www.theguardian.com', 'title': 'The Guardian'}"
2021-01-25 08:00:00+00:00,Google: Sites Can Safely Display Pop-Ups On Temporary Basis - Search Engine Journal,"{'href': 'https://www.searchenginejournal.com', 'title': 'Search Engine Journal'}"
2021-01-25 08:00:00+00:00,How header bidding wars led to a Google antitrust case and claims ... - AdAge.com,"{'href': 'https://adage.com', 'title': 'AdAge.com'}"
2021-01-27 08:00:00+00:00,Google's Tilt Brush VR painting app goes open source - BBC,"{'href': 'https://www.bbc.com', 'title': 'BBC'}"
2021-01-17 08:00:00+00:00,Google Confirms Fitbit Deal: Here’s What It Means - Forbes,"{'href': 'https://www.forbes.com', 'title': 'Forbes'}"
2021-01-21 08:00:00+00:00,Otter.ai's new Chrome extension can transcribe Google Meet calls in ... - The Verge,"{'href': 'https://www.theverge.com', 'title': 'The Verge'}"
2021-01-27 08:00:00+00:00,Google's using AI to plan electric car trips because EV charging is ... - The Verge,"{'href': 'https://www.theverge.com', 'title': 'The Verge'}"
2021-01-26 08:00:00+00:00,Google warns of 'novel social engineering method' used to hack ... - The Verge,"{'href': 'https://www.theverge.com', 'title': 'The Verge'}"
2021-01-27 08:00:00+00:00,Google opens Dublin hub to tackle harmful online content - Reuters,"{'href': 'https://www.reuters.com', 'title': 'Reuters'}"
2021-01-19 08:00:00+00:00,Google CEO to meet with Black college leaders following racism allegations - CNN,"{'href': 'https://www.cnn.com', 'title': 'CNN'}"
2021-01-19 08:00:00+00:00,Google Cloud Launches Product Discovery Solutions for Retail ... - PR Newswire,"{'href': 'https://www.prnewswire.com', 'title': 'PR Newswire'}"
2021-01-29 08:00:00+00:00,Google CEO says recent AI disputes are the result of transparency - Business Insider,"{'href': 'https://www.businessinsider.com', 'title': 'Business Insider'}"
2021-01-25 08:00:00+00:00,Exclusive: Google workers across the globe announce international ... - The Verge,"{'href': 'https://www.theverge.com', 'title': 'The Verge'}"
2021-01-26 08:00:00+00:00,Google’s BeyondCorp Enterprise security platform is now generally available - TechCrunch,"{'href': 'https://techcrunch.com', 'title': 'TechCrunch'}"
2021-01-25 08:00:00+00:00,Does Google Set Limits to Search Traffic? - Search Engine Journal,"{'href': 'https://www.searchenginejournal.com', 'title': 'Search Engine Journal'}"
2021-01-22 08:00:00+00:00,"Amazon, Apple, Facebook, Google spend $65 million on ... - The Washington Post","{'href': 'https://www.washingtonpost.com', 'title': 'The Washington Post'}"
2021-01-30 08:00:00+00:00,Google union in turmoil following global alliance announcement - The Verge,"{'href': 'https://www.theverge.com', 'title': 'The Verge'}"
2021-01-16 08:00:00+00:00,Google Maps is rolling out incredibly accurate street-level details in ... - Android Police,"{'href': 'https://www.androidpolice.com', 'title': 'Android Police'}"
2021-01-29 08:00:00+00:00,134 funny things to ask your Google Assistant - from silly questions ... - The Scotsman,"{'href': 'https://www.scotsman.com', 'title': 'The Scotsman'}"
2021-01-22 08:00:00+00:00,Google Duo may shut down in April for uncertified Android devices - XDA Developers,"{'href': 'https://www.xda-developers.com', 'title': 'XDA Developers'}"
2021-01-19 08:00:00+00:00,Safer Badgers app now available in Google Play Store - University of Wisconsin-Madison,"{'href': 'https://news.wisc.edu', 'title': 'University of Wisconsin-Madison'}"
2021-01-27 08:00:00+00:00,Google to make Taiwan its main hardware R&D hub outside US - Nikkei Asia,"{'href': 'https://asia.nikkei.com', 'title': 'Nikkei Asia'}"
2021-01-21 08:00:00+00:00,Google Calendar for Web Gets Basic Offline Support - Thurrott.com,"{'href': 'https://www.thurrott.com', 'title': 'Thurrott.com'}"
2021-01-26 08:00:00+00:00,Google Lens Now Translates Offline - PCMag,"{'href': 'https://www.pcmag.com', 'title': 'PCMag'}"
2021-01-19 08:00:00+00:00,Honor is working on a new line of smartphones with Google Services - GSMArena.com,"{'href': 'https://www.gsmarena.com', 'title': 'GSMArena.com'}"
2021-01-27 08:00:00+00:00,Google Lens can do offline translations on Android - Android Police,"{'href': 'https://www.androidpolice.com', 'title': 'Android Police'}"
2021-01-31 08:00:00+00:00,Google is introducing Tab Groups feature and a new grid layout in ... - Digital Information World,"{'href': 'https://www.digitalinformationworld.com', 'title': 'Digital Information World'}"
2021-01-22 08:00:00+00:00,Google My Business updates flag review feature - Search Engine Land,"{'href': 'https://searchengineland.com', 'title': 'Search Engine Land'}"
2021-01-27 08:00:00+00:00,Google Chrome OS 88 turns your Chromebook into a smart display - PCWorld,"{'href': 'https://www.pcworld.com', 'title': 'PCWorld'}"
2021-01-28 08:00:00+00:00,Google gives recent Pixel device owners more control over Night Sight - The Verge,"{'href': 'https://www.theverge.com', 'title': 'The Verge'}"
2021-01-25 08:00:00+00:00,Google Photos app update finally makes it nice to use on your ... - Chrome Unboxed,"{'href': 'https://chromeunboxed.com', 'title': 'Chrome Unboxed'}"
2021-01-21 08:00:00+00:00,Google Awards MonetizeMore 2020 Innovation Award in Publishing ... - PR Newswire,"{'href': 'https://www.prnewswire.com', 'title': 'PR Newswire'}"
