date,title,publisher
2021-07-07 07:00:00+00:00,Google-backed Planet Labs to go public in $2.8 bln SPAC deal - Reuters,"{'href': 'https://www.reuters.com', 'title': 'Reuters'}"
2021-07-01 07:00:00+00:00,"Facebook, Google, TikTok and Twitter commit to tackling abuse of ... - CNET","{'href': 'https://www.cnet.com', 'title': 'CNET'}"
2021-07-09 07:00:00+00:00,"Google Pixel 6, 6 Pro full specs leak, custom chipset confirmed - GSMArena.com","{'href': 'https://www.gsmarena.com', 'title': 'GSMArena.com'}"
2021-07-08 07:00:00+00:00,You can finally use your Google Pay balance for in-store payments - Android Central,"{'href': 'https://www.androidcentral.com', 'title': 'Android Central'}"
2021-07-14 07:00:00+00:00,Google Chrome will add HTTPS-First Mode to keep your data safe - BleepingComputer,"{'href': 'https://www.bleepingcomputer.com', 'title': 'BleepingComputer'}"
2021-07-08 07:00:00+00:00,Google to buy Japan payment startup for $182 mln-plus -Nikkei - Reuters,"{'href': 'https://www.reuters.com', 'title': 'Reuters'}"
2021-07-08 07:00:00+00:00,Google employees angered by search giant's 'hypocritical' remote ... - CNET,"{'href': 'https://www.cnet.com', 'title': 'CNET'}"
2021-07-06 07:00:00+00:00,"The best browser to replace Google Chrome on Windows, Mac ... - ZDNet","{'href': 'https://www.zdnet.com', 'title': 'ZDNet'}"
2021-07-01 07:00:00+00:00,Google releases new open-source security software program ... - ZDNet,"{'href': 'https://www.zdnet.com', 'title': 'ZDNet'}"
2021-07-12 07:00:00+00:00,Google Home 2.40 rolling out Nest Hello controls for Quiet Time ... - 9to5Google,"{'href': 'https://9to5google.com', 'title': '9to5Google'}"
2021-07-03 07:00:00+00:00,"Google Doodle celebrates Ludwig Guttmann, 'father of the ... - USA TODAY","{'href': 'https://www.usatoday.com', 'title': 'USA TODAY'}"
2021-07-15 07:00:00+00:00,"Google's latest Chromebook update is safe to install again, leaving ... - Android Police","{'href': 'https://www.androidpolice.com', 'title': 'Android Police'}"
2021-07-12 07:00:00+00:00,Link Exchanges Violate Google Guidelines - Relevance Doesn't Matter - Search Engine Journal,"{'href': 'https://www.searchenginejournal.com', 'title': 'Search Engine Journal'}"
2021-06-30 23:31:35+00:00,AT&T sets Google Messages as default SMS app for all its Android ... - GSMArena.com,"{'href': 'https://www.gsmarena.com', 'title': 'GSMArena.com'}"
2021-07-07 07:00:00+00:00,Google Pixel Buds A-Series review - TechRadar,"{'href': 'https://www.techradar.com', 'title': 'TechRadar'}"
2021-07-06 07:00:00+00:00,AT&T and Google Cloud Expand 5G and Edge Collaboration to ... - PR Newswire,"{'href': 'https://www.prnewswire.com', 'title': 'PR Newswire'}"
2021-07-09 07:00:00+00:00,Google Pixel 4a with custom firmware was used by FBI to intercept ... - GSMArena.com,"{'href': 'https://www.gsmarena.com', 'title': 'GSMArena.com'}"
2021-07-08 07:00:00+00:00,"Tennessee AG suing Google for using 'illegal, anticompetitive, and unfair business practices' - WBIR.com","{'href': 'https://www.wbir.com', 'title': 'WBIR.com'}"
2021-07-09 07:00:00+00:00,Google Drive for Desktop app: 4 reasons why you should install it - TechRepublic,"{'href': 'https://www.techrepublic.com', 'title': 'TechRepublic'}"
2021-07-12 07:00:00+00:00,Here's how to opt-out of Google Chrome's Privacy Sandbox (FLoC) trials - ZDNet,"{'href': 'https://www.zdnet.com', 'title': 'ZDNet'}"
2021-07-07 07:00:00+00:00,Google names NCSU grad as cloud engineering hub site lead in Durham - WRAL TechWire,"{'href': 'https://wraltechwire.com', 'title': 'WRAL TechWire'}"
2021-07-05 07:00:00+00:00,Wear OS 3.0 version of the Google Play Store starts arriving on ... - Notebookcheck.net,"{'href': 'https://www.notebookcheck.net', 'title': 'Notebookcheck.net'}"
2021-07-07 07:00:00+00:00,"Google Chat review: Terrible as a Slack clone, good as a consumer chat app - Ars Technica","{'href': 'https://arstechnica.com', 'title': 'Ars Technica'}"
2021-07-05 07:00:00+00:00,Indoor Live View in Google Maps comes to transit stations in Japan - 9to5Google,"{'href': 'https://9to5google.com', 'title': '9to5Google'}"
2021-07-08 07:00:00+00:00,What Is The Significance Of Google’s New Tau VMs? - Forbes,"{'href': 'https://www.forbes.com', 'title': 'Forbes'}"
2021-07-14 07:00:00+00:00,Google Teams Up With GoDaddy - Search Engine Journal,"{'href': 'https://www.searchenginejournal.com', 'title': 'Search Engine Journal'}"
2021-07-12 07:00:00+00:00,Cohere Capital Completes Strategic Growth Investment in Promevo ... - Business Wire,"{'href': 'https://www.businesswire.com', 'title': 'Business Wire'}"
2021-07-01 07:00:00+00:00,Google Chrome will get an HTTPS-Only Mode for secure browsing - BleepingComputer,"{'href': 'https://www.bleepingcomputer.com', 'title': 'BleepingComputer'}"
2021-07-01 07:00:00+00:00,Google's iOS app has a secret pinball Easter egg now - The Verge,"{'href': 'https://www.theverge.com', 'title': 'The Verge'}"
2021-07-07 07:00:00+00:00,4 Ways to Optimize for Google's Page Experience Update - Search Engine Journal,"{'href': 'https://www.searchenginejournal.com', 'title': 'Search Engine Journal'}"
2021-07-05 07:00:00+00:00,Google is hiding a secret pinball game in one of its biggest iPhone ... - The Independent,"{'href': 'https://www.independent.co.uk', 'title': 'The Independent'}"
2021-07-01 07:00:00+00:00,Google Is a Librarian: Teaching SEO to Non-Specialists - Search Engine Journal,"{'href': 'https://www.searchenginejournal.com', 'title': 'Search Engine Journal'}"
2021-07-13 07:00:00+00:00,Google adds direct apply markup and new editorial guidelines for ... - Search Engine Land,"{'href': 'https://searchengineland.com', 'title': 'Search Engine Land'}"
2021-07-14 07:00:00+00:00,Google Photos preps 'Ask friends for photos' feature for shared albums - 9to5Google,"{'href': 'https://9to5google.com', 'title': '9to5Google'}"
2021-07-07 07:00:00+00:00,Google cartoonist Manu Cornet quits company after 14 years - Business Insider,"{'href': 'https://www.businessinsider.com', 'title': 'Business Insider'}"
2021-07-10 07:00:00+00:00,"Now, on Google Meet, add cats, astronauts, jellyfish and more! - HT Tech","{'href': 'https://tech.hindustantimes.com', 'title': 'HT Tech'}"
2021-07-12 07:00:00+00:00,What would happen if Facebook and Google left your country ... - LSE,"{'href': 'https://blogs.lse.ac.uk', 'title': 'LSE'}"
2021-07-07 07:00:00+00:00,Google Search Quality: Hacking the Most Problematic Spam - Search Engine Journal,"{'href': 'https://www.searchenginejournal.com', 'title': 'Search Engine Journal'}"
2021-07-10 07:00:00+00:00,How to drop a pin in Google Maps - Tom's Guide,"{'href': 'https://www.tomsguide.com', 'title': ""Tom's Guide""}"
2021-07-01 07:00:00+00:00,4 ways to protect your Google search history - Popular Science,"{'href': 'https://www.popsci.com', 'title': 'Popular Science'}"
2021-07-01 07:00:00+00:00,Google Health app leak points to new personal healthcare records ... - Android Authority,"{'href': 'https://www.androidauthority.com', 'title': 'Android Authority'}"
2021-07-01 07:00:00+00:00,Google sends out free Chromecast w/Google TV emails to YouTube ... - Chrome Unboxed,"{'href': 'https://chromeunboxed.com', 'title': 'Chrome Unboxed'}"
2021-07-10 07:00:00+00:00,Google Pay could upend Japan's smartphone payment leaders - Nikkei Asia,"{'href': 'https://asia.nikkei.com', 'title': 'Nikkei Asia'}"
2021-07-09 07:00:00+00:00,IAC CEO says Apple is ‘worse’ than Google and will be next target in U.S. antitrust crackdown - CNBC,"{'href': 'https://www.cnbc.com', 'title': 'CNBC'}"
2021-10-22 13:07:01+00:00,Google launches AI-powered 'Footy Skills Lab' - AFLW,"{'href': 'https://www.womens.afl', 'title': 'AFLW'}"
2021-07-02 07:00:00+00:00,How to Send Zoom Meeting Invite from Google Calendar - Beebom,"{'href': 'https://beebom.com', 'title': 'Beebom'}"
2021-07-01 07:00:00+00:00,Google gives third-party cookies a stay of execution - TechTarget,"{'href': 'https://www.techtarget.com', 'title': 'TechTarget'}"
2021-07-02 07:00:00+00:00,Google Drive for Desktop adds Google Photos upload and multi ... - Chrome Unboxed,"{'href': 'https://chromeunboxed.com', 'title': 'Chrome Unboxed'}"
2021-07-09 07:00:00+00:00,5 reasons the Chromecast with Google TV is worth buying - 9to5Google,"{'href': 'https://9to5google.com', 'title': '9to5Google'}"
2021-07-06 07:00:00+00:00,Google's Nest Thermostat Hits Record Low $88 During Limited Time Fire Sale - Hot Hardware,"{'href': 'https://hothardware.com', 'title': 'Hot Hardware'}"
2021-07-04 07:00:00+00:00,Who was Maliheh Afnan? Google Doodle celebrates life of ... - The National,"{'href': 'https://www.thenationalnews.com', 'title': 'The National'}"
2021-07-13 07:00:00+00:00,These Google search tips will make finding stuff online way easier - TNW,"{'href': 'https://thenextweb.com', 'title': 'TNW'}"
2021-07-02 07:00:00+00:00,How to Fix Chrome Not Opening in Windows 10 Computers - Wccftech,"{'href': 'https://wccftech.com', 'title': 'Wccftech'}"
2021-07-09 07:00:00+00:00,Google now does soft 404 detection by device type - Search Engine Land,"{'href': 'https://searchengineland.com', 'title': 'Search Engine Land'}"
2021-07-04 07:00:00+00:00,How to stop Google from tracking your location: All you need to know - India Today,"{'href': 'https://www.indiatoday.in', 'title': 'India Today'}"
2021-07-04 07:00:00+00:00,Google's John Mueller Doesn't See SEO Becoming Obsolete - Search Engine Journal,"{'href': 'https://www.searchenginejournal.com', 'title': 'Search Engine Journal'}"
2021-07-05 07:00:00+00:00,Google AI chief Jeff Dean sparks cries of hypocrisy as he urges marginalized groups to work with its researchers: 'After what you did to Timnit?' - Yahoo News,"{'href': 'https://news.yahoo.com', 'title': 'Yahoo News'}"
2021-07-07 07:00:00+00:00,China Claims To Have World's Most Powerful Quantum Computer ... - Interesting Engineering,"{'href': 'https://interestingengineering.com', 'title': 'Interesting Engineering'}"
2021-07-05 07:00:00+00:00,Google Photos alternatives: Some of the best free options [Video] - 9to5Google,"{'href': 'https://9to5google.com', 'title': '9to5Google'}"
2021-07-09 07:00:00+00:00,Rupert Murdoch’s answer to Google News is dead after only 18 months - Ars Technica,"{'href': 'https://arstechnica.com', 'title': 'Ars Technica'}"
2021-07-02 07:00:00+00:00,How to View the Edit History for a Cell in Google Sheets - groovyPost,"{'href': 'https://www.groovypost.com', 'title': 'groovyPost'}"
2021-07-07 07:00:00+00:00,Opinion | Let’s Make Google a Public Good - The New York Times,"{'href': 'https://www.nytimes.com', 'title': 'The New York Times'}"
2021-07-14 07:00:00+00:00,Google Sheets racks up 1 billion Play Store downloads - 9to5Google,"{'href': 'https://9to5google.com', 'title': '9to5Google'}"
2021-07-05 07:00:00+00:00,Google announces Adaire Fox-Martin as its new EMEA Cloud ... - SiliconRepublic.com,"{'href': 'https://www.siliconrepublic.com', 'title': 'SiliconRepublic.com'}"
2021-07-08 07:00:00+00:00,How to Disable Autofill in Google Chrome - Beebom,"{'href': 'https://beebom.com', 'title': 'Beebom'}"
2021-07-06 07:00:00+00:00,"Google Pay enables online loans for small businesses, partners with digital lending app FlexiLoans - The Financial Express","{'href': 'https://www.financialexpress.com', 'title': 'The Financial Express'}"
2021-07-06 07:00:00+00:00,The 4 Best Google Chrome Extensions for Writers - MUO - MakeUseOf,"{'href': 'https://www.makeuseof.com', 'title': 'MUO - MakeUseOf'}"
2021-07-02 07:00:00+00:00,Best ways to fix audio issues in Google Meet - Gadget Bridge,"{'href': 'https://www.gadgetbridge.com', 'title': 'Gadget Bridge'}"
2021-07-10 07:00:00+00:00,Google's CEO Is Facing Intense Criticism for Being 'Too Nice.' His ... - Inc.,"{'href': 'https://www.inc.com', 'title': 'Inc.'}"
2021-07-05 07:00:00+00:00,Google promises 5 years of support for its smart home devices - The Ambient,"{'href': 'https://www.the-ambient.com', 'title': 'The Ambient'}"
2021-07-06 07:00:00+00:00,Google Moves ‘Cookies’ End To 2023 As Digital Ad Biz Awaits Alternatives - Forbes,"{'href': 'https://www.forbes.com', 'title': 'Forbes'}"
2021-07-07 07:00:00+00:00,Dozens of attorneys general are suing Google over its Play Store’s alleged anticompetitive practices - Vox.com,"{'href': 'https://www.vox.com', 'title': 'Vox.com'}"
2021-07-01 07:00:00+00:00,Here's a look at the Google Photos homescreen widget in action on ... - 9to5Google,"{'href': 'https://9to5google.com', 'title': '9to5Google'}"
2021-07-09 07:00:00+00:00,Google’s Nest Hub is the best bedside smart display—and sleep tracking helps - Ars Technica,"{'href': 'https://arstechnica.com', 'title': 'Ars Technica'}"
2021-07-28 07:00:00+00:00,Google And Facebook Mandate Vaccines For Employees At U.S. ... - NPR,"{'href': 'https://www.npr.org', 'title': 'NPR'}"
2021-07-29 07:00:00+00:00,Google’s profits soar as revenue rises 62 percent. - The New York Times,"{'href': 'https://www.nytimes.com', 'title': 'The New York Times'}"
2021-07-28 07:00:00+00:00,"Google revenue jumps 62%, fueled by demand for online advertising - CNN","{'href': 'https://www.cnn.com', 'title': 'CNN'}"
2021-07-26 07:00:00+00:00,Alphabet (Google) Earnings: What to Look for from GOOGL - Investopedia,"{'href': 'https://www.investopedia.com', 'title': 'Investopedia'}"
2021-07-29 07:00:00+00:00,Hausfeld & Co LLP: New Lawsuit seeks damages from Google on ... - Business Wire,"{'href': 'https://www.businesswire.com', 'title': 'Business Wire'}"
2021-07-19 07:00:00+00:00,Google is making it easier to find Wear OS apps on the Play Store - The Verge,"{'href': 'https://www.theverge.com', 'title': 'The Verge'}"
2021-07-22 07:00:00+00:00,"Google pushed a one-character typo to production, bricking Chrome OS devices - Ars Technica","{'href': 'https://arstechnica.com', 'title': 'Ars Technica'}"
2021-07-20 07:00:00+00:00,Verizon and Google team up to bring enhanced messaging services ... - Verizon News,"{'href': 'https://www.verizon.com', 'title': 'Verizon News'}"
2021-07-29 07:00:00+00:00,Not so sweet: Google responds to 'sugar daddy' Play Store app ban - Android Police,"{'href': 'https://www.androidpolice.com', 'title': 'Android Police'}"
2021-07-17 07:00:00+00:00,It's time for Google to fix Android's share menu - Android Police,"{'href': 'https://www.androidpolice.com', 'title': 'Android Police'}"
2021-07-26 07:00:00+00:00,"EU gives Google 2 months to improve hotel, flight search results - Reuters","{'href': 'https://www.reuters.com', 'title': 'Reuters'}"
2021-07-22 07:00:00+00:00,Google Maps can now tell you when your train is too crowded for ... - Macworld,"{'href': 'https://www.macworld.com', 'title': 'Macworld'}"
2021-07-23 07:00:00+00:00,Google parent Alphabet launches Intrinsic: a new company to build ... - The Verge,"{'href': 'https://www.theverge.com', 'title': 'The Verge'}"
2021-07-16 07:00:00+00:00,Google adds toggle to divorce the Assistant from its corner gesture ... - Android Police,"{'href': 'https://www.androidpolice.com', 'title': 'Android Police'}"
2021-07-15 07:00:00+00:00,Google Maps' Ben Nevis route 'potentially fatal' - BBC,"{'href': 'https://www.bbc.com', 'title': 'BBC'}"
2021-07-22 07:00:00+00:00,Google is starting to tell you how it found Search results - Reuters,"{'href': 'https://www.reuters.com', 'title': 'Reuters'}"
2021-07-27 07:00:00+00:00,Google takes legal action over Germany's expanded hate-speech law - Reuters,"{'href': 'https://www.reuters.com', 'title': 'Reuters'}"
2021-07-23 07:00:00+00:00,Google is finally doing something about Google Drive spam - Ars Technica,"{'href': 'https://arstechnica.com', 'title': 'Ars Technica'}"
2021-07-22 07:00:00+00:00,DeepMind creates 'transformative' map of human proteins drawn by ... - The Verge,"{'href': 'https://www.theverge.com', 'title': 'The Verge'}"
2021-07-20 07:00:00+00:00,Dating Searches On Google Reach 5-Year High - NPR,"{'href': 'https://www.npr.org', 'title': 'NPR'}"
2021-07-16 07:00:00+00:00,Google's new 'quick delete' erases the last 15mins of your search history - ZDNet,"{'href': 'https://www.zdnet.com', 'title': 'ZDNet'}"
2021-07-15 07:00:00+00:00,Google parts with Cloud VP after uproar over his manifesto renouncing his antisemitism - CNBC,"{'href': 'https://www.cnbc.com', 'title': 'CNBC'}"
2021-07-21 07:00:00+00:00,Biden picks prominent Google critic as antitrust chief - Business Insider,"{'href': 'https://www.businessinsider.com', 'title': 'Business Insider'}"
2021-07-20 07:00:00+00:00,SpringML wins 2020 Google Cloud Public Sector Partner of the Year ... - PR Newswire,"{'href': 'https://www.prnewswire.com', 'title': 'PR Newswire'}"
2021-07-27 07:00:00+00:00,Google Cloud offers a model for fixing Google’s product-killing reputation - Ars Technica,"{'href': 'https://arstechnica.com', 'title': 'Ars Technica'}"
2021-07-30 07:00:00+00:00,How to save your Apple iPhone contacts into your Google account - HT Tech,"{'href': 'https://tech.hindustantimes.com', 'title': 'HT Tech'}"
2021-07-18 07:00:00+00:00,"After a 10-year wait, Pixel 6 is the Samsung-powered Google ... - PhoneArena","{'href': 'https://www.phonearena.com', 'title': 'PhoneArena'}"
2021-07-21 07:00:00+00:00,'Backup by Google One' is Android's new unified backup system - 9to5Google,"{'href': 'https://9to5google.com', 'title': '9to5Google'}"
2021-07-15 07:00:00+00:00,"Google staff say they're as productive at home, still must return to office - Business Insider","{'href': 'https://www.businessinsider.com', 'title': 'Business Insider'}"
2021-07-27 07:00:00+00:00,Google Cloud's Retail Search Equips Retailers with Google-Quality ... - PR Newswire,"{'href': 'https://www.prnewswire.com', 'title': 'PR Newswire'}"
2021-07-22 07:00:00+00:00,Google Cloud Announces Healthcare Data Engine to Enable ... - PR Newswire,"{'href': 'https://www.prnewswire.com', 'title': 'PR Newswire'}"
2021-07-16 07:00:00+00:00,How to Change Search Engine From Yahoo to Google on Mac - Guiding Tech,"{'href': 'https://www.guidingtech.com', 'title': 'Guiding Tech'}"
2021-07-20 07:00:00+00:00,Quantum computers: Google points the way towards scalable fault-tolerant quantum devices - ZDNet,"{'href': 'https://www.zdnet.com', 'title': 'ZDNet'}"
2021-07-21 07:00:00+00:00,Google's investment in simsim is not its first. Here's a look at other ... - YourStory,"{'href': 'https://yourstory.com', 'title': 'YourStory'}"
2021-07-20 07:00:00+00:00,Google advances 'invisible' cloud security with intrusion detection ... - SiliconANGLE News,"{'href': 'https://siliconangle.com', 'title': 'SiliconANGLE News'}"
2021-07-21 07:00:00+00:00,The Home Depot and Google Cloud Expand Partnership to ... - PR Newswire,"{'href': 'https://www.prnewswire.com', 'title': 'PR Newswire'}"
2021-07-20 07:00:00+00:00,Google messed up all those Chromebooks yesterday because of a ... - Android Police,"{'href': 'https://www.androidpolice.com', 'title': 'Android Police'}"
2021-07-15 07:00:00+00:00,Bell Partners with Google Cloud to Deliver Next-Generation Network ... - PR Newswire,"{'href': 'https://www.prnewswire.com', 'title': 'PR Newswire'}"
2021-07-30 07:00:00+00:00,U.S. judge says Google request for Microsoft documents is relevant - Reuters,"{'href': 'https://www.reuters.com', 'title': 'Reuters'}"
2021-07-21 07:00:00+00:00,Google Launches Free Deals Listings in Search Results - Google ... - Search Engine Journal,"{'href': 'https://www.searchenginejournal.com', 'title': 'Search Engine Journal'}"
2021-07-29 07:00:00+00:00,Russia fines Google 3 mln rbls for violating personal data law - Reuters,"{'href': 'https://www.reuters.com', 'title': 'Reuters'}"
2021-07-30 07:00:00+00:00,"Google founders have sold $1 billion in stock since May, the most since 2017 - CNBC","{'href': 'https://www.cnbc.com', 'title': 'CNBC'}"
2021-07-20 07:00:00+00:00,Combining Google Analytics Data with Other Sources - Practical Ecommerce,"{'href': 'https://www.practicalecommerce.com', 'title': 'Practical Ecommerce'}"
2021-07-15 07:00:00+00:00,Google Ads optimized targeting gradually rolling out - Search Engine Land,"{'href': 'https://searchengineland.com', 'title': 'Search Engine Land'}"
2021-07-15 07:00:00+00:00,11 Clever Google Maps Settings Everyone Should Be Using - Lifehacker,"{'href': 'https://lifehacker.com', 'title': 'Lifehacker'}"
2021-07-15 07:00:00+00:00,Google CEO Sundar Pichai: Climate is 'bar none' the No. 1 concern for young people - CNBC,"{'href': 'https://www.cnbc.com', 'title': 'CNBC'}"
2021-07-20 07:00:00+00:00,Google categorizes what organic search traffic drops look like - Search Engine Land,"{'href': 'https://searchengineland.com', 'title': 'Search Engine Land'}"
2021-07-23 07:00:00+00:00,"Google's three-strikes ad policy isn't the problem, it's policy ... - Search Engine Land","{'href': 'https://searchengineland.com', 'title': 'Search Engine Land'}"
2021-07-27 07:00:00+00:00,What Google Does With Feedback From Search Results - Search Engine Journal,"{'href': 'https://www.searchenginejournal.com', 'title': 'Search Engine Journal'}"
2021-07-19 07:00:00+00:00,Google to provide Air Force's maintenance office a cloud 'ecosystem' - FedScoop,"{'href': 'https://fedscoop.com', 'title': 'FedScoop'}"
2021-07-29 07:00:00+00:00,Google Cloud and SAP Partner to Accelerate Business ... - PR Newswire,"{'href': 'https://www.prnewswire.com', 'title': 'PR Newswire'}"
2021-07-20 07:00:00+00:00,How to Add Ranking Questions in Google Forms - MUO - MakeUseOf,"{'href': 'https://www.makeuseof.com', 'title': 'MUO - MakeUseOf'}"
2021-07-30 07:00:00+00:00,"Google Meet is now a simple PWA on Mac, Windows, and Chrome OS - 9to5Google","{'href': 'https://9to5google.com', 'title': '9to5Google'}"
2021-07-16 07:00:00+00:00,Google: Forum Links Do Not Work For SEO - Search Engine Roundtable,"{'href': 'https://www.seroundtable.com', 'title': 'Search Engine Roundtable'}"
2021-07-28 07:00:00+00:00,Put Google Maps on your iPhone and iPad Home screens with its ... - iMore,"{'href': 'https://www.imore.com', 'title': 'iMore'}"
2021-07-26 07:00:00+00:00,Google Chrome just got a killer new search feature - Tom's Guide,"{'href': 'https://www.tomsguide.com', 'title': ""Tom's Guide""}"
2021-07-20 07:00:00+00:00,What you need to know about fraudulent ads on Facebook and Google - Ladders,"{'href': 'https://www.theladders.com', 'title': 'Ladders'}"
2021-07-23 07:00:00+00:00,Google publishes detailed timeline for Privacy Sandbox rollout in ... - 9to5Google,"{'href': 'https://9to5google.com', 'title': '9to5Google'}"
2021-07-27 07:00:00+00:00,The Kerala-Born Executive Who Turned Around Google Cloud - NDTV,"{'href': 'https://www.ndtv.com', 'title': 'NDTV'}"
2021-07-23 07:00:00+00:00,Google Cloud intros new interoperability platform - Healthcare IT News,"{'href': 'https://www.healthcareitnews.com', 'title': 'Healthcare IT News'}"
2021-07-26 07:00:00+00:00,How to upload to Google Photos - Tom's Guide,"{'href': 'https://www.tomsguide.com', 'title': ""Tom's Guide""}"
2021-07-15 07:00:00+00:00,"Google CEO Sundar Pichai: A.I. More 'Profound' Than Fire, Electricity - Dice Insights","{'href': 'https://www.dice.com', 'title': 'Dice Insights'}"
2021-07-26 07:00:00+00:00,Google's Waymo asks UK not to curb use of autonomous vehicles - Business Insider,"{'href': 'https://www.businessinsider.com', 'title': 'Business Insider'}"
2021-07-26 07:00:00+00:00,Why Google Workspace Can Now Compete With Microsoft Teams In ... - CMSWire,"{'href': 'https://www.cmswire.com', 'title': 'CMSWire'}"
2021-07-21 07:00:00+00:00,Google to receive IDA Ireland Special Recognition Award 2021 - Gov.ie,"{'href': 'https://www.gov.ie', 'title': 'Gov.ie'}"
2021-07-30 07:00:00+00:00,Google Drive security update: What is it and what do I need to do? - Tom's Guide,"{'href': 'https://www.tomsguide.com', 'title': ""Tom's Guide""}"
2021-07-27 07:00:00+00:00,Google passes on 2% “Regulatory Operating Cost” for ads served in ... - Search Engine Land,"{'href': 'https://searchengineland.com', 'title': 'Search Engine Land'}"
2021-07-22 07:00:00+00:00,Google removes standalone Maximize conversions and Maximize ... - Search Engine Land,"{'href': 'https://searchengineland.com', 'title': 'Search Engine Land'}"
2021-07-15 07:00:00+00:00,Why Every Business Should Copy Google's '3-Day a Week' Plan For ... - Inc.,"{'href': 'https://www.inc.com', 'title': 'Inc.'}"
2021-07-22 07:00:00+00:00,Major GOP tech critics sought funding from Google - POLITICO,"{'href': 'https://www.politico.com', 'title': 'POLITICO'}"
2021-07-19 07:00:00+00:00,You can now sign into Twitter with your Google account - Phandroid - News for Android,"{'href': 'https://phandroid.com', 'title': 'Phandroid - News for Android'}"
2021-07-19 07:00:00+00:00,How to use Google Photos' sorting tools to organize your snapshots - The Arizona Republic,"{'href': 'https://www.azcentral.com', 'title': 'The Arizona Republic'}"
2021-07-26 07:00:00+00:00,7 best Google Photos tips and tricks you need to know - Android Central,"{'href': 'https://www.androidcentral.com', 'title': 'Android Central'}"
2021-07-20 07:00:00+00:00,Google drops AMP label in mobile search results - Search Engine Land,"{'href': 'https://searchengineland.com', 'title': 'Search Engine Land'}"
2021-07-16 07:00:00+00:00,Google Meet is finally getting virtual backgrounds on iOS - TechRadar,"{'href': 'https://www.techradar.com', 'title': 'TechRadar'}"
2021-07-26 07:00:00+00:00,"Google Faces Off With Amazon, Microsoft to Become a Cloud ... - Bloomberg","{'href': 'https://www.bloomberg.com', 'title': 'Bloomberg'}"
2021-07-28 07:00:00+00:00,Pixel 6 to show off Google's 'deep technology investments' - Tom's Guide,"{'href': 'https://www.tomsguide.com', 'title': ""Tom's Guide""}"
2021-07-18 07:00:00+00:00,Robotaxis: have Google and Amazon backed the wrong technology? - Financial Times,"{'href': 'https://www.ft.com', 'title': 'Financial Times'}"
2021-07-27 07:00:00+00:00,Android 13 Dessert Name Revealed by Google - Wccftech,"{'href': 'https://wccftech.com', 'title': 'Wccftech'}"
