date,title,publisher
2021-04-02 07:00:00+00:00,Google is limiting which apps can see everything else you have ... - The Verge,"{'href': 'https://www.theverge.com', 'title': 'The Verge'}"
2021-04-11 07:00:00+00:00,DuckDuckGo Announces Plans to Block Google's FLoC - Search Engine Journal,"{'href': 'https://www.searchenginejournal.com', 'title': 'Search Engine Journal'}"
2021-04-12 07:00:00+00:00,Google Photos just let me copy text from a photo into my web browser - The Verge,"{'href': 'https://www.theverge.com', 'title': 'The Verge'}"
2021-04-08 07:00:00+00:00,"Google I/O 2021 is happening, will be virtual with free attendance - GSMArena.com","{'href': 'https://www.gsmarena.com', 'title': 'GSMArena.com'}"
2021-04-12 07:00:00+00:00,Google is removing its Play Movies and TV app from every Roku ... - The Verge,"{'href': 'https://www.theverge.com', 'title': 'The Verge'}"
2021-04-05 07:00:00+00:00,'Get back to what you love': Google COVID-19 vaccine ad garners ... - USA TODAY,"{'href': 'https://www.usatoday.com', 'title': 'USA TODAY'}"
2021-04-06 07:00:00+00:00,Google's getting rid of the Google Wifi app - CNET,"{'href': 'https://www.cnet.com', 'title': 'CNET'}"
2021-04-09 07:00:00+00:00,"Google says the Pixel 5a will launch, but only in two countries - Ars Technica","{'href': 'https://arstechnica.com', 'title': 'Ars Technica'}"
2021-04-07 07:00:00+00:00,Google removes a fake 'Netflix' app that's been spreading malware ... - TNW,"{'href': 'https://thenextweb.com', 'title': 'TNW'}"
2021-04-12 07:00:00+00:00,"Why is Google Docs not working? Google says it's investigating issues affecting Google Drive, Docs - Tech Xplore","{'href': 'https://techxplore.com', 'title': 'Tech Xplore'}"
2021-04-12 07:00:00+00:00,Google Pixel Watch Leaks With Dazzling Looks To Challenge Apple ... - Forbes,"{'href': 'https://www.forbes.com', 'title': 'Forbes'}"
2021-04-02 07:00:00+00:00,Head of Google's self-driving car spin-off steps down - Financial Times,"{'href': 'https://www.ft.com', 'title': 'Financial Times'}"
2021-04-13 07:00:00+00:00,"For the Met Museum’s 151st Birthday, Google Showcases Works from the Institution’s Collection - ARTnews","{'href': 'https://www.artnews.com', 'title': 'ARTnews'}"
2021-04-11 07:00:00+00:00,Google reportedly ran secret 'Project Bernanke' that boosted its own ... - The Verge,"{'href': 'https://www.theverge.com', 'title': 'The Verge'}"
2021-04-14 07:00:00+00:00,Google is testing a new feature on Chrome that we desperately need - Yahoo Entertainment,"{'href': 'https://www.yahoo.com', 'title': 'Yahoo Entertainment'}"
2021-04-14 07:00:00+00:00,Google opens $2bn cloud region in Poland - Capacity Media,"{'href': 'https://www.capacitymedia.com', 'title': 'Capacity Media'}"
2021-04-05 07:00:00+00:00,Google's new Stack PDF scanner will organize your paperwork ... - CNET,"{'href': 'https://www.cnet.com', 'title': 'CNET'}"
2021-04-09 07:00:00+00:00,More than 500 Alphabet employees demand Google stop protecting ... - The Verge,"{'href': 'https://www.theverge.com', 'title': 'The Verge'}"
2021-04-06 07:00:00+00:00,"NEWS RELEASE: San José Announces Unprecedented Community ... - City of San Jose, CA","{'href': 'https://www.sanjoseca.gov', 'title': 'City of San Jose, CA'}"
2021-04-08 07:00:00+00:00,What Are Google Play Points and How Can You Use Them? - MUO - MakeUseOf,"{'href': 'https://www.makeuseof.com', 'title': 'MUO - MakeUseOf'}"
2021-04-02 07:00:00+00:00,Can Google Chrome Still Track You When You're Using ... - MUO - MakeUseOf,"{'href': 'https://www.makeuseof.com', 'title': 'MUO - MakeUseOf'}"
2021-04-06 07:00:00+00:00,Google may have leaked the new Pixel Buds - CNET,"{'href': 'https://www.cnet.com', 'title': 'CNET'}"
2021-04-04 07:00:00+00:00,How Google Maps Will Determine the Best Route on Android and ... - autoevolution,"{'href': 'https://www.autoevolution.com', 'title': 'autoevolution'}"
2021-04-12 07:00:00+00:00,Google founders Larry Page and Sergey Brin join $100bn club - The Guardian,"{'href': 'https://www.theguardian.com', 'title': 'The Guardian'}"
2021-04-07 07:00:00+00:00,Media Giant Grupo Globo Announces Strategic Partnership with ... - PR Newswire,"{'href': 'https://www.prnewswire.com', 'title': 'PR Newswire'}"
2021-04-13 07:00:00+00:00,Google is working to bring Sony's 360 Reality Audio to Android - Engadget,"{'href': 'https://www.engadget.com', 'title': 'Engadget'}"
2021-04-12 07:00:00+00:00,Google is making another attempt at personal health records - The Verge,"{'href': 'https://www.theverge.com', 'title': 'The Verge'}"
2021-04-06 07:00:00+00:00,Max Schrems accuses Google of illegally tracking Android users - Financial Times,"{'href': 'https://www.ft.com', 'title': 'Financial Times'}"
2021-04-08 07:00:00+00:00,⚖️ Google vs. Oracle - The Hustle,"{'href': 'https://thehustle.co', 'title': 'The Hustle'}"
2021-04-07 07:00:00+00:00,Google is now writing low-level Android code in Rust - Ars Technica,"{'href': 'https://arstechnica.com', 'title': 'Ars Technica'}"
2021-04-13 07:00:00+00:00,The best Google Pixel phone deals of April 2021 - Business Insider,"{'href': 'https://www.businessinsider.com', 'title': 'Business Insider'}"
2021-04-02 07:00:00+00:00,Google vs Bing: A Detailed Comparison of Two Search Engines - Search Engine Journal,"{'href': 'https://www.searchenginejournal.com', 'title': 'Search Engine Journal'}"
2021-04-01 07:00:00+00:00,Google is restricting which apps can see the other installed apps on ... - XDA Developers,"{'href': 'https://www.xda-developers.com', 'title': 'XDA Developers'}"
2021-04-12 07:00:00+00:00,Google could match Amazon and Microsoft with virtual desktop tool but keeps it for employees only - CNBC,"{'href': 'https://www.cnbc.com', 'title': 'CNBC'}"
2021-04-06 07:00:00+00:00,Remote working: Is Big Tech going off work from home? - BBC,"{'href': 'https://www.bbc.com', 'title': 'BBC'}"
2021-04-08 07:00:00+00:00,Google-backed TAE Technologies raises $280 million from new ... - Reuters,"{'href': 'https://www.reuters.com', 'title': 'Reuters'}"
2021-04-13 07:00:00+00:00,Google Doodle honors printing press pioneer Johannes Gutenberg - CNET,"{'href': 'https://www.cnet.com', 'title': 'CNET'}"
2021-04-09 07:00:00+00:00,Google Phone Now Automatically Records Calls From Unknown ... - MUO - MakeUseOf,"{'href': 'https://www.makeuseof.com', 'title': 'MUO - MakeUseOf'}"
2021-04-06 07:00:00+00:00,"Google, San Jose Development Deal Includes $200 Million in ... - KQED","{'href': 'https://www.kqed.org', 'title': 'KQED'}"
2021-04-04 07:00:00+00:00,The Google Chrome browser will now remember your tab groups ... - MSPoweruser,"{'href': 'https://mspoweruser.com', 'title': 'MSPoweruser'}"
2021-04-14 07:00:00+00:00,Google Ads rolling out auto-applied recommendations - Search Engine Land,"{'href': 'https://searchengineland.com', 'title': 'Search Engine Land'}"
2021-04-12 07:00:00+00:00,New Google Pixel Feature Might Save Your Life - Droid Life,"{'href': 'https://www.droid-life.com', 'title': 'Droid Life'}"
2021-04-09 07:00:00+00:00,Use a USB-C Hub to Upgrade Your Chromecast With Google TV - Gizmodo,"{'href': 'https://gizmodo.com', 'title': 'Gizmodo'}"
2021-04-07 07:00:00+00:00,Google Launches 2 Improvements to Search Console Reports - Search Engine Journal,"{'href': 'https://www.searchenginejournal.com', 'title': 'Search Engine Journal'}"
2021-04-13 07:00:00+00:00,U.S. Supreme Court Rules for Google in Landmark Decision ... - JD Supra,"{'href': 'https://www.jdsupra.com', 'title': 'JD Supra'}"
2021-04-13 07:00:00+00:00,Broadcom Picks Google Cloud To Host Core SaaS Offerings - CRN,"{'href': 'https://www.crn.com', 'title': 'CRN'}"
2021-04-09 07:00:00+00:00,"Google Shopping for Android, iOS shutting down in favor of the web - 9to5Google","{'href': 'https://9to5google.com', 'title': '9to5Google'}"
2021-04-06 07:00:00+00:00,How to use Google Photos to back up your photos - Business Insider,"{'href': 'https://www.businessinsider.com', 'title': 'Business Insider'}"
2021-04-13 07:00:00+00:00,Google's healthcare partnerships in the last 6 months: A timeline - Becker's Hospital Review,"{'href': 'https://www.beckershospitalreview.com', 'title': ""Becker's Hospital Review""}"
2021-04-10 07:00:00+00:00,Google On Optimizing Web Stories For Search Results - Search Engine Journal,"{'href': 'https://www.searchenginejournal.com', 'title': 'Search Engine Journal'}"
2021-04-09 07:00:00+00:00,She sued for pregnancy discrimination. Now she’s battling Google’s army of lawyers - The Guardian,"{'href': 'https://www.theguardian.com', 'title': 'The Guardian'}"
2021-04-12 07:00:00+00:00,"Facebook, Google lead latest undersea cable boom - FierceTelecom","{'href': 'https://www.fiercetelecom.com', 'title': 'FierceTelecom'}"
2021-04-13 07:00:00+00:00,Google is poisoning its reputation with AI researchers - The Verge,"{'href': 'https://www.theverge.com', 'title': 'The Verge'}"
2021-04-12 07:00:00+00:00,Some Nest Camera users say Google Home app shows 'camera ... - PiunikaWeb,"{'href': 'https://piunikaweb.com', 'title': 'PiunikaWeb'}"
2021-04-05 07:00:00+00:00,Google's cookieless ad targeting proposal under fire for ... - Digiday,"{'href': 'https://digiday.com', 'title': 'Digiday'}"
2021-04-14 07:00:00+00:00,"Google updating FeedBurner infrastructure, email subscriptions ... - 9to5Google","{'href': 'https://9to5google.com', 'title': '9to5Google'}"
2021-04-07 07:00:00+00:00,Google's new AR toy fulfills the childhood dream of digging a hole to ... - The Verge,"{'href': 'https://www.theverge.com', 'title': 'The Verge'}"
2021-04-07 07:00:00+00:00,LiveRamp Enters into Strategic Partnership with Google Cloud to ... - Business Wire,"{'href': 'https://www.businesswire.com', 'title': 'Business Wire'}"
2021-04-09 07:00:00+00:00,Google Search Console performance report image impression change - Search Engine Land,"{'href': 'https://searchengineland.com', 'title': 'Search Engine Land'}"
2021-04-05 07:00:00+00:00,Google Workspace users get deadline for storage restrictions ... - Chrome Unboxed,"{'href': 'https://chromeunboxed.com', 'title': 'Chrome Unboxed'}"
2021-04-01 07:00:00+00:00,Google shares five tips to spot fake news online ahead of International Fact Checking Day - India Today,"{'href': 'https://www.indiatoday.in', 'title': 'India Today'}"
2021-04-02 07:00:00+00:00,How to spot fake news online? Google shares tips | Mint - Mint,"{'href': 'https://www.livemint.com', 'title': 'Mint'}"
2021-04-05 07:00:00+00:00,Google rolls out Chat integration to all Gmail users - PhoneArena,"{'href': 'https://www.phonearena.com', 'title': 'PhoneArena'}"
2021-04-14 07:00:00+00:00,Google backs former DeepMind employee’s 'solar forecasting' start-up - CNBC,"{'href': 'https://www.cnbc.com', 'title': 'CNBC'}"
2021-04-08 07:00:00+00:00,Permission.io Launches Browser Extension on Google Chrome Store - GlobeNewswire,"{'href': 'https://www.globenewswire.com', 'title': 'GlobeNewswire'}"
2021-04-07 07:00:00+00:00,How to scrape contact information from a website with Google Sheets - TNW,"{'href': 'https://thenextweb.com', 'title': 'TNW'}"
2021-04-06 07:00:00+00:00,Google Doodle reminds us to wear a mask while practicing social distance - Firstpost,"{'href': 'https://www.firstpost.com', 'title': 'Firstpost'}"
2021-04-12 07:00:00+00:00,Fox News Media Hires Google Executive as Legal Boss (Corrects) - Bloomberg Law,"{'href': 'https://news.bloomberglaw.com', 'title': 'Bloomberg Law'}"
2021-04-09 07:00:00+00:00,Will Google Maps bring a new dimension to the in-store experience? - RetailWire,"{'href': 'https://retailwire.com', 'title': 'RetailWire'}"
2021-04-12 07:00:00+00:00,"Google Chrome, Microsoft Edge zero-day vulnerability shared on Twitter - BleepingComputer","{'href': 'https://www.bleepingcomputer.com', 'title': 'BleepingComputer'}"
2021-04-13 07:00:00+00:00,Google's partnership with ADT begins taking shape with Nest ... - Chrome Unboxed,"{'href': 'https://chromeunboxed.com', 'title': 'Chrome Unboxed'}"
2021-04-11 07:00:00+00:00,Google Lens expands beyond mobile and comes to desktop web ... - 9to5Google,"{'href': 'https://9to5google.com', 'title': '9to5Google'}"
2021-04-08 07:00:00+00:00,The woman who took on Google and won - BBC,"{'href': 'https://www.bbc.com', 'title': 'BBC'}"
2021-04-14 07:00:00+00:00,Google v. Oracle – Copyright Infringement in Developing ... - JD Supra,"{'href': 'https://www.jdsupra.com', 'title': 'JD Supra'}"
2021-04-02 07:00:00+00:00,Why the Google Nest Hub (2nd generation) isn't suited to those who ... - TechRadar,"{'href': 'https://www.techradar.com', 'title': 'TechRadar'}"
2021-04-07 07:00:00+00:00,"Opinion | After Working at Google, I'll Never Let Myself Love a Job ... - The New York Times","{'href': 'https://www.nytimes.com', 'title': 'The New York Times'}"
2021-04-06 07:00:00+00:00,Google Ads' continuous audience sharing is now available from sub ... - Search Engine Land,"{'href': 'https://searchengineland.com', 'title': 'Search Engine Land'}"
2021-04-01 07:00:00+00:00,"As Google partners with Fiat, Alexa steps into a Lamborghini - GearBrain","{'href': 'https://www.gearbrain.com', 'title': 'GearBrain'}"
2021-04-12 07:00:00+00:00,Top 7 Ways to Fix Memory Leak In Google Chrome on Windows and ... - Guiding Tech,"{'href': 'https://www.guidingtech.com', 'title': 'Guiding Tech'}"
2021-04-12 07:00:00+00:00,Google staff to CEO: 'We deserve environment free from abuse' - HRD America,"{'href': 'https://www.hcamag.com', 'title': 'HRD America'}"
2021-04-01 07:00:00+00:00,Google tracks a lot of data about you. Here's how to erase it. - USA TODAY,"{'href': 'https://www.usatoday.com', 'title': 'USA TODAY'}"
2021-04-07 07:00:00+00:00,Google updates Merchant Center product data specifications - Search Engine Land,"{'href': 'https://searchengineland.com', 'title': 'Search Engine Land'}"
2021-04-01 07:00:00+00:00,YouTube TV now lets you play YouTube and Google TV movie ... - 9to5Google,"{'href': 'https://9to5google.com', 'title': '9to5Google'}"
2021-04-06 07:00:00+00:00,How to turn off Google Assistant on your phone? Here is a step-by-step guide - Republic World,"{'href': 'https://www.republicworld.com', 'title': 'Republic World'}"
2021-04-07 07:00:00+00:00,Google Chrome Will Remember Tab Groups and Webpages Under ... - Digital Information World,"{'href': 'https://www.digitalinformationworld.com', 'title': 'Digital Information World'}"
2021-04-12 07:00:00+00:00,GM Announces Killer Google Maps Alternative With Traffic Alerts ... - autoevolution,"{'href': 'https://www.autoevolution.com', 'title': 'autoevolution'}"
2021-04-01 07:00:00+00:00,Google's AI reservation service Duplex is now available in 49 states - The Verge,"{'href': 'https://www.theverge.com', 'title': 'The Verge'}"
2021-04-03 07:00:00+00:00,Google Shutdown Inbox 2 Years Ago and I Still Miss It - Droid Life,"{'href': 'https://www.droid-life.com', 'title': 'Droid Life'}"
2021-04-15 07:00:00+00:00,USGS Landsat Satellites Enable Google to Portray Global Change ... - United States Geological Survey (.gov),"{'href': 'https://www.usgs.gov', 'title': 'United States Geological Survey (.gov)'}"
2021-04-15 07:00:00+00:00,Google Earth's new Timelapse feature shows chilling effect of climate change - CNN,"{'href': 'https://www.cnn.com', 'title': 'CNN'}"
2021-04-15 07:00:00+00:00,Google Earth invites you to look through our planet's past — get ... - Android Police,"{'href': 'https://www.androidpolice.com', 'title': 'Android Police'}"
2021-04-27 07:00:00+00:00,Google advertising boom lifts profits to record - Financial Times,"{'href': 'https://www.ft.com', 'title': 'Financial Times'}"
2021-04-28 07:00:00+00:00,"Analysis: For Google, plenty of cash with nowhere to go - Reuters","{'href': 'https://www.reuters.com', 'title': 'Reuters'}"
2021-04-28 07:00:00+00:00,Google is saving $1 billion per year as a result of employees ... - Los Angeles Times,"{'href': 'https://www.latimes.com', 'title': 'Los Angeles Times'}"
2021-04-19 07:00:00+00:00,"Google, Apple executives to testify in app store hearing on Wednesday - Reuters","{'href': 'https://www.reuters.com', 'title': 'Reuters'}"
2021-04-16 07:00:00+00:00,Australia finds Google misled users over data collection - CNBC,"{'href': 'https://www.cnbc.com', 'title': 'CNBC'}"
2021-04-20 07:00:00+00:00,Daily Mail owner sues Google for monopoly over ad business - Reuters,"{'href': 'https://www.reuters.com', 'title': 'Reuters'}"
2021-04-21 07:00:00+00:00,U.S. senators question Apple and Google on app store dominance - Reuters,"{'href': 'https://www.reuters.com', 'title': 'Reuters'}"
2021-04-28 07:00:00+00:00,Google data case to be heard in Supreme Court - BBC,"{'href': 'https://www.bbc.com', 'title': 'BBC'}"
2021-04-26 07:00:00+00:00,Roku says it may lose YouTube TV app after Google made anti ... - Axios,"{'href': 'https://www.axios.com', 'title': 'Axios'}"
2021-04-26 07:00:00+00:00,Facebook and Google failing to crack down on scam ads - Business Insider,"{'href': 'https://www.businessinsider.com', 'title': 'Business Insider'}"
2021-04-21 07:00:00+00:00,Google Meet Promises No More Gloomy Faces - Forbes,"{'href': 'https://www.forbes.com', 'title': 'Forbes'}"
2021-04-21 07:00:00+00:00,Google Ads Recommendations: What You Need to Know - Search Engine Journal,"{'href': 'https://www.searchenginejournal.com', 'title': 'Search Engine Journal'}"
2021-04-17 07:00:00+00:00,Google Earth Now Shows You The Consequences of Climate ... - ScienceAlert,"{'href': 'https://www.sciencealert.com', 'title': 'ScienceAlert'}"
2021-04-16 07:00:00+00:00,"Firefox, Edge, Safari, and other browsers won’t use Google’s new ... - The Verge","{'href': 'https://www.theverge.com', 'title': 'The Verge'}"
2021-04-26 07:00:00+00:00,Google Argentina's domain name bought by man for £2 - BBC,"{'href': 'https://www.bbc.com', 'title': 'BBC'}"
2021-04-26 07:00:00+00:00,Google and Microsoft's Indian-born CEOs pledge support to the country over coronavirus crisis - CNN,"{'href': 'https://www.cnn.com', 'title': 'CNN'}"
2021-04-29 07:00:00+00:00,"Blocking Google class action would deny justice, UK court told - Reuters","{'href': 'https://www.reuters.com', 'title': 'Reuters'}"
2021-04-29 07:00:00+00:00,You can now teach the Google Assistant how to pronounce names - Ars Technica,"{'href': 'https://arstechnica.com', 'title': 'Ars Technica'}"
2021-04-28 07:00:00+00:00,Google announces additional travel advisory notices in search and ... - Search Engine Land,"{'href': 'https://searchengineland.com', 'title': 'Search Engine Land'}"
2021-04-19 07:00:00+00:00,How to Export Your Facebook Posts to Google Drive - Lifehacker,"{'href': 'https://lifehacker.com', 'title': 'Lifehacker'}"
2021-04-20 07:00:00+00:00,Google Photos finally lets you add photos and videos to an album ... - Android Police,"{'href': 'https://www.androidpolice.com', 'title': 'Android Police'}"
2021-04-28 07:00:00+00:00,Google expands its Android-based earthquake detection system - The Verge,"{'href': 'https://www.theverge.com', 'title': 'The Verge'}"
2021-04-20 07:00:00+00:00,"Everybody hates “FLoC,” Google’s tracking plan for Chrome ads - Ars Technica","{'href': 'https://arstechnica.com', 'title': 'Ars Technica'}"
2021-04-26 07:00:00+00:00,Univision Partners With Google to Transform Its Business and ... - PR Newswire,"{'href': 'https://www.prnewswire.com', 'title': 'PR Newswire'}"
2021-04-21 07:00:00+00:00,Google responds to last month's WebView nightmare on Android - Engadget,"{'href': 'https://www.engadget.com', 'title': 'Engadget'}"
2021-04-26 07:00:00+00:00,Google Assistant could say goodbye to 'Hey Google' for short ... - Tom's Guide,"{'href': 'https://www.tomsguide.com', 'title': ""Tom's Guide""}"
2021-04-26 07:00:00+00:00,When Do Third-Party Cookies End? Apple (AAPL) Google (GOOG ... - Bloomberg,"{'href': 'https://www.bloomberg.com', 'title': 'Bloomberg'}"
2021-04-23 07:00:00+00:00,Papa John's and Google Cloud Strengthen Innovative Partnership to ... - PR Newswire,"{'href': 'https://www.prnewswire.com', 'title': 'PR Newswire'}"
2021-04-20 07:00:00+00:00,Ditch Google for good with these apps and gadgets - Popular Science,"{'href': 'https://www.popsci.com', 'title': 'Popular Science'}"
2021-04-22 07:00:00+00:00,Google Pixel 5 vs 4a 5G vs 4a: which should you buy? - Radio Times,"{'href': 'https://www.radiotimes.com', 'title': 'Radio Times'}"
2021-04-16 07:00:00+00:00,How to remove Google account from Chrome: Step-by-step guide - India Today,"{'href': 'https://www.indiatoday.in', 'title': 'India Today'}"
2021-04-19 07:00:00+00:00,Google Postpones Page Experience Algorithm Update to Mid-June - Search Engine Journal,"{'href': 'https://www.searchenginejournal.com', 'title': 'Search Engine Journal'}"
2021-04-17 07:00:00+00:00,How to make Google Nest devices play music through Bluetooth - Pocket-lint,"{'href': 'https://www.pocket-lint.com', 'title': 'Pocket-lint'}"
2021-04-19 07:00:00+00:00,Google Photos is making it easier to find your documents - Android Police,"{'href': 'https://www.androidpolice.com', 'title': 'Android Police'}"
2021-04-21 07:00:00+00:00,"Amazon, Apple, Facebook, and Google became big tech companies ... - The Washington Post","{'href': 'https://www.washingtonpost.com', 'title': 'The Washington Post'}"
2021-04-27 07:00:00+00:00,How to Make Microsoft Edge or Google Chrome Always Open in ... - groovyPost,"{'href': 'https://www.groovypost.com', 'title': 'groovyPost'}"
2021-04-15 07:00:00+00:00,Google Docs acting weird? Turn off your adblocker - TNW,"{'href': 'https://thenextweb.com', 'title': 'TNW'}"
2021-04-25 07:00:00+00:00,Powerful Google ad about grandparents who are deaf makes Oscars viewers emotional - TODAY,"{'href': 'https://www.today.com', 'title': 'TODAY'}"
2021-04-27 07:00:00+00:00,Pichai teases 'significant' announcements at Google I/O 2021 as ... - 9to5Google,"{'href': 'https://9to5google.com', 'title': '9to5Google'}"
2021-04-25 07:00:00+00:00,Google officially dropped Q&A on Google in search results - Search Engine Land,"{'href': 'https://searchengineland.com', 'title': 'Search Engine Land'}"
2021-04-19 07:00:00+00:00,"Google Cloud, Siemens Boosting AI Processes for Manufacturing in ... - EnterpriseAI","{'href': 'https://www.enterpriseai.news', 'title': 'EnterpriseAI'}"
2021-04-22 07:00:00+00:00,4chan founder Chris Poole has left Google - CNBC,"{'href': 'https://www.cnbc.com', 'title': 'CNBC'}"
2021-04-15 07:00:00+00:00,Google Ads Tracking Updates; Here's What Advertisers Need to Know - Search Engine Journal,"{'href': 'https://www.searchenginejournal.com', 'title': 'Search Engine Journal'}"
2021-04-22 07:00:00+00:00,Earth Day 2021: Google Doodle honors environmentally conscious ... - USA TODAY,"{'href': 'https://www.usatoday.com', 'title': 'USA TODAY'}"
2021-04-21 07:00:00+00:00,Google fixes exploited Chrome zero-day dropped on Twitter last week - BleepingComputer,"{'href': 'https://www.bleepingcomputer.com', 'title': 'BleepingComputer'}"
2021-04-27 07:00:00+00:00,The mystery of Google's missed Pixel opportunity - Computerworld,"{'href': 'https://www.computerworld.com', 'title': 'Computerworld'}"
2021-04-23 07:00:00+00:00,How to reduce data usage on Google Meet video calls - TNW,"{'href': 'https://thenextweb.com', 'title': 'TNW'}"
2021-04-28 07:00:00+00:00,Girl Scout cookies being delivering by Google Wing drones in Virginia - USA TODAY,"{'href': 'https://www.usatoday.com', 'title': 'USA TODAY'}"
2021-04-23 07:00:00+00:00,How to change your Google profile photo from the Contacts app - Android Central,"{'href': 'https://www.androidcentral.com', 'title': 'Android Central'}"
2021-04-20 07:00:00+00:00,Google honors Luther Vandross with doodle on his 70th birthday - USA TODAY,"{'href': 'https://www.usatoday.com', 'title': 'USA TODAY'}"
2021-04-21 07:00:00+00:00,"Google, AWS win $1.2 billion Israel tender for cloud services - The Times of Israel","{'href': 'https://www.timesofisrael.com', 'title': 'The Times of Israel'}"
2021-04-28 07:00:00+00:00,"Google Stadia is adding a search bar, teases more features coming ... - XDA Developers","{'href': 'https://www.xda-developers.com', 'title': 'XDA Developers'}"
2021-04-23 07:00:00+00:00,Does Andy Warhol Get Same Copyright Treatment as Google Code? - Hollywood Reporter,"{'href': 'https://www.hollywoodreporter.com', 'title': 'Hollywood Reporter'}"
2021-04-21 07:00:00+00:00,Google Search Console: How Accurate is the Average Position ... - Search Engine Journal,"{'href': 'https://www.searchenginejournal.com', 'title': 'Search Engine Journal'}"
2021-04-26 07:00:00+00:00,Google develops custom 'Argos' video-transcoding chips for ... - DatacenterDynamics,"{'href': 'https://www.datacenterdynamics.com', 'title': 'DatacenterDynamics'}"
2021-04-27 07:00:00+00:00,"Regulation may be needed for Apple, Google app stores if changes ... - Reuters","{'href': 'https://www.reuters.com', 'title': 'Reuters'}"
2021-04-15 07:00:00+00:00,2 big questions to ask about Google and privacy - Computerworld,"{'href': 'https://www.computerworld.com', 'title': 'Computerworld'}"
2021-04-23 07:00:00+00:00,Daily Mail Lawsuit Links Google Algorithm Updates to Advertising ... - Search Engine Journal,"{'href': 'https://www.searchenginejournal.com', 'title': 'Search Engine Journal'}"
2021-04-23 07:00:00+00:00,How to Change Your YouTube Channel's Name Without Messing ... - Lifehacker,"{'href': 'https://lifehacker.com', 'title': 'Lifehacker'}"
2021-04-17 07:00:00+00:00,Google used 'double-Irish' to shift $75.4bn in profits out of Ireland - The Irish Times,"{'href': 'https://www.irishtimes.com', 'title': 'The Irish Times'}"
2021-04-21 07:00:00+00:00,Google Turmoil Exposes Cracks Long in Making for Top AI Watchdog - Bloomberg,"{'href': 'https://www.bloomberg.com', 'title': 'Bloomberg'}"
2021-04-15 07:00:00+00:00,Google Calendar app broken (blank/empty) for some Android & web ... - PiunikaWeb,"{'href': 'https://piunikaweb.com', 'title': 'PiunikaWeb'}"
2021-04-27 07:00:00+00:00,"Ex-Google employee: Big Tech's biz model is 'a society that is addicted, outraged, polarized' - Fox Business","{'href': 'https://www.foxbusiness.com', 'title': 'Fox Business'}"
